president,speech_label,matched_title,document_date,document_type,block_idx,block_size,sentence_start,sentence_end,text,n_sentences,n_words,care_p,fairness_p,loyalty_p,authority_p,sanctity_p,care_sent,fairness_sent,loyalty_sent,authority_sent,sanctity_sent,moral_nonmoral_ratio,f_var,sent_var,moral_vector_R5,cosine_gonye,cosine_pergel,cosine_yasa,cosine_gpy_sum_vector,delta_vector_discriminant
Millard Fillmore,Second Annual Message,Second Annual Message,1851-12-02,Written,13,5,65,69,"I think the legislation of the country is deficient in not providing sufficiently either for the protection or the punishment of consuls. I therefore recommend the subject to the consideration of Congress.Your attention is again invited to the question of reciprocal trade between the United States and Canada and other British possessions near our frontier. Overtures for a convention upon this subject have been received from Her Britannic Majesty's minister plenipotentiary, but it seems to be in many respects preferable that the matter should be regulated by reciprocal legislation. Documents are laid before you showing the terms which the British Government is willing to offer and the measures which it may adopt if some arrangement upon this subject shall not be made.From the accompanying copy of a note from the British legation at Washington and the reply of the Department of State thereto it will appear that Her Britannic Majesty's Government is desirous that a part of the boundary line between Oregon and the British possessions should be authoritatively marked out, and that an intention was expressed to apply to Congress for an appropriation to defray the expense thereof on the part of the United States. Your attention to this subject is accordingly invited and a proper appropriation recommended.",5,209,0.096567256916039,0.11615698698436443,0.09448027076572277,0.10350253040553087,0.06634332593197201,-0.06748967932610518,-0.009035055163122576,0.032553620942231305,0.007745213871939666,0.012090843012749578,0.9782608695652174,0.0003357504246655151,0.0014464759761135362,"[0.096567256916039, 0.11615698698436443, 0.09448027076572277, 0.10350253040553087, 0.06634332593197201]",0.8025139106708019,0.8598577101919043,0.7438967972337851,0.9798862805317373,0.002634126936378954
Millard Fillmore,Second Annual Message,Second Annual Message,1851-12-02,Written,14,5,70,74,"A convention for the adjustment of claims of citizens of the United States against Portugal has been concluded and the ratifications have been exchanged. The first installment of the amount to be paid by Portugal fell due on the 30th of September last and has been paid. The President of the French Republic, according to the provisions of the convention, has been selected as arbiter in the case of the General Armstrong, and has signified that he accepts the trust and the high satisfaction he feels in acting as the common friend of two nations with which France is united by sentiments of sincere and lasting amity.The Turkish Government has expressed its thanks for the kind reception given to the Sultan's agent, Amin Bey, on the occasion of his recent visit to the United States. On the 28th of February last a dispatch was addressed by the Secretary of State to Mr. Marsh, the American minister at Constantinople, instructing him to ask of the Turkish Government permission for the Hungarians then imprisoned within the dominions of the Sublime Porte to remove to this country. On the 3d of March last both Houses of Congress passed a resolution requesting the President to authorize the employment of a public vessel to convey to this country Louis Kossuth and his associates in captivity.",5,220,0.08455851900502981,0.0878334491309211,0.08500425871231272,0.09428692142354528,0.06729026112422794,-0.0056837488365127885,0.004137379040976818,0.009914161217483099,0.045249264238184254,0.04367292205903846,1.0416666666666667,0.00010021028982416229,0.000552366395291019,"[0.08455851900502981, 0.0878334491309211, 0.08500425871231272, 0.09428692142354528, 0.06729026112422794]",0.772848280775411,0.8303358294327089,0.7857694421443692,0.9726984863057471,-0.00019393180937825327
Millard Fillmore,Second Annual Message,Second Annual Message,1851-12-02,Written,15,5,75,79,"The instruction above referred to was complied with, and the Turkish Government having released Governor Kossuth and his companions from prison, on the 10th of September last they embarked on board of the United States steam frigate Mississippi, which was selected to carry into effect the resolution of Congress. Governor Kossuth left the Mississippi at Gibraltar for the purpose of making a visit to England, and may shortly be expected in New York. By communications to the Department of State he has expressed his grateful acknowledgments for the interposition of this Government in behalf of himself and his associates. This country has been justly regarded as a safe asylum for those whom political events have exiled from their own homes in Europe. and it is recommended to Congress to consider in what manner Governor Kossuth and his companions, brought hither by its authority, shall be received and treated.It is earnestly to be hoped that the differences which have for some time past been pending between the Government of the French Republic and that of the Sandwich Islands may be peaceably and durably adjusted so as to secure the independence of those islands. Long before the events which have of late imparted so much importance to the possessions of the United States on the Pacific we acknowledged the independence of the Hawaiian Government.",5,222,0.09065872335122846,0.09975297723244583,0.09386911070018958,0.11207456570742214,0.07433327942461086,-0.0868275512161686,-0.010456377731140462,-0.005391765508766566,-0.03546414625738508,-0.003975299723964361,1.4146341463414633,0.00018941324571499862,0.0012278991675262342,"[0.09065872335122846, 0.09975297723244583, 0.09386911070018958, 0.11207456570742214, 0.07433327942461086]",0.7609225123378359,0.8451469141144988,0.7970526660134565,0.9785251517284848,0.0009127344237294527
Millard Fillmore,Second Annual Message,Second Annual Message,1851-12-02,Written,16,5,80,84,"This Government was first in taking that step, and several of the leading powers of Europe immediately followed. We were influenced in this measure by the existing and prospective importance of the islands as a place of refuge and refreshment for our vessels engaged in the whale fishery, and by the consideration that they lie in the course of the great trade which must at no distant day be carried on between the western coast of North America and eastern Asia.We were also influenced by a desire that those islands should not pass under the control of any other great maritime state, but should remain in an independent condition, and so be accessible and useful to the commerce of all nations. I need not say that the importance of these considerations has been greatly enhanced by the sudden and vast development which the interests of the United States have attained in California and Oregon, and the policy heretofore adopted in regard to those islands will be steadily pursued.It is gratifying, not only to those who consider the commercial interests of nations, but also to all who favor the progress of knowledge and the diffusion of religion, to see a community emerge from a savage state and attain such a degree of civilization in those distant seas. It is much to be deplored that the internal tranquillity of the Mexican Republic should again be seriously disturbed, for since the peace between that Republic and the United States it had enjoyed such comparative repose that the most favorable anticipations for the future might with a degree of confidence have been indulged. These, however, have been thwarted by the recent outbreak in the State of Tamaulipas, on the right bank of the Rio Bravo.",5,291,0.08745748030401634,0.09245457685233828,0.0843825402787268,0.09530874000872502,0.07105188906574993,-0.008085414872335585,0.060069635679161966,0.06511866572297745,0.06797818858561055,0.06603514470710066,1.3333333333333333,8.910369595654934e-05,0.0010709947445261324,"[0.08745748030401634, 0.09245457685233828, 0.0843825402787268, 0.09530874000872502, 0.07105188906574993]",0.7780010792257556,0.8337189926008577,0.7748224116470216,0.9717415427425624,0.00019776499588732704
Millard Fillmore,Second Annual Message,Second Annual Message,1851-12-02,Written,17,5,85,89,"Having received information that persons from the United States had taken part in the insurrection, and apprehending that their example might be followed by others, I caused orders to be issued for the purpose of preventing any hostile expeditions against Mexico from being set on foot in violation of the laws of the United States. I likewise issued a proclamation upon the subject, a copy of which is herewith laid before you. This appeared to be rendered imperative by the obligations of treaties and the general duties of good neighborhood.In my last annual message I informed Congress that citizens of the United States had undertaken the connection of the two oceans by means of a railroad across the Isthmus of Tehuantepec, under a grant of the Mexican Government to a citizen of that Republic, and that this enterprise would probably be prosecuted with energy whenever Mexico should consent to such stipulations with the Government of the United States as should impart a feeling of security to those who should invest their property in the enterprise. A convention between the two Governments for the accomplishment of that end has been ratified by this Government, and only awaits the decision of the Congress and the Executive of that Republic.Some unexpected difficulties and delays have arisen in the ratification of that convention by Mexico, but it is to be presumed that her decision will be governed by just and enlightened views, as well of the general importance of the object as of her own interests and obligations.In negotiating upon this important subject this Government has had in view one, and only one, object. That object has been, and is, the construction or attainment of a passage from ocean to ocean, the shortest and the best for travelers and merchandise, and equally open to all the world.",5,303,0.10779219731560578,0.118065941361412,0.09768048841698591,0.11931007688899514,0.08143527847354848,-0.05618653120074341,-0.021182153627836424,-0.013779502005399392,0.015490466081811044,0.034312316155990244,1.392156862745098,0.00024801557607166615,0.001217721419844555,"[0.10779219731560578, 0.118065941361412, 0.09768048841698591, 0.11931007688899514, 0.08143527847354848]",0.7910635258643864,0.850057468431292,0.7629597268433074,0.978942519824446,0.001788023948295421
Millard Fillmore,Second Annual Message,Second Annual Message,1851-12-02,Written,18,5,90,94,"It has sought to obtain no territorial acquisition, nor any advantages peculiar to itself; and it would see with the greatest regret that Mexico should oppose any obstacle to the accomplishment of an enterprise which promises so much convenience to the whole commercial world and such eminent advantages to Mexico herself. Impressed with these sentiments and these convictions, the Government will continue to exert all proper efforts to bring about the necessary arrangement with the Republic of Mexico for the speedy completion of the work. For some months past the Republic of Nicaragua has been the theater of one of those civil convulsions from which the cause of free institutions and the general prosperity and social progress of the States of Central America have so often and so severely suffered. Until quiet shall have been restored and a government apparently stable shall have been organized, no advance can prudently be made in disposing of the questions pending between the two countries.I am happy to announce that an interoceanic communication from the mouth of the St. John to the Pacific has been so far accomplished as that passengers have actually traversed it and merchandise has been transported over it, and when the canal shall have been completed according to the original plan the means of communication will be further improved. It is understood that a considerable part of the railroad across the Isthmus of Panama has been completed, and that the mail and passengers will in future be conveyed thereon.",5,249,0.10023116132160252,0.1209142195110068,0.10734852017386091,0.10793546157362821,0.07764661196744242,-0.0638321984179868,0.012343642822559025,0.02006645844376726,0.010952279930957374,0.01562911862224053,0.8571428571428571,0.00025361941427120947,0.001247278284872369,"[0.10023116132160252, 0.1209142195110068, 0.10734852017386091, 0.10793546157362821, 0.07764661196744242]",0.7841975113582398,0.8472231950367684,0.7573373922862708,0.9727182505242525,0.002056576744172249
Millard Fillmore,Second Annual Message,Second Annual Message,1851-12-02,Written,19,5,95,99,"Whichever of the several routes between the two oceans may ultimately prove most eligible for travelers to and from the different States on the Atlantic and Gulf of Mexico and our coast on the Pacific, there is little reason to doubt that all of them will be useful to the public, and will liberally reward that individual enterprise by which alone they have been or are expected to be carried into effect. Peace has been concluded between the contending parties in the island of St. Domingo, and, it is hoped, upon a durable basis. Such is the extent of our commercial relations with that island that the United States can not fail to feel a strong interest in its tranquillity. The office of commissioner to China remains unfilled. Several persons have been appointed, and the place has been offered to others, all of whom have declined its acceptance on the ground of the inadequacy of the compensation.",5,157,0.09164283021285297,0.0948212750624217,0.08508123896948254,0.08839302964463554,0.06745709662449058,-0.06624487136818642,0.047639305150648986,0.08731986321894124,0.04699050710473685,0.04843197763396825,1.7272727272727273,0.00011467742251848994,0.0033620581204740797,"[0.09164283021285297, 0.0948212750624217, 0.08508123896948254, 0.08839302964463554, 0.06745709662449058]",0.8011387513052151,0.8263830908453377,0.750566539820411,0.968273807179072,-0.00019145528761908837
Millard Fillmore,Second Annual Message,Second Annual Message,1851-12-02,Written,20,5,100,104,"The annual allowance by law is $6,000, and there is no provision for any outfit. I earnestly recommend the consideration of this subject to Congress. Our commerce with China is highly important, and is becoming more and more so in consequence of the increasing intercourse between our ports on the Pacific Coast and eastern Asia. China is understood to be a country in which living is very expensive, and I know of no reason why the American commissioner sent thither should not be placed, in regard to compensation, on an equal footing with ministers who represent this country at the Courts of Europe.By reference to the report of the Secretary of the Treasury it will be seen that the aggregate receipts for the last fiscal year amounted to $52,312,979.87, which, with the balance in the Treasury on the 1st July, 1850, gave as the available means for the year the sum of $58,917,524.36.The total expenditures for the same period were $48,005,878.68. The total imports for the year ending June 30, 1851, were $215,725,995, of which there were in specie $4,967,901.",5,180,0.10480715834331805,0.1203405604058283,0.10231084454555346,0.08999408903403565,0.07378617114790242,-0.04557021519991707,-0.014051616017171144,-0.03051070026403807,0.026024890404438377,-0.014049173957102845,0.925,0.00030352965150144077,0.0007144929797143689,"[0.10480715834331805, 0.1203405604058283, 0.10231084454555346, 0.08999408903403565, 0.07378617114790242]",0.8155916361566234,0.8289233178202708,0.7131921642249536,0.9600317832584792,0.001063619794171189
Millard Fillmore,Second Annual Message,Second Annual Message,1851-12-02,Written,21,5,105,109,"The exports for the same period were $217,517,130, of which there were of domestic products $178,546,555; foreign goods reexported, $9,738,695; specie, $29,231,880.Since the 1st of December last the payments in cash on account of the public debt, exclusive of interest, have amounted to $7,501,456.56, which, however, includes the sum of $3,242,400, paid under the twelfth article of the treaty with Mexico, and the further sum of $2,591,213.45, being the amount of awards to American citizens under the late treaty with Mexico, for which the issue of stock was authorized, but which was paid in cash from the Treasury.The public debt on the 20th ultimo, exclusive of the stock authorized to be issued to Texas by the act of 9th September, 1850, was $62,560,395.26.The receipts for the next fiscal year are estimated at $51,800,000, which, with the probable unappropriated balance in the Treasury on the 30th June next, will give as the probable available means for that year the sum of $63,258,743.09.It has been deemed proper, in view of the large expenditures consequent upon the acquisition of territory from Mexico, that the estimates for the next fiscal year should be laid before Congress in such manner as to distinguish the expenditures so required from the otherwise ordinary demands upon the Treasury.The total expenditures for the next fiscal year are estimated at $42,892,299.19, of which there is required for the ordinary purposes of the Government, other than those consequent upon the acquisition of our new territories, and deducting the payments on account of the public debt, the sum of $33,343,198.08, and for the purposes connected, directly or indirectly, with those territories and in the fulfillment of the obligations of the Government contracted in consequence of their acquisition the sum of $9,549,101.11.If the views of the Secretary of the Treasury in reference to the expenditures required for these territories shall be met by corresponding action on the part of Congress, and appropriations made in accordance therewith, there will be an estimated unappropriated balance in the Treasury on the 30th June, 1853, of $20,366,443.90 wherewith to meet that portion of the public debt due on the 1st of July following, amounting to $6,237,931.35, as well as any appropriations which may be made beyond the estimates.In thus referring to the estimated expenditures on account of our newly acquired territories, I may express the hope that Congress will concur with me in the desire that a liberal course of policy may be pursued toward them, and that every obligation, express or implied, entered into in consequence of their acquisition shall be fulfilled by the most liberal appropriations for that purpose.The values of our domestic exports for the last fiscal year, as compared with those of the previous year, exhibit an increase of $43,646,322. At first view this condition of our trade with foreign nations would seem to present the most flattering hopes of its future prosperity. An examination of the details of our exports, however, will show that the increased value of our exports for the last fiscal year is to be found in the high price of cotton which prevailed during the first half of that year, which price has since declined about one-half.The value of our exports of breadstuffs and provisions, which it was supposed the incentive of a low tariff and large importations from abroad would have greatly augmented, has fallen from $68,701,921 in 1847 to $26,051,373 in 1850 and to $21,948,653 in 1851, with a strong probability, amounting almost to a certainty, of a still further reduction in the current year.The aggregate values of rice exported during the last fiscal year, as compared with the previous year, also exhibit a decrease, amounting to $460,917, which, with a decline in the values of the exports of tobacco for the same period, make an aggregate decrease in these two articles of $1,156,751.The policy which dictated a low rate of duties on foreign merchandise, it was thought by those who promoted and established it, would tend to benefit the farming population of this country by increasing the demand and raising the price of agricultural products in foreign markets.The foregoing facts, however, seem to show incontestably that no such result has followed the adoption of this policy. On the contrary, notwithstanding the repeal of the restrictive corn laws in England, the foreign demand for the products of the American farmer has steadily declined, since the short crops and consequent famine in a portion of Europe have been happily replaced by full crops and comparative abundance of food.It will be seen by recurring to the commercial statistics for the past year that the value of our domestic exports has been increased in the single item of raw cotton by $40,000,000 over the value of that export for the year preceding. This is not due to any increased general demand for that article, but to the short crop of the preceding year, which created an increased demand and an augmented price for the crop of last year.",5,829,0.10674822948723646,0.1124782852740473,0.09849046949708128,0.09553733791834719,0.08100845256395717,-0.0855306448810129,-0.012073759484110675,-0.010649530461744319,0.005856722245687003,-0.02324037915450772,1.0804597701149425,0.0001443839907668455,0.0012480337270443498,"[0.10674822948723646, 0.1124782852740473, 0.09849046949708128, 0.09553733791834719, 0.08100845256395717]",0.805748318713574,0.8205350830545828,0.7334990128340128,0.9608233586024119,-0.00014974860958472808
Millard Fillmore,Second Annual Message,Second Annual Message,1851-12-02,Written,22,5,110,114,"Should the cotton crop now going forward to market be only equal in quantity to that of the year preceding and be sold at the present prices, then there would be a falling off in the value of our exports for the present fiscal year of at least $40,000,000 compared with the amount exported for the year ending 30th June, 1851.The production of gold in California for the past year seems to promise a large supply of that metal from that quarter for some time to come. This large annual increase of the currency of the world must be attended with its usual results. These have been already partially disclosed in the enhancement of prices and a rising spirit of speculation and adventure, tending to overtrading, as well at home as abroad. Unless some salutary check shall be given to these tendencies it is to be feared that importations of foreign goods beyond a healthy demand in this country will lead to a sudden drain of the precious metals from us, bringing with it, as it has done in former times, the most disastrous consequences to the business and capital of the American people.The exports of specie to liquidate our foreign debt during the past fiscal year have been $24,963,979 over the amount of specie imported. The exports of specie during the first quarter of the present fiscal year have been $14,651,827.",5,232,0.10402775496114908,0.10717665446141969,0.09318263287117046,0.09111992689463776,0.08471460599612915,-0.07667374844765283,0.008761773440003673,-0.002880150237062538,0.036762773718302784,-0.042948370546817646,1.0833333333333333,8.711635610716044e-05,0.001993719441297314,"[0.10402775496114908, 0.10717665446141969, 0.09318263287117046, 0.09111992689463776, 0.08471460599612915]",0.8001552043361606,0.8125045622099565,0.7317791456336894,0.9545602245278467,-0.0004588504045297953
