president,speech_label,matched_title,document_date,document_type,block_idx,block_size,sentence_start,sentence_end,text,n_sentences,n_words,care_p,fairness_p,loyalty_p,authority_p,sanctity_p,care_sent,fairness_sent,loyalty_sent,authority_sent,sanctity_sent,moral_nonmoral_ratio,f_var,sent_var,moral_vector_R5,cosine_gonye,cosine_pergel,cosine_yasa,cosine_gpy_sum_vector,delta_vector_discriminant
Millard Fillmore,Second Annual Message,Second Annual Message,1851-12-02,Written,33,5,165,169,"Our settlements are now extending to the sources of the great rivers which empty into and form a part of the Mississippi, and the value of the public lands in those regions would be greatly enhanced by freeing the navigation of those waters from obstructions. In view, therefore, of this great interest, I deem it my duty again to urge upon Congress to make such appropriations for these improvements as they may deem necessary.The surveys of the Delta of the Mississippi, with a view to the prevention of the overflows that have proved so disastrous to that region of country, have been nearly completed, and the reports thereof are now in course of preparation and will shortly be laid before you.The protection of our southwestern frontier and of the adjacent Mexican States against the Indian tribes within our border has claimed my earnest and constant attention. Congress having failed at the last session to adopt my recommendation that an additional regiment of mounted men specially adapted to that service should be raised, all that remained to be done was to make the best use of the means at my disposal. Accordingly, all the troops adapted to that service that could properly be spared from other quarters have been concentrated on that frontier and officers of high reputation selected to command them. A new arrangement of the military posts has also been made, whereby the troops are brought nearer to the Mexican frontier and to the tribes they are intended to overawe.Sufficient time has not yet elapsed to realize all the benefits that are expected to result from these arrangements, but I have every reason to hope that they will effectually check their marauding expeditions.",5,284,0.10069669690816917,0.10036400765293686,0.09359253825136395,0.09197063897270864,0.08059491806816316,-0.06600445158174596,-0.02855828170102428,0.014475526403160872,-0.014647686297762329,-0.0074075328208179966,1.0714285714285714,6.694497022257906e-05,0.0008911287913951828,"[0.10069669690816917, 0.10036400765293686, 0.09359253825136395, 0.09197063897270864, 0.08059491806816316]",0.7936509724378544,0.8093184664729982,0.7490559344951296,0.9576150054054812,-0.00111068804197351
Millard Fillmore,Second Annual Message,Second Annual Message,1851-12-02,Written,34,5,170,174,"The nature of the country, which furnishes little for the support of an army and abounds in places of refuge and concealment, is remarkably well adapted to this predatory warfare, and we can scarcely hope that any military force, combined with the greatest vigilance, can entirely suppress it.By the treaty of Guadalupe Hidalgo we are bound to protect the territory of Mexico against the incursions of the savage tribes within our border ""with equal diligence and energy"" as if the same were made within our territory or against our citizens. I have endeavored to comply as far as possible with this provision of the treaty. Orders have been given to the officers commanding on that frontier to consider the Mexican territory and its inhabitants as equally with our own entitled to their protection, and to make all their plans and arrangements with a view to the attainment of this object. Instructions have also been given to the Indian commissioners and agents among these tribes in all treaties to make the clauses designed for the protection of our own citizens apply also to those of Mexico. I have no reason to doubt that these instructions have been fully carried into effect; nevertheless, it is probable that in spite of all our efforts some of the neighboring States of Mexico may have suffered, as our own have, from depredations by the Indians.To the difficulties of defending our own territory, as above mentioned, are superadded, in defending that of Mexico, those that arise from its remoteness, from the fact that we have no right to station our troops within her limits and that there is no efficient military force on the Mexican side to cooperate with our own.So long as this shall continue to be the case the number and activity of our troops will rather increase than diminish the evil, as the Indians will naturally turn toward that country where they encounter the least resistance.",5,323,0.1133207079238183,0.12140847971805191,0.10837333258109656,0.12018008574537994,0.0917923919717901,-0.07740697830018922,-0.058246190982506434,-0.063326434191711,-0.03090575907937792,-0.04639239541024952,1.5,0.00014345664313949417,0.0003090591770051234,"[0.1133207079238183, 0.12140847971805191, 0.10837333258109656, 0.12018008574537994, 0.0917923919717901]",0.7827468439708144,0.8342886219236996,0.766580181358412,0.9705591748293138,0.0005850030938118062
Millard Fillmore,Second Annual Message,Second Annual Message,1851-12-02,Written,35,5,175,179,"Yet these troops are necessary to subdue them and to compel them to make and observe treaties. Until this shall have been done neither country will enjoy any security from their attacks.The Indians in California, who had previously appeared of a peaceable character and disposed to cultivate the friendship of the whites, have recently committed several acts of hostility. As a large portion of the reenforcements sent to the Mexican frontier were drawn from the Pacific, the military force now stationed there is considered entirely inadequate to its defense. It can not be increased, however, without an increase of the Army, and I again recommend that measure as indispensable to the protection of the frontier.I invite your attention to the suggestions on this subject and on others connected with his Department in the report of the Secretary of War. The appropriations for the support of the Army during the current fiscal year ending 30th June next were reduced far below the estimate submitted by the Department.",5,166,0.11238540071171169,0.10023686511466248,0.09878174289739848,0.09565755958298257,0.07413652426250944,-0.10734986935141771,-0.03412758427797189,-0.03171431578347072,-0.05594619847950278,-0.040900597224676996,1.9166666666666667,0.00019300305690814318,0.000978288732894855,"[0.11238540071171169, 0.10023686511466248, 0.09878174289739848, 0.09565755958298257, 0.07413652426250944]",0.8165306996074163,0.7965388752399772,0.7444230766383594,0.9597553404490711,-0.0028762618113306222
Millard Fillmore,Second Annual Message,Second Annual Message,1851-12-02,Written,36,5,180,184,"The consequence of this reduction is a considerable deficiency, to which I invite your early attention. The expenditures of that Department for the year ending 30th June last were $9,060,268.58, The estimates for the year commencing 1st July next and ending June 30, 1853, are $7,898,775.83, showing a reductions of $1,161,492.75, The board of commissioners to whom the management of the affairs of the military asylum created by the act of 3d March last was intrusted have selected a site for the establishment of an asylum in the vicinity of this city, which has been approved by me subject to the production of a satisfactory title.The report of the Secretary of the Navy will exhibit the condition of the public service under the supervision of that Department. Our naval force afloat during the present year has been actively and usefully employed in giving protection to our widely extended and increasing commerce and interests in the various quarters of the globe, and our flag has everywhere afforded the security and received the respect inspired by the justice and liberality of our intercourse and the dignity and power of the nation.The expedition commanded by Lieutenant De Haven, dispatched in search of the British commander Sir John Franklin and his companions in the Arctic Seas, returned to New York in the month of October, after having undergone great peril and suffering from an unknown and dangerous navigation and the rigors of a northern climate, without any satisfactory information of the objects of their search, but with new contributions to science and navigation from the unfrequented polar regions. The officers and men of the expedition having been all volunteers for this service and having so conducted it as to meet the entire approbation of the Government, it is suggested, as an act of grace and generosity, that the same allowance of extra pay and emoluments be extended to them that were made to the officers and men of like rating in the late exploring expedition to the South Seas.I earnestly recommend to your attention the necessity of reorganizing the naval establishment, apportioning and fixing the number of officers in each grade, providing some mode of promotion to the higher grades of the Navy having reference to merit and capacity rather than seniority or date of entry into the service, and for retiring from the effective list upon reduced pay those who may be incompetent to the performance of active duty. As a measure of economy, as well as of efficiency, in this arm of the service, the provision last mentioned is eminently worthy of your consideration.The determination of the questions of relative rank between the sea officers and civil officers of the Navy, and between officers of the Army and Navy, in the various grades of each, will also merit your attention.",5,468,0.10210822990472689,0.10535199664173553,0.0961327178938661,0.10791704270794585,0.08166241676260538,-0.07041224347677652,-0.014361268159797418,0.01934774238746591,-0.022510007819280208,-0.027119103848966916,1.2473118279569892,0.00010941692070733425,0.0010332715777739917,"[0.10210822990472689, 0.10535199664173553, 0.0961327178938661, 0.10791704270794585, 0.08166241676260538]",0.7827571809247424,0.8295491426736139,0.7707897314367221,0.9703209308276717,-0.00011089905855276444
Millard Fillmore,Second Annual Message,Second Annual Message,1851-12-02,Written,37,5,185,189,"The failure to provide any substitute when corporal punishment was abolished for offenses in the Navy has occasioned the convening of numerous courts-martial upon the arrival of vessels in port, and is believed to have had an injurious effect upon the discipline and efficiency of the service. To moderate punishment from one grade to another is among the humane reforms of the age, but to abolish one of severity, which applied so generally to offenses on shipboard, and provide nothing in its stead is to suppose a progress of improvement in every individual among seamen which is not assumed by the Legislature in respect to any other class of men. It is hoped that Congress, in the ample opportunity afforded by the present session, will thoroughly investigate this important subject, and establish such modes of determining guilt and such gradations of punishment as are consistent with humanity and the personal rights of individuals, and at the same time shall insure the most energetic and efficient performance of duty and the suppression of crime in our ships of war.The stone dock in the navy-yard at New York, which was ten years in process of construction, has been so far finished as to be surrendered up to the authorities of the yard. The dry dock at Philadelphia is reported as completed, and is expected soon to be tested and delivered over to the agents of the Government. That at Portsmouth, N.",5,239,0.1214160560930464,0.1259163498066197,0.10882654791824865,0.12014458751950934,0.08643422401084336,-0.09889338431695906,-0.09234183490162264,-0.08942730509027097,-0.05394498888910925,-0.040506159759710926,1.0784313725490196,0.00025271045959325577,0.0006782290267837146,"[0.1214160560930464, 0.1259163498066197, 0.10882654791824865, 0.12014458751950934, 0.08643422401084336]",0.8051917488856348,0.8339431536647676,0.7501710796651196,0.9728626566362671,0.0002741070382202837
Millard Fillmore,Second Annual Message,Second Annual Message,1851-12-02,Written,38,5,190,194,"H., is also nearly ready for delivery; and a contract has been concluded, agreeably to the act of Congress at its last session, for a floating sectional dock on the Bay of San Francisco. I invite your attention to the recommendation of the Department touching the establishment of a navy-yard in conjunction with this dock on the Pacific. Such a station is highly necessary to the convenience and effectiveness of our fleet in that ocean, which must be expected to increase with the growth of commerce and the rapid extension of our whale fisheries over its waters.The Naval Academy at Annapolis, under a revised and improved system of regulations, now affords opportunities of education and instruction to the pupils quite equal, it is believed, for professional improvement, to those enjoyed by the cadets in the Military Academy. A large class of acting midshipmen was received at the commencement of the last academic term, and a practice ship has been attached to the institution to afford the amplest means for regular instruction in seamanship, as well as for cruises during the vacations of three or four months in each year.The advantages of science in nautical affairs have rarely been more strikingly illustrated than in the fact, stated in the report of the Navy Department, that by means of the wind and current charts projected and prepared by Lieutenant Maury, the Superintendent of the Naval Observatory, the passage from the Atlantic to the Pacific ports of our country has been shortened by about forty days.The estimates for the support of the Navy and Marine Corps the ensuing fiscal year will be found to be $5,856,472.19, the estimates for the current year being $5,900,621.The estimates for special objects under the control of this Department amount to $2,684,220.89, against $2,210,980 for the present year, the increase being occasioned by the additional mail service on the Pacific Coast and the construction of the dock in California, authorized at the last session of Congress, and some slight additions under the head of improvements and repairs in navy-yards, buildings, and machinery. I deem it of much importance to a just economy and a correct understanding of naval expenditures that there should be an entire separation of the appropriations for the support of the naval service proper from those for permanent improvements at navy-yards and stations and from ocean steam mail service and other special objects assigned to the supervision of this Department.The report of the Postmaster-General, herewith communicated, presents an interesting view of the progress, operations, and condition of his Department.At the close of the last fiscal year the length of mail routes within the United States was 196,290 miles, the annual transportation thereon 53,272,252 miles, and the annual cost of such transportation $3,421,754.The length of the foreign mail routes is estimated at 18,349 miles and the annual transportation thereon at 615,206 miles.",5,476,0.09198416532767673,0.09459282085343435,0.08611919604096915,0.09671276507132015,0.0788824783425994,-0.0488372980383055,0.033250520637492176,0.016428055504288445,-0.007757831811825363,0.03048591103768314,0.7596899224806202,5.204205306044221e-05,0.0011597579038082743,"[0.09198416532767673, 0.09459282085343435, 0.08611919604096915, 0.09671276507132015, 0.0788824783425994]",0.7755571455411587,0.8245683055687704,0.7708195539339695,0.9653689857894484,-0.00016864416849948077
Millard Fillmore,Second Annual Message,Second Annual Message,1851-12-02,Written,39,5,195,199,"The annual cost of this service is $1,472,187, of which $448,937 are paid by the Post-Office Department and $1,023,250 are paid through the Navy Department.The annual transportation within the United States, excluding the service in California and Oregon, which is now for the first time reported and embraced in the tabular statements of the Department, exceeds that of the preceding year 6,162,855 miles, at an increased cost of $547,110.The whole number of post-offices in the United States on the 30th day of June last was 19,796. There were 1,698 post-offices established and 256 discontinued during the year.The gross revenues of the Department for the fiscal year, including the appropriations for the franked matter of Congress, of the Departments, and officers of Government, and excluding the foreign postages collected for and payable to the British post-office, amounted to $6,727,866.78.The expenditures for the same period, excluding $20,599.49, paid under an award of the Auditor, in pursuance of a resolution of the last Congress, for mail service on the Ohio and Mississippi rivers in 1832 and 1833, and the amount paid to the British post-office for foreign postages collected for and payable to that office, amounted to $6,024,566.79, leaving a balance of revenue over the proper expenditures of the year of $703,299.99.The receipts for postages during the year, excluding the foreign postages collected for and payable to the British post-office, amounted to $6,345,747.21, being an increase of $997,610.79, or 18.65 per cent, over the like receipts for the preceding year.The reduction of postage under the act of March last did not take effect until the commencement of the present fiscal year. The accounts for the first quarter under the operation of the reduced rates will not be settled before January next, and no reliable estimate of the receipts for the present year can yet be made. It is believed, however, that they will fall far short of those of the last year. The surplus of the revenues now on hand is, however, so large that no further appropriation from the Treasury in aid of the revenues of the Department is required for the current fiscal year, but an additional appropriation for the year ending June 30, 1853, will probably be found necessary when the receipts of the first two quarters of the fiscal year are fully ascertained.In his last annual report the Postmaster-General recommended a reduction of postage to rates which he deemed as low as could be prudently adopted unless Congress was prepared to appropriate from the Treasury for the support of the Department a sum more than equivalent to the mail services performed by it for the Government.",5,437,0.08283338591401021,0.09106729658281502,0.07795823515622313,0.08325511428730362,0.06651921505243218,-0.13494120865902245,-0.027775805437586357,-0.048423723591628394,-0.039300036842757874,-0.05107607536383286,0.8785046728971962,8.161894143626886e-05,0.001824064596214234,"[0.08283338591401021, 0.09106729658281502, 0.07795823515622313, 0.08325511428730362, 0.06651921505243218]",0.7917478487794107,0.8351620802617987,0.7501394508507828,0.9679041869387082,0.0005821496704329458
Millard Fillmore,Second Annual Message,Second Annual Message,1851-12-02,Written,40,5,200,204,"The recommendations of the Postmaster-General in respect to letter postage, except on letters from and to California and Oregon, were substantially adopted by the last Congress. He now recommends adherence to the present letter rates and advises against a further reduction until justified by the revenue of the Department.He also recommends that the rates of postage on printed matter be so revised as to render them more simple and more uniform in their operation upon all classes of printed matter. I submit the recommendations of the report to your favorable consideration.The public statutes of the United States have now been accumulating for more than sixty years, and, interspersed with private acts, are scattered through numerous volumes, and, from the cost of the whole, have become almost inaccessible to the great mass of the community. They also exhibit much of the incongruity and imperfection of hasty legislation. As it seems to be generally conceded that there is no ""common law"" of the United States to supply the defects of their legislation, it is most important that that legislation should be as perfect as possible, defining every power intended to be conferred, every crime intended to be made punishable, and prescribing the punishment to be inflicted.",5,204,0.10086064564042395,0.10278553291766658,0.08383092549170053,0.09876889783695977,0.08078135884061174,-0.10117635920288631,-0.07062412662275958,0.02437176237614343,-0.0002236795541217179,-0.009925828307293036,1.1794871794871795,0.00010584291685930124,0.0027376995069029156,"[0.10086064564042395, 0.10278553291766658, 0.08383092549170053, 0.09876889783695977, 0.08078135884061174]",0.7981060612344485,0.8290234865523358,0.7455881795184289,0.9661134355988675,0.00027955003897250225
Millard Fillmore,Second Annual Message,Second Annual Message,1851-12-02,Written,41,5,205,209,"In addition to some particular cases spoken of more at length, the whole criminal code is now lamentably defective. Some offenses are imperfectly described and others are entirely omitted, so that flagrant crimes may be committed with impunity. The scale of punishment is not in all cases graduated according to the degree and nature of the offense, and is often rendered more unequal by the different modes of imprisonment or penitentiary confinement in the different States.Many laws of a permanent character have been introduced into appropriation bills, and it is often difficult to determine whether the particular clause expires with the temporary act of which it is a part or continues in force. It has also frequently happened that enactments and provisions of law have been introduced into bills with the title or general subject of which they have little or no connection or relation. In this mode of legislation so many enactments have been heaped upon each other, and often with but little consideration, that in many instances it is difficult to search out and determine what is the law.The Government of the United States is emphatically a government of written laws.",5,193,0.1004298942164962,0.11543846833308427,0.09250564119336105,0.09449205305437419,0.08013426289305542,-0.16835913777020264,-0.14333281448069668,-0.1331862086561245,-0.08264013477184796,-0.0863050142652609,2.6818181818181817,0.00016547092291595408,0.0013874493375396362,"[0.1004298942164962, 0.11543846833308427, 0.09250564119336105, 0.09449205305437419, 0.08013426289305542]",0.8023583303512182,0.8379296055938588,0.7266226909126091,0.9638129865621845,0.0016551494260310662
Millard Fillmore,Second Annual Message,Second Annual Message,1851-12-02,Written,42,5,210,214,"The statutes should therefore, as far as practicable, not only be made accessible to all, but be expressed in language so plain and simple as to be understood by all and arranged in such method as to give perspicuity to every subject. Many of the States have revised their public acts with great and manifest benefit, and I recommend that provision be made by law for the appointment of a commission to revise the public statutes of the United States, arranging them in order, supplying deficiencies, correcting incongruities, simplifying their language, and reporting them to Congress for its action.An act of Congress approved 30th September, 1850, contained a provision for the extension of the Capitol according to such plan as might be approved by the President, and appropriated $100,000 to be expended under his direction by such architect as he should appoint to execute the same. On examining the various plans which had been submitted by different architects in pursuance of an advertisement by a committee of the Senate no one was found to be entirely satisfactory, and it was therefore deemed advisable to combine and adopt the advantages of several.The great object to be accomplished was to make such an addition as would afford ample and convenient halls for the deliberations of the two Houses of Congress, with sufficient accommodations for spectators and suitable apartments for the committees and officers of the two branches of the Legislature. It was also desirable not to mar the harmony and beauty of the present structure, which, as a specimen of architecture, is so universally admired. Keeping these objects in view, I concluded to make the addition by wings, detached from the present building, yet connected with it by corridors.",5,287,0.07853867920752224,0.10871623569024882,0.08825528576372214,0.09435130776696198,0.0739907844579509,-0.044315005820515875,-0.004659290583380905,0.02334663403345897,0.0642926996911115,-0.04464521821645287,0.8870967741935484,0.00018809334537275022,0.002162547070190475,"[0.07853867920752224, 0.10871623569024882, 0.08825528576372214, 0.09435130776696198, 0.0739907844579509]",0.7612328854344866,0.8645703867984209,0.757168120893472,0.970475242547814,0.0035303334802148575
