president,speech_label,matched_title,document_date,document_type,block_idx,block_size,sentence_start,sentence_end,text,n_sentences,n_words,care_p,fairness_p,loyalty_p,authority_p,sanctity_p,care_sent,fairness_sent,loyalty_sent,authority_sent,sanctity_sent,moral_nonmoral_ratio,f_var,sent_var,moral_vector_R5,cosine_gonye,cosine_pergel,cosine_yasa,cosine_gpy_sum_vector,delta_vector_discriminant
Gerald R. Ford,1976 State of the Union,19  - Address Before a Joint Session of the Congress Reporting on the State of the Union.,1976-01-19,Oral,0,2,0,1,"Mr. Speaker, Mr. Vice President, Members of the 94th Congress, and distinguished guests: As we begin our Bicentennial, America is still one of the youngest nations in recorded history. Long before our forefathers came to these shores, men and women had been struggling on this planet to forge a better life for themselves and their families.",2,56,0.11058351634036584,0.09196733880007664,0.08422391576967078,0.08182970212441068,0.0943071375554435,-0.1826647060035386,-0.10991095071834156,-0.005816775694241841,-0.08170635310531048,-0.06906083412780172,1.1538461538461537,0.00012821949490405792,0.004144275237538624,"[0.11058351634036584, 0.09196733880007664, 0.08422391576967078, 0.08182970212441068, 0.0943071375554435]",0.7997521374988588,0.7617585591561791,0.717258962018527,0.9276587364240029,-0.0033020225103810585
Gerald R. Ford,1976 State of the Union,19  - Address Before a Joint Session of the Congress Reporting on the State of the Union.,1976-01-19,Oral,1,2,2,3,"In man's long, upward march from savagery and slavery--throughout the nearly 2,000 years of the Christian calendar, the nearly 6,000 years of Jewish reckoning--there have been many deep, terrifying valleys, but also many bright and towering peaks. One peak stands highest in the ranges of human history.",2,47,0.09584884314045433,0.07960078201407418,0.09350138646565845,0.08927799652675285,0.0752460217495671,-0.14497061160547267,-0.0801321721441079,-0.06573512204045676,-0.11388121484075607,0.040189301287102706,0.5294117647058824,7.954966095692471e-05,0.004941615676218673,"[0.09584884314045433, 0.07960078201407418, 0.09350138646565845, 0.08927799652675285, 0.0752460217495671]",0.7742394045659748,0.7754900608049594,0.7848258692486636,0.950339225094466,-0.0035605157819458
Gerald R. Ford,1976 State of the Union,19  - Address Before a Joint Session of the Congress Reporting on the State of the Union.,1976-01-19,Oral,2,2,4,5,One example shines forth of a people uniting to produce abundance and to share the good life fairly and with freedom. One union holds out the promise of justice and opportunity for every citizen: That union is the United States of America.,2,42,0.08592581786901181,0.10639303443993452,0.0798966002478157,0.07394197991296247,0.07226856872543004,0.06911103653269675,0.11998479577472748,0.2233151163631368,0.19102675003143313,0.2059753478634862,3.4,0.00019007235219815056,0.004232373737245357,"[0.08592581786901181, 0.10639303443993452, 0.0798966002478157, 0.07394197991296247, 0.07226856872543004]",0.8053151968952015,0.8365191522938142,0.6966431300011732,0.9522856972107773,0.002067329977611429
Gerald R. Ford,1976 State of the Union,19  - Address Before a Joint Session of the Congress Reporting on the State of the Union.,1976-01-19,Oral,3,2,6,7,We have not remade paradise on Earth. We know perfection will not be found here.,2,15,0.0749235474006116,0.0642750373692077,0.0686900958466453,0.0489396411092985,0.0587155963302752,-0.0378510204081632,0.0205720930232558,0.0143790697674418,0.1815933333333333,-0.1287218749999999,0.25,9.804113280541528e-05,0.012777174010919778,"[0.0749235474006116, 0.0642750373692077, 0.0686900958466453, 0.0489396411092985, 0.0587155963302752]",0.8036517034053995,0.7451871860132679,0.711437612601398,0.9200696763212133,-0.00200935362725148
Gerald R. Ford,1976 State of the Union,19  - Address Before a Joint Session of the Congress Reporting on the State of the Union.,1976-01-19,Oral,4,2,8,9,"But think for a minute how far we have come in 200 years. We came from many roots, and we have many branches.",2,23,0.07254052362911932,0.08694589797749797,0.08547345836818271,0.08246658406603015,0.07021465824859455,-0.014981282504990794,-0.02980125457875455,0.012243321775060075,-0.028503885615548927,-0.019251919642857128,1.0,5.864303057141739e-05,0.00028902559189878594,"[0.07254052362911932, 0.08694589797749797, 0.08547345836818271, 0.08246658406603015, 0.07021465824859455]",0.7473479408953946,0.8288173970680593,0.7819353137393846,0.9601900133120717,0.0005806848676009925
Gerald R. Ford,1976 State of the Union,19  - Address Before a Joint Session of the Congress Reporting on the State of the Union.,1976-01-19,Oral,5,2,10,11,"Yet all Americans across the eight generations that separate us from the stirring deeds of 1776, those who know no other homeland and those who just found refuge among our shores, say in unison: I am proud of America, and I am proud to be an American. Life will be a little better here for my children than for me.",2,60,0.13315803103432605,0.11104154072645052,0.1252285917717813,0.08120446885262227,0.12213504725468885,0.011028785447657985,0.08777387240773869,0.09412273017236147,0.10031696322088764,0.006814760393644129,1.25,0.00041051443862990514,0.0021970137851651515,"[0.13315803103432605, 0.11104154072645052, 0.1252285917717813, 0.08120446885262227, 0.12213504725468885]",0.7760462409714958,0.7172968559643441,0.7078823680852521,0.8959829670834626,-0.007674628150571829
Gerald R. Ford,1976 State of the Union,19  - Address Before a Joint Session of the Congress Reporting on the State of the Union.,1976-01-19,Oral,6,2,12,13,"I believe this not because I am told to believe it, but because life has been better for me than it was for my father and my mother. I know it will be better for my children because my hands, my brains, my voice, and my vote can help make it happen.",2,52,0.12180708783211205,0.10007596265987363,0.10433083038675584,0.0873250969090679,0.09442677185771792,0.005034229637880963,-0.029972200440963867,0.0424504440084139,0.016997067574972248,-0.027812983911279978,4.333333333333333,0.00016833358717234845,0.0009448025173122491,"[0.12180708783211205, 0.10007596265987363, 0.10433083038675584, 0.0873250969090679, 0.09442677185771792]",0.8050077761944259,0.7549337819345466,0.7260106695701963,0.9305286902629717,-0.005168434836582591
Gerald R. Ford,1976 State of the Union,19  - Address Before a Joint Session of the Congress Reporting on the State of the Union.,1976-01-19,Oral,7,2,14,15,It has happened here in America. It has happened to you and to me.,2,14,0.0620155038759689,0.1029411764705882,0.0534351145038167,0.0457516339869281,0.0277777777777777,0.0743625,-0.18755,-0.1941428571428571,-0.1181714285714285,0.1646333333333333,2.0,0.0007798346931499335,0.02646359599284296,"[0.0620155038759689, 0.1029411764705882, 0.0534351145038167, 0.0457516339869281, 0.0277777777777777]",0.8593891290508757,0.8802075220511485,0.556038209576822,0.9351851549585257,0.004596173476787651
Gerald R. Ford,1976 State of the Union,19  - Address Before a Joint Session of the Congress Reporting on the State of the Union.,1976-01-19,Oral,8,2,16,17,"Government exists to create and preserve conditions in which people can translate their ideas into practical reality. In the best of times, much is lost in translation.",2,27,0.14281095644050032,0.12598872657390298,0.08929616322489678,0.08848927476813928,0.12061850137509451,-0.0576096483302568,0.005552512937892301,0.0314569317557805,-0.037276302766592204,-0.06586290056176738,2.5,0.0005692795110107217,0.001751099196824469,"[0.14281095644050032, 0.12598872657390298, 0.08929616322489678, 0.08848927476813928, 0.12061850137509451]",0.8249374220746508,0.7613096178888799,0.6528736353931817,0.9115934179406235,-0.002445775690032119
Gerald R. Ford,1976 State of the Union,19  - Address Before a Joint Session of the Congress Reporting on the State of the Union.,1976-01-19,Oral,9,2,18,19,But we try. Sometimes we have tried and failed.,2,9,0.127419336627422,0.12972686884903997,0.1437351592565299,0.14388167388167383,0.09539676182423656,-0.1854621263616558,-0.18883303376906313,-0.19163990519284635,-0.18008305030345473,-0.15229761904761904,3.0,0.0003915270200989354,0.00025255154017526417,"[0.127419336627422, 0.12972686884903997, 0.1437351592565299, 0.14388167388167383, 0.09539676182423656]",0.7638220522770957,0.818591892475446,0.8010424902753001,0.9704026305353054,-0.0025108057702616995
Gerald R. Ford,1976 State of the Union,19  - Address Before a Joint Session of the Congress Reporting on the State of the Union.,1976-01-19,Oral,10,2,20,21,"Always we have had the best of intentions. But in the recent past, we sometimes forgot the sound principles that guided us through most of our history.",2,27,0.08611674039952322,0.06923882154044374,0.0544684030677239,0.06880246801849588,0.1162745670782006,-0.2167852681992337,0.04066760037348273,0.09829802934759473,-0.05580532855436079,-0.024764845008051473,2.0,0.0005602772240165944,0.014255568633413804,"[0.08611674039952322, 0.06923882154044374, 0.0544684030677239, 0.06880246801849588, 0.1162745670782006]",0.6980185730614097,0.7078610451582458,0.6990636659613492,0.8569204819181172,-0.001915937862181253
Gerald R. Ford,1976 State of the Union,19  - Address Before a Joint Session of the Congress Reporting on the State of the Union.,1976-01-19,Oral,11,2,22,23,We wanted to accomplish great things and solve age-old problems. And we became overconfident of our abilities.,2,17,0.10456474130711525,0.08222035827629773,0.10292194061323515,0.067165799628942,0.09771454635767182,-0.040034837314245224,0.11022664285714281,0.07966339586559452,0.09253272765246454,-0.048812317390724384,2.3333333333333335,0.0002540842933989378,0.005887400541082423,"[0.10456474130711525, 0.08222035827629773, 0.10292194061323515, 0.067165799628942, 0.09771454635767182]",0.7613203407970808,0.7065981213154994,0.7285593080732093,0.8939967928007511,-0.005735035015627887
Gerald R. Ford,1976 State of the Union,19  - Address Before a Joint Session of the Congress Reporting on the State of the Union.,1976-01-19,Oral,12,2,24,25,"We tried to be a policeman abroad and the indulgent parent here at home. We thought we could transform the country through massive national programs, but often the programs did not work.",2,32,0.10177851060466893,0.11220501482718545,0.10285829053210542,0.0918042211705144,0.08048473275069573,-0.00189592093469895,-0.018191597373051274,0.0015230803598178105,-0.020016923235317643,0.07987981732184765,3.6666666666666665,0.0001461709313611116,0.0016942996100625788,"[0.10177851060466893, 0.11220501482718545, 0.10285829053210542, 0.0918042211705144, 0.08048473275069573]",0.7951159198678581,0.818423592213056,0.7373200995740238,0.9571960328272934,-5.0472329311913866e-05
Gerald R. Ford,1976 State of the Union,19  - Address Before a Joint Session of the Congress Reporting on the State of the Union.,1976-01-19,Oral,13,2,26,27,"Too often they only made things worse. In our rush to accomplish great deeds quickly, we trampled on sound principles of restraint and endangered the rights of individuals.",2,28,0.11706747273557068,0.1341457782527525,0.0910061497493605,0.09212439608142488,0.10973539092815579,-0.0006692271315640537,0.13121634403691548,0.18343085059576442,-0.019515140251759315,0.10002216793870052,1.0,0.0003265825388777752,0.007531661562538151,"[0.11706747273557068, 0.1341457782527525, 0.0910061497493605, 0.09212439608142488, 0.10973539092815579]",0.8025726707785003,0.8167099735128537,0.6770433940571169,0.935092999374298,0.002736434337650681
Gerald R. Ford,1976 State of the Union,19  - Address Before a Joint Session of the Congress Reporting on the State of the Union.,1976-01-19,Oral,14,2,28,29,We unbalanced our economic system by the huge and unprecedented growth of Federal expenditures and borrowing. And we were not totally honest with ourselves about how much these programs would cost and how we would pay for them.,2,38,0.11068682672690792,0.14103059620072284,0.12027606487312652,0.09690364373145284,0.0914463949792991,0.09112519497461603,0.0876891711349122,0.07850333990955724,0.08406298912761767,0.1087137647404556,3.3333333333333335,0.0003908300598599619,0.00013105762283391312,"[0.11068682672690792, 0.14103059620072284, 0.12027606487312652, 0.09690364373145284, 0.0914463949792991]",0.7935398093182604,0.8296466396513844,0.7112642514896068,0.9506140082426798,0.0027317290448143697
Gerald R. Ford,1976 State of the Union,19  - Address Before a Joint Session of the Congress Reporting on the State of the Union.,1976-01-19,Oral,15,2,30,31,"Finally, we shifted our emphasis from defense to domestic problems while our adversaries continued a massive buildup of arms. The time has now come for a fundamentally different approach for a new realism that is true to the great principles upon which this Nation was founded.",2,46,0.1095803580948236,0.09258586958959461,0.09918701961189672,0.08708942935569176,0.07881672199908536,-0.0012383306712236044,0.03440666977134186,0.03233555924525029,-0.024821812649206257,0.02931583918170298,2.8333333333333335,0.0001371095584917689,0.000681634922996717,"[0.1095803580948236, 0.09258586958959461, 0.09918701961189672, 0.08708942935569176, 0.07881672199908536]",0.8051820136947674,0.7720837510690087,0.7453257057979057,0.9454726557699813,-0.004006522632962171
Gerald R. Ford,1976 State of the Union,19  - Address Before a Joint Session of the Congress Reporting on the State of the Union.,1976-01-19,Oral,16,2,32,33,"We must introduce a new balance to our economy--a balance that favors not only sound, active government but also a much more vigorous, healthy economy that can create new jobs and hold down prices. We must introduce a new balance in the relationship between the individual and the government--a balance that favors greater individual freedom and self-reliance.",2,57,0.09651887538088046,0.10524602844920995,0.07504496832473116,0.0954818112880468,0.07914473901715158,0.015214382154119183,0.16452310862510536,0.11722452714107078,0.1219269201046615,0.14616291255232366,2.75,0.00016151609405516034,0.003353493135818074,"[0.09651887538088046, 0.10524602844920995, 0.07504496832473116, 0.0954818112880468, 0.07914473901715158]",0.8029357332785034,0.8438422772118711,0.7277150885711979,0.9669194719061329,0.0017985495292380284
Gerald R. Ford,1976 State of the Union,19  - Address Before a Joint Session of the Congress Reporting on the State of the Union.,1976-01-19,Oral,17,2,34,35,We must strike a new balance in our system of federalism--a balance that favors greater responsibility and freedom for the leaders of our State and local governments. We must introduce a new balance between the spending on domestic programs and spending on defense--a balance that ensures we will fully meet our obligation to the needy while also protecting our security in a world that is still hostile to freedom.,2,69,0.10787463670020699,0.11453761427264836,0.08803829466646819,0.10268637162483107,0.09175140959958585,0.015771954653100304,0.09370221342577717,0.041737626172149926,0.06613302131899929,0.09551500247564994,3.5714285714285716,0.00012172780364548703,0.0011728319625358332,"[0.10787463670020699, 0.11453761427264836, 0.08803829466646819, 0.10268637162483107, 0.09175140959958585]",0.7971777013822482,0.8300912844355126,0.7316990557557282,0.9605492982798465,0.0011107265349667161
Gerald R. Ford,1976 State of the Union,19  - Address Before a Joint Session of the Congress Reporting on the State of the Union.,1976-01-19,Oral,18,2,36,37,"And in all that we do, we must be more honest with the American people, promising them no more than we can deliver and delivering all that we promise. The genius of America has been its incredible ability to improve the lives of its citizens through a unique combination of governmental and free citizen activity.",2,55,0.11633085653013057,0.1389934732494054,0.13346571502591945,0.14547201108231708,0.10213249625979794,0.04440015099715098,0.07218868785273554,0.1303709131574368,0.1262366626478486,0.10843986676501322,3.0,0.0003146746185792527,0.001369838311100305,"[0.11633085653013057, 0.1389934732494054, 0.13346571502591945, 0.14547201108231708, 0.10213249625979794]",0.7513695946951486,0.8463296474803226,0.7953005803549734,0.9744311806842318,0.0026711536238942304
Gerald R. Ford,1976 State of the Union,19  - Address Before a Joint Session of the Congress Reporting on the State of the Union.,1976-01-19,Oral,19,2,38,39,"History and experience tells us that moral progress cannot come in comfortable and in complacent times, but out of trial and out of confusion. Tom Paine aroused the troubled Americans of 1776 to stand up to the times that try men's souls because the harder the conflict, the more glorious the triumph.",2,52,0.10592007798571981,0.09445829590426527,0.09994676744085648,0.1052325208281015,0.09157239518948862,-0.11308781795802637,-0.07832088306329685,-0.10087527789834157,-0.05593965885437971,-0.05842742510694432,1.0833333333333333,4.062928106026319e-05,0.0006422072585785888,"[0.10592007798571981, 0.09445829590426527, 0.09994676744085648, 0.1052325208281015, 0.09157239518948862]",0.7666511002434125,0.7922835990167709,0.7838288488120476,0.953762837895104,-0.0029719927248187776
Gerald R. Ford,1976 State of the Union,19  - Address Before a Joint Session of the Congress Reporting on the State of the Union.,1976-01-19,Oral,20,2,40,41,"Just a year ago I reported that the state of the Union was not good. Tonight, I report that the state of our Union is better--in many ways a lot better--but still not good enough.",2,35,0.07145255498954452,0.06859456407238168,0.0675987356044843,0.0689888215732058,0.053963312278677504,0.005174631666392038,0.0064608090541378475,0.11069126484004986,-0.005459612844168672,0.01910622832383,2.75,4.8190365454060064e-05,0.0022545453761587397,"[0.07145255498954452, 0.06859456407238168, 0.0675987356044843, 0.0689888215732058, 0.053963312278677504]",0.7910267289943611,0.8104210528634218,0.7662505697162538,0.9639709961652114,-0.0008118173921389873
Gerald R. Ford,1976 State of the Union,19  - Address Before a Joint Session of the Congress Reporting on the State of the Union.,1976-01-19,Oral,21,2,42,43,"To paraphrase Tom Paine, 1975 was not a year for summer soldiers and sum shine patriots. It was a year of fears and alarms and of dire forecasts--most of which never happened and won't happen.",2,35,0.10693920020380762,0.09642098631543064,0.08464572624082099,0.09656768940453081,0.0997107343338297,-0.2073668212365591,-0.2944534375,-0.29545550595238096,-0.2399391534391535,-0.1695059609250399,0.3076923076923077,6.479589397127157e-05,0.0030164483891410646,"[0.10693920020380762, 0.09642098631543064, 0.08464572624082099, 0.09656768940453081, 0.0997107343338297]",0.7768466302983458,0.7894553974061219,0.7461748071058747,0.9414763803841357,-0.0018902313430276194
Gerald R. Ford,1976 State of the Union,19  - Address Before a Joint Session of the Congress Reporting on the State of the Union.,1976-01-19,Oral,22,2,44,45,"As you recall, the year 1975 opened with rancor and with bitterness. Political misdeeds of the past had neither been forgotten nor forgiven.",2,23,0.1053837899346066,0.10131796749726252,0.1173342482832944,0.0974950018185161,0.08603982826432785,-0.19341374999999997,-0.1893531582633053,-0.06805435445167694,-0.14213664698162726,-0.0881996980676328,0.6666666666666666,0.00013022407394333143,0.0032704420561413916,"[0.1053837899346066, 0.10131796749726252, 0.1173342482832944, 0.0974950018185161, 0.08603982826432785]",0.7682501896545431,0.7843748678869417,0.7757346399175784,0.9478811570501907,-0.0034724907494913596
Gerald R. Ford,1976 State of the Union,19  - Address Before a Joint Session of the Congress Reporting on the State of the Union.,1976-01-19,Oral,23,2,46,47,"The longest, most divisive war in our history was winding toward an unhappy conclusion. Many feared that the end of that foreign war of men and machines meant the beginning of a domestic war of recrimination and reprisal.",2,38,0.11370307121151015,0.09592830947518816,0.11312973643292339,0.07684003441533048,0.09568424710683089,-0.39149938428124526,-0.2132748200775727,-0.25247834973248573,-0.2234984777692438,-0.21898171126236785,1.7142857142857142,0.00023182675972004759,0.005636688144688772,"[0.11370307121151015, 0.09592830947518816, 0.11312973643292339, 0.07684003441533048, 0.09568424710683089]",0.7815593852545044,0.7333255032923582,0.7293153120097684,0.9134870985022107,-0.005723516216697328
Gerald R. Ford,1976 State of the Union,19  - Address Before a Joint Session of the Congress Reporting on the State of the Union.,1976-01-19,Oral,24,2,48,49,"Friends and adversaries abroad were asking whether America had lost its nerve. Finally, our economy was ravaged by inflation--inflation that was plunging us into the worse recession in four decades.",2,30,0.09868946390131389,0.10649967660890168,0.0950462450261524,0.082837378863467,0.09019837498172627,0.04566709420594833,-0.017091888354700834,0.10639551961122606,-0.05189511002886003,0.0025438564814814976,0.6,7.906100212755412e-05,0.0037327643976473057,"[0.09868946390131389, 0.10649967660890168, 0.0950462450261524, 0.082837378863467, 0.09019837498172627]",0.7844265541011372,0.8014177286694414,0.7253358236687882,0.9410211265079422,-0.00039756363252065746
Gerald R. Ford,1976 State of the Union,19  - Address Before a Joint Session of the Congress Reporting on the State of the Union.,1976-01-19,Oral,25,2,50,51,"At the same time, Americans became increasingly alienated from big institutions. They were steadily losing confidence, not just in big government but in big business, big labor, and big education, among others.",2,32,0.10402888410034493,0.10326293809107132,0.1124973986948267,0.09758072130092013,0.07830547349781072,-0.012168555083777724,0.014367819807942007,0.006882635587099424,0.07843733076164085,0.06480193081755996,4.666666666666667,0.00016395715747402314,0.0015283091185619721,"[0.10402888410034493, 0.10326293809107132, 0.1124973986948267, 0.09758072130092013, 0.07830547349781072]",0.7819718203575325,0.7992806823951811,0.7689212692329573,0.9568060139238067,-0.002449748203101086
Gerald R. Ford,1976 State of the Union,19  - Address Before a Joint Session of the Congress Reporting on the State of the Union.,1976-01-19,Oral,26,2,52,53,"Ours was a troubled land. And so, 1975 was a year of hard decisions, difficult compromises, and a new realism that taught us something important about America.",2,27,0.09109190152956136,0.11032225205562633,0.10649319744204637,0.11565723069013409,0.08089639733754102,-0.07631507204000666,-0.12957017892651027,-0.06585859613064535,-0.056190226503727674,-0.112244353766585,1.4,0.00020854528990595748,0.0009886257737241415,"[0.09109190152956136, 0.11032225205562633, 0.10649319744204637, 0.11565723069013409, 0.08089639733754102]",0.7481484934073902,0.8473378230475797,0.7973726044495504,0.9743799715019498,0.001828037603416044
Gerald R. Ford,1976 State of the Union,19  - Address Before a Joint Session of the Congress Reporting on the State of the Union.,1976-01-19,Oral,27,2,54,55,"It brought back a needed measure of common sense, steadfastness, and self-discipline. Americans did not panic or demand instant but useless cures.",2,22,0.11872404094053092,0.0921761601668983,0.08458097078676453,0.10485835404204398,0.07825066087078504,-0.04409193282026617,-0.09526431818181817,0.008938221030177515,-0.04177029178338002,-0.02891163632119514,0.75,0.0002636274942797813,0.0013979205041057643,"[0.11872404094053092, 0.0921761601668983, 0.08458097078676453, 0.10485835404204398, 0.07825066087078504]",0.8195893007767874,0.7908684992714279,0.7484547236648211,0.9602974042994923,-0.0035840758782913866
Gerald R. Ford,1976 State of the Union,19  - Address Before a Joint Session of the Congress Reporting on the State of the Union.,1976-01-19,Oral,28,2,56,57,"In all sectors, people met their difficult problems with the restraint and with responsibility worthy of their great heritage. Add up the separate pieces of progress in 1975, subtract the setbacks, and the sum total shows that we are not only headed in a new direction, a direction which I proposed 12 months ago, but it turned out to be the right direction.",2,63,0.10797276596774588,0.10669064501650591,0.08681108633019247,0.10912664016030169,0.07530086908282321,-0.07982017684218468,0.017149760611019298,0.05201755474698109,-0.005154512325581871,-0.09563929861148372,2.2222222222222223,0.00023396727914047085,0.0040151432998613325,"[0.10797276596774588, 0.10669064501650591, 0.08681108633019247, 0.10912664016030169, 0.07530086908282321]",0.8096229086697602,0.8366948116551982,0.7502955903229344,0.9758392032241466,0.00023778217524085543
Gerald R. Ford,1976 State of the Union,19  - Address Before a Joint Session of the Congress Reporting on the State of the Union.,1976-01-19,Oral,29,2,58,59,"It is the right direction because it follows the truly revolutionary American concept of 1776, which holds that in a free society the making of public policy and successful problemsolving involves much more than government. It involves a full partnership among all branches and all levels of government, private institutions, and individual citizens.Common sense tells me to stick to that steady course.",2,62,0.10188840727493291,0.12402343829713448,0.11199825081819932,0.11566637845265426,0.09069999895753526,-0.006749376328689647,0.08970995274659183,0.11239039485836087,0.029770726384491998,0.040547590431121716,3.5714285714285716,0.00016612347477995134,0.0022848499178054105,"[0.10188840727493291, 0.12402343829713448, 0.11199825081819932, 0.11566637845265426, 0.09069999895753526]",0.7644901987562809,0.8440041433050796,0.7706996644327558,0.9688245601781051,0.002283987171300246
