president,speech_label,matched_title,document_date,document_type,block_idx,block_size,sentence_start,sentence_end,text,n_sentences,n_words,care_p,fairness_p,loyalty_p,authority_p,sanctity_p,care_sent,fairness_sent,loyalty_sent,authority_sent,sanctity_sent,moral_nonmoral_ratio,f_var,sent_var,moral_vector_R5,cosine_gonye,cosine_pergel,cosine_yasa,cosine_gpy_sum_vector,delta_vector_discriminant
Gerald R. Ford,1976 State of the Union,19  - Address Before a Joint Session of the Congress Reporting on the State of the Union.,1976-01-19,Oral,42,5,210,214,"Our traditional friendships in Latin America, Africa, and Asia continue. We have taken the role of leadership in launching a serious and hopeful dialog between the industrial world and the developing world. We have helped to achieve significant reform of the international monetary system. We should be proud of what America, what our country, has accomplished in these areas, and I believe the American people are. The American people have heard too much about how terrible our mistakes, how evil our deeds, and how misguided our purposes.",5,87,0.11962871988064981,0.11589525627963845,0.11961613015834459,0.11665184155621909,0.10383312394507954,-0.1321528329915247,-0.07075513158612708,-0.03498483075579502,-0.019402891372374866,-0.03237006082939911,1.8571428571428572,4.2721186893831763e-05,0.0020844105672867806,"[0.11962871988064981, 0.11589525627963845, 0.11961613015834459, 0.11665184155621909, 0.10383312394507954]",0.7698085104844776,0.7995364443826264,0.7740944588462136,0.9540791317336376,-0.002833178461446914
Gerald R. Ford,1976 State of the Union,19  - Address Before a Joint Session of the Congress Reporting on the State of the Union.,1976-01-19,Oral,43,5,215,219,The American people know better. The truth is we are the world's greatest democracy. We remain the symbol of man's aspiration for liberty and well-being. We are the embodiment of hope for progress. I say it is time we quit downgrading ourselves as a nation.,5,45,0.09216227642308394,0.0983479613206859,0.1074036061293699,0.1118523110394345,0.10412747742065276,0.16239411394963044,0.0864481217510669,0.11119529024136131,0.1509487143968827,0.14320691556165546,1.5,5.946981733406505e-05,0.0009773791422379226,"[0.09216227642308394, 0.0983479613206859, 0.1074036061293699, 0.1118523110394345, 0.10412747742065276]",0.712115020449638,0.8037096331400209,0.8110463489249397,0.9473907444707439,-0.0007936196011572375
Gerald R. Ford,1976 State of the Union,19  - Address Before a Joint Session of the Congress Reporting on the State of the Union.,1976-01-19,Oral,44,5,220,224,"Of course, it is our responsibility to learn the right lesson from past mistakes. It is our duty to see that they never happen again. But our greater duty is to look to the future. The world's troubles will not go away. The American people want strong and effective international and defense policies.",5,53,0.1097321858716275,0.11078796227619365,0.12477507860807993,0.12620165699917346,0.10903120851236563,-0.03215405072882777,0.02479791114913851,0.02092866904523396,0.02517684383720904,0.03454587425980341,5.0,7.400872994962813e-05,0.0007099201986408958,"[0.1097321858716275, 0.11078796227619365, 0.12477507860807993, 0.12620165699917346, 0.10903120851236563]",0.7308894573422683,0.8019017771716114,0.8091132130748254,0.9534707884126716,-0.002279321572253655
Gerald R. Ford,1976 State of the Union,19  - Address Before a Joint Session of the Congress Reporting on the State of the Union.,1976-01-19,Oral,45,5,225,229,"In our constitutional system, these policies should reflect consultation and accommodation between the President and the Congress. But in the final analysis, as the framers of our Constitution knew from hard experience, the foreign relations of the United States can be conducted effectively only if there is strong central direction that allows flexibility of action. That responsibility clearly rests with the President. I pledge to the American people policies which seek a secure, just, and peaceful world. I pledge to the Congress to work with you to that end.",5,89,0.10132984333195691,0.10896403762962971,0.0989743049534893,0.10901319395488683,0.08087624094569608,0.0021233334718066626,0.0016623357276023265,0.082665861960721,0.05373773652925176,0.059598981866670404,3.6666666666666665,0.00013249710233471042,0.0013244076683773622,"[0.10132984333195691, 0.10896403762962971, 0.0989743049534893, 0.10901319395488683, 0.08087624094569608]",0.7814339590193031,0.8353023159830635,0.7704326199517816,0.9720046167674223,0.0004434411775056449
Gerald R. Ford,1976 State of the Union,19  - Address Before a Joint Session of the Congress Reporting on the State of the Union.,1976-01-19,Oral,46,5,230,234,"We must not face a future in which we can no longer help our friends, such as Angola, even in limited and carefully controlled ways. We must not lose all capacity to respond short of military intervention. Some hasty actions of the Congress during the past year--most recently in respect to Angola--were, in my view, very shortsighted. Unfortunately, they are still very much on the minds of our allies and our adversaries. A strong defense posture gives weight to our values and our views in international negotiations.",5,87,0.10416413451460062,0.10236224912525622,0.1028850191146473,0.11240221448610895,0.08968998524034084,-0.029846663738220713,0.04038738120054835,0.05402262430733143,-0.0010787084466826018,-0.02141273348442421,3.3333333333333335,6.622208174330514e-05,0.0013865169123936983,"[0.10416413451460062, 0.10236224912525622, 0.1028850191146473, 0.11240221448610895, 0.08968998524034084]",0.7644080987264078,0.8144673353030585,0.7884157036926056,0.963829480951877,-0.001382525383942082
Gerald R. Ford,1976 State of the Union,19  - Address Before a Joint Session of the Congress Reporting on the State of the Union.,1976-01-19,Oral,47,5,235,239,It assures the vigor of our alliances. And it sustains our efforts to promote settlements of international conflicts. Only from a position of strength can we negotiate a balanced agreement to limit the growth of nuclear arms. Only a balanced agreement will serve our interests and minimize the threat of nuclear confrontation. The defense budget I will submit to the Congress for fiscal year 1977 will show an essential increase over the current year.,5,74,0.11458361762962872,0.11265984283051284,0.10732117782703265,0.10199655089304112,0.0950691146946492,0.014907163921658412,0.08120439365467129,0.08468740760915532,0.07603050282567021,0.03772271087130464,2.0,6.368944728882834e-05,0.0009599442877731486,"[0.11458361762962872, 0.11265984283051284, 0.10732117782703265, 0.10199655089304112, 0.0950691146946492]",0.7893589436272884,0.8010487851980455,0.748058103462691,0.9520732147786067,-0.001931808608055148
Gerald R. Ford,1976 State of the Union,19  - Address Before a Joint Session of the Congress Reporting on the State of the Union.,1976-01-19,Oral,48,5,240,244,"It provides for real growth in purchasing power over this year's defense budget, which includes the cost of the all-volunteer force. We are continuing to make economies to enhance the efficiency of our military forces. But the budget I will submit represents the necessity of American strength for the real world in which we live. As conflict and rivalry persist in the world, our United States intelligence capabilities must be the best in the world. The crippling of our foreign intelligence services increases the danger of American involvement in direct armed conflict.",5,92,0.11274028936906183,0.09301895197178353,0.09113437094375922,0.08873004258085143,0.08263412203608933,-0.05466679263297982,0.049249485474427715,0.02356473174728067,0.018073874550489574,0.058314096553717366,3.0,0.00012918032389575053,0.0019772693022433773,"[0.11274028936906183, 0.09301895197178353, 0.09113437094375922, 0.08873004258085143, 0.08263412203608933]",0.8125532341052543,0.7748921174277802,0.7349180893291541,0.9453967763381735,-0.0036773829080706533
Gerald R. Ford,1976 State of the Union,19  - Address Before a Joint Session of the Congress Reporting on the State of the Union.,1976-01-19,Oral,49,5,245,249,"Our adversaries are encouraged to attempt new adventures while our own ability to monitor events and to influence events short of military action is undermined. Without effective intelligence capability, the United States stands blindfolded and hobbled. In the near future, I will take actions to reform and strengthen our intelligence community. I ask for your positive cooperation. It is time to go beyond sensationalism and ensure an effective, responsible, and responsive intelligence capability.",5,73,0.10988861573386835,0.10302358087644649,0.1126165511154496,0.10804375418530646,0.07864945786249539,0.04740529012697121,0.11110288514897454,0.12440314484454336,0.11861482505941583,0.1766528943216113,3.4444444444444446,0.00018919412382873373,0.0021211941299899987,"[0.10988861573386835, 0.10302358087644649, 0.1126165511154496, 0.10804375418530646, 0.07864945786249539]",0.7844854519075347,0.8026222990776558,0.7801813057891821,0.9637594732505328,-0.0029896619863499993
Gerald R. Ford,1976 State of the Union,19  - Address Before a Joint Session of the Congress Reporting on the State of the Union.,1976-01-19,Oral,50,5,250,254,"Tonight I have spoken about our problems at home and abroad. I have recommended policies that will meet the challenge of our third century. I have no doubt that our Union will endure, better, stronger, and with more individual freedom. We can see forward only dimly--1 year, 5 years, a generation perhaps. Like our forefathers, we know that if we meet the challenges of our own time with a common sense of purpose and conviction, if we remain true to our Constitution and to our ideals, then we can know that the future will be better than the past.",5,99,0.09034677024505781,0.09747753028650762,0.08083225787793351,0.08645469068571827,0.07710267781466693,0.025625647645713515,0.07595613100018804,0.11244567605886384,0.030044990115394278,0.004535191222678081,3.0,6.393061572450927e-05,0.0019080389422034285,"[0.09034677024505781, 0.09747753028650762, 0.08083225787793351, 0.08645469068571827, 0.07710267781466693]",0.7912910598415317,0.8269676848192391,0.7401194478461003,0.9602919996999354,0.0005156856405320702
Gerald R. Ford,1976 State of the Union,19  - Address Before a Joint Session of the Congress Reporting on the State of the Union.,1976-01-19,Oral,51,5,255,259,"I see America today crossing a threshold, not just because it is our Bicentennial but because we have been tested in adversity. We have taken a new look at what we want to be and what we want our Nation to become. I see America resurgent, certain once again that life will be better for our children than it is for us, seeking strength that cannot be counted in megatons and riches that cannot be eroded by inflation. I see these United States of America moving forward as before toward a more perfect Union where the government serves and the people rule. We will not make this happen simply by making speeches, good or bad, yours or mine, but by hard work and hard decisions made with courage and with common sense.",5,132,0.09987296335007737,0.10302038286678573,0.10325249364728623,0.10032340114097411,0.08854562500400108,0.022078394579034055,0.03666510032340675,0.07207127856587968,0.058841550206821074,0.07224097092302059,1.9411764705882353,3.651363714089646e-05,0.0004972754025272187,"[0.09987296335007737, 0.10302038286678573, 0.10325249364728623, 0.10032340114097411, 0.08854562500400108]",0.7671384044868128,0.809251853051364,0.7727765353184312,0.9564562992200278,-0.001154660251850216
Gerald R. Ford,1976 State of the Union,19  - Address Before a Joint Session of the Congress Reporting on the State of the Union.,1976-01-19,Oral,52,5,260,264,"I have heard many inspiring Presidential speeches, but the words I remember best were spoken by Dwight D. Eisenhower. ""America is not good because' it is great,"" the President said. ""America is great because it is good."" President Eisenhower was raised in a poor but religious home in the heart of America. His simple words echoed President Lincoln's eloquent testament that ""right makes might."" And Lincoln in turn evoked the silent image of George Washington kneeling in prayer at Valley Forge.",5,81,0.08977599565610031,0.08857366049935264,0.0867867134767133,0.08887291707936258,0.08462693478071981,-0.006446011509232801,0.03907565805952177,0.012820542359082076,0.01544314607096141,0.01141052968123828,1.2380952380952381,4.180721490978387e-06,0.0002639864006796428,"[0.08977599565610031, 0.08857366049935264, 0.0867867134767133, 0.08887291707936258, 0.08462693478071981]",0.7622266007682531,0.801149166450009,0.7707172773521497,0.9503020334197796,-0.0011702957044488864
