president,speech_label,matched_title,document_date,document_type,block_idx,block_size,sentence_start,sentence_end,text,n_sentences,n_words,care_p,fairness_p,loyalty_p,authority_p,sanctity_p,care_sent,fairness_sent,loyalty_sent,authority_sent,sanctity_sent,moral_nonmoral_ratio,f_var,sent_var,moral_vector_R5,cosine_gonye,cosine_pergel,cosine_yasa,cosine_gpy_sum_vector,delta_vector_discriminant
Gerald R. Ford,1976 State of the Union,19  - Address Before a Joint Session of the Congress Reporting on the State of the Union.,1976-01-19,Oral,22,5,110,114,"The American farmer, who now feeds 215 million Americans, but also millions worldwide, has shown how touch more he can produce without the shackles of government control. Now, we badly need reforms in other key areas in our economy: the airlines, trucking, railroads, and financial institutions. I have submitted concrete plans in each of these areas, not to help this or that industry, but to foster competition and to bring prices down for the consumer. This administration, in addition, will strictly enforce the Federal antitrust laws for the very same purposes. Taking a longer look at America's future, there can be neither sustained growth nor more jobs unless we continue to have an assured supply of energy to run our economy.",5,121,0.1131066614279596,0.11910197549834826,0.10138625194227498,0.10435490872617431,0.07406034251713635,-0.03846085231079068,0.003728716256652076,0.030652301852151797,-0.007861111980683627,0.006124691902820336,2.111111111111111,0.00030039352585356326,0.0006313118159845621,"[0.1131066614279596, 0.11910197549834826, 0.10138625194227498, 0.10435490872617431, 0.07406034251713635]",0.8199448587953161,0.8328280577137642,0.7320019331114218,0.971020567269191,0.00036386505606390146
Gerald R. Ford,1976 State of the Union,19  - Address Before a Joint Session of the Congress Reporting on the State of the Union.,1976-01-19,Oral,23,5,115,119,"Domestic production of oil and gas is still declining. Our dependence on foreign oil at high prices is still too great, draining jobs and dollars away from our own economy at the rate of $125 per year for every American. Last month, I signed a compromise national energy bill which enacts a part of my comprehensive energy independence program. This legislation was late, not the complete answer to energy independence, but still a start in the right direction. I again urge the Congress to move ahead immediately on the remainder of my energy proposals to make America invulnerable to the foreign oil cartel.",5,103,0.09677470062050908,0.10708585391034237,0.09218367190142902,0.09415003762107439,0.07380701786305675,0.021274063532832344,0.03951020966798587,0.03716394665799993,0.0356128003652994,0.03437881453803187,2.923076923076923,0.0001457049247498268,5.105454932932652e-05,"[0.09677470062050908, 0.10708585391034237, 0.09218367190142902, 0.09415003762107439, 0.07380701786305675]",0.7992419763585432,0.8346748012067232,0.7431110314630266,0.9678926594976125,0.000743892185855733
Gerald R. Ford,1976 State of the Union,19  - Address Before a Joint Session of the Congress Reporting on the State of the Union.,1976-01-19,Oral,24,5,120,124,"My proposals, as all of you know, would reduce domestic natural gas shortages; allow production from Federal petroleum reserves; stimulate effective conservation, including revitalization of our railroads and the expansion of our urban transportation systems; develop more and cleaner energy from our vast coal resources; expedite clean and safe nuclear power production; create a new national energy independence authority to stimulate vital energy investment; and accelerate development of technology to capture energy from the Sun and the Earth for this and future generations. Also, I ask, for the sake of future generations, that we preserve the family farm and family-owned small business. Both strengthen America and give stability to our economy. I will propose estate tax changes so that family businesses and family farms can be handed down from generation to generation without having to be sold to pay taxes. I propose tax changes to encourage people to invest in America's future, and their own, through a plan that gives moderate-income families income tax benefits if they make long-term investments in common stock in American companies.",5,176,0.12993098691503766,0.11764268437747569,0.09806291375325725,0.0930387693529613,0.09498021618737601,0.022558004366108164,0.0690532319014005,0.058844126882060324,0.041170245400460506,0.040087425825401896,4.526315789473684,0.00026449951705753857,0.0003259121053173085,"[0.12993098691503766, 0.11764268437747569, 0.09806291375325725, 0.0930387693529613, 0.09498021618737601]",0.8310395996136328,0.7856165320207102,0.6952298451404975,0.9412149979401457,-0.0025497342443129914
Gerald R. Ford,1976 State of the Union,19  - Address Before a Joint Session of the Congress Reporting on the State of the Union.,1976-01-19,Oral,25,5,125,129,"The Federal Government must and will respond to clear-cut national needs-for this and future generations. Hospital and medical services in America are among the best in the world, but the cost of a serious and extended illness can quickly wipe out a family's lifetime savings. Increasing health costs are of deep concern to all and a powerful force pushing up the cost of living. The burden of catastrophic illness can be borne by very few in our society. We must eliminate this fear from every family.",5,86,0.125613824661882,0.10993457628246761,0.11207786097172784,0.1073184569848604,0.0888913189582038,-0.045051597827244994,-0.02513548880995271,-0.025817591716606702,-0.043732991162807856,-0.05840622612167369,3.5555555555555554,0.00017332037736604586,0.00019991209915689998,"[0.125613824661882, 0.10993457628246761, 0.11207786097172784, 0.1073184569848604, 0.0888913189582038]",0.8062050373729603,0.7890317129095158,0.7513057375835231,0.9552750932280069,-0.004221862049690987
Gerald R. Ford,1976 State of the Union,19  - Address Before a Joint Session of the Congress Reporting on the State of the Union.,1976-01-19,Oral,26,5,130,134,"I propose catastrophic health insurance for everybody covered by Medicare. To finance this added protection, fees for short-term care will go up somewhat, but nobody after reaching age 65 will have to pay more than $500 a year for covered hospital or nursing home care, nor more than $250 for 1 year's doctor bills. We cannot realistically afford federally dictated national health insurance providing full coverage for all 215 million Americans. The experience of other countries raises questions about the quality as well as the cost of such plans. But I do envision the day when we may use the private health insurance system to offer more middle-income families high quality health services at prices they can afford and shield them also from their catastrophic illnesses.",5,126,0.13325412207329826,0.12257893456136995,0.08252393937433194,0.07187648090457571,0.0835097347936734,-0.015506831891479143,0.036661839514526985,0.038149639508132195,0.03633053426145274,-0.02987624495818324,2.611111111111111,0.0007440223271805236,0.0010968993737064834,"[0.13325412207329826, 0.12257893456136995, 0.08252393937433194, 0.07187648090457571, 0.0835097347936734]",0.8764537116638785,0.7745134979865838,0.6122336099078582,0.921426682169841,-0.0007325793804889361
Gerald R. Ford,1976 State of the Union,19  - Address Before a Joint Session of the Congress Reporting on the State of the Union.,1976-01-19,Oral,27,5,135,139,"Using resources now available, I propose improving the Medicare and other Federal health programs to help those who really need protection--older people and the poor. To help States and local governments give better health care to the poor, I propose that we combine 16 existing Federal programs, including Medicaid, into a single $10 billion Federal grant. Funds would be divided among States under a new formula which provides a larger share of Federal money to those States that have a larger share of low-income families. I will take further steps to improve the quality of medical and hospital care for those who have served in our Armed Forces. Now let me speak about social security.",5,115,0.13509846526316577,0.12512879021648166,0.09551732013384773,0.0955340282381496,0.08637487452107377,0.029363223358015195,0.005790588508214739,0.059208729909616356,0.039712758503184904,0.026093154695798055,4.636363636363637,0.00045137121043429466,0.00038214315371510205,"[0.13509846526316577, 0.12512879021648166, 0.09551732013384773, 0.0955340282381496, 0.08637487452107377]",0.8536628669762157,0.7994531760879018,0.677438448347091,0.9488593184442499,-0.0013495255085909097
Gerald R. Ford,1976 State of the Union,19  - Address Before a Joint Session of the Congress Reporting on the State of the Union.,1976-01-19,Oral,28,5,140,144,"Our Federal social security system for people who have worked and contributed to it for all their lives is a vital part of our economic system. Its value is no longer debatable. In my budget for fiscal year 1977, I am recommending that the full cost-of-living increases in the social security benefits be paid during the coming year. But I am concerned about the integrity of our Social Security Trust Fund that enables people--those retired and those still working who will retire--to count on this source of retirement income. Younger workers watch their deductions rise and wonder if they will be adequately protected in the future.",5,106,0.12198522668054843,0.11816723239751552,0.10110404517478291,0.08858415360147287,0.08889028696165523,0.0017777345070002686,0.05325946783050245,0.06149797907275205,-0.012780417485370456,0.05514745391173856,3.4545454545454546,0.00024954876374442755,0.001194082615241634,"[0.12198522668054843, 0.11816723239751552, 0.10110404517478291, 0.08858415360147287, 0.08889028696165523]",0.8273122329848247,0.7931944858864199,0.6973095053514552,0.9436618322826572,-0.0016986150525466967
Gerald R. Ford,1976 State of the Union,19  - Address Before a Joint Session of the Congress Reporting on the State of the Union.,1976-01-19,Oral,29,5,145,149,"We must meet this challenge head on. Simple arithmetic warns all of us that the Social Security Trust Fund is headed for trouble. Unless we act soon to make sure the fund takes in as much as it pays out, there will be no security for old or for young. I must, therefore, recommend a three-tenths of 1 percent increase in both employer and employee social security taxes effective January 1, 1977. This will cost each covered employee less than 1 extra dollar a week and will ensure the integrity of the trust fund.",5,94,0.10633611000662083,0.1294213947271786,0.08639301826768044,0.09204931362992338,0.08467810867423181,0.0516604948626194,0.14297813730781203,0.11593194009016053,0.055299476829014704,0.07565743068735639,3.6666666666666665,0.00034715916894466857,0.001586136271666603,"[0.10633611000662083, 0.1294213947271786, 0.08639301826768044, 0.09204931362992338, 0.08467810867423181]",0.8200013205389933,0.8472384883545897,0.683892039152778,0.9574752051417047,0.003893154398172831
Gerald R. Ford,1976 State of the Union,19  - Address Before a Joint Session of the Congress Reporting on the State of the Union.,1976-01-19,Oral,30,5,150,154,"As we rebuild our economy, we have a continuing responsibility to provide a temporary cushion to the unemployed. At my request, the Congress enacted two extensions and two expansions in unemployment insurance which helped those who were jobless during 1975. These programs will continue in 1976. In my fiscal year 1977 budget, I am also requesting funds to continue proven job training and employment opportunity programs for millions of other Americans. Compassion and a sense of community--two of America's greatest strengths throughout our history-- tell us we must take care of our neighbors who cannot take care of themselves.",5,99,0.14696922873201135,0.12427563792323491,0.09904164358716053,0.08905746513433314,0.08565082247784127,0.017371035318617747,0.10171727632151002,0.05949576936821988,0.029264700498849036,0.11292436260124906,1.4444444444444444,0.0006792662723319669,0.001804289027741418,"[0.14696922873201135, 0.12427563792323491, 0.09904164358716053, 0.08905746513433314, 0.08565082247784127]",0.8704708729117481,0.7716241365954314,0.6553848626215922,0.9352971150603266,-0.0035669424215461695
Gerald R. Ford,1976 State of the Union,19  - Address Before a Joint Session of the Congress Reporting on the State of the Union.,1976-01-19,Oral,31,5,155,159,"The host of Federal programs in this field reflect our generosity as a people. But everyone realizes that when it comes to welfare, government at all levels is not doing the job well. Too many of our welfare programs are inequitable and invite abuse. Too many of our welfare programs have problems from beginning to end. Worse, we are wasting badly needed resources without reaching many of the truly needy.",5,70,0.11832179092901579,0.12614334402208965,0.11378109138736331,0.09802367372068788,0.07093983249077622,-0.07283952196731941,0.015300079089477826,-0.10585044236142672,-0.061102707261980554,0.005278597754097714,2.4444444444444446,0.00047735155786735636,0.002723613464768415,"[0.11832179092901579, 0.12614334402208965, 0.11378109138736331, 0.09802367372068788, 0.07093983249077622]",0.8284976656552284,0.8194229331398933,0.7146433185647011,0.9619439064119045,-0.00034909956984196383
Gerald R. Ford,1976 State of the Union,19  - Address Before a Joint Session of the Congress Reporting on the State of the Union.,1976-01-19,Oral,32,5,160,164,"Complex welfare programs cannot be reformed overnight. Surely we cannot simply dump welfare into the laps of the 50 States, their local taxpayers, or their private charities, and just walk away from it. Nor is it the right time for massive and sweeping changes while we are still recovering from the recession. Nevertheless, there are still plenty of improvements that we can make. I will ask Congress for Presidential authority to tighten up the rules for eligibility and benefits.",5,79,0.10633377048464998,0.13866091858138355,0.10199346574913426,0.11987282734605613,0.07424732812908408,-0.01845889783201147,0.02015690324188,0.007238935249073233,0.008008490812011384,-0.04059491856948555,2.090909090909091,0.0005647269800084835,0.0005999143829399821,"[0.10633377048464998, 0.13866091858138355, 0.10199346574913426, 0.11987282734605613, 0.07424732812908408]",0.8021981460097508,0.8779231429956622,0.7335888367538357,0.9830068675954134,0.005920047974717492
Gerald R. Ford,1976 State of the Union,19  - Address Before a Joint Session of the Congress Reporting on the State of the Union.,1976-01-19,Oral,33,5,165,169,"Last year I twice sought long overdue reform of the scandal-riddled food stamp program. This year I say again: Let's give food stamps to those most in need. Let's not give any to those who don't need them. Protecting the life and property of the citizen at home is the responsibility of all public officials, but is primarily the job of local and State law enforcement authorities. Americans have always found the very thought of a Federal police force repugnant, and so do I.",5,84,0.12153906371524213,0.12283572885971067,0.10265901738612802,0.11953824580279467,0.10179766258095418,-0.11222704712680828,-0.06770123804814741,-0.015067034650053336,-0.060595232806662215,-0.0555551175216971,3.0,0.00011064077855958311,0.0012003027459765267,"[0.12153906371524213, 0.12283572885971067, 0.10265901738612802, 0.11953824580279467, 0.10179766258095418]",0.7905599163908075,0.8239378285942941,0.7502928909596378,0.9628721170744551,7.968641813752009e-06
Gerald R. Ford,1976 State of the Union,19  - Address Before a Joint Session of the Congress Reporting on the State of the Union.,1976-01-19,Oral,34,5,170,174,"But there are proper ways in which we can help to insure domestic tranquility as the Constitution charges us. My recommendations on how to control violent crime were submitted to the Congress last June with strong emphasis on protecting the innocent victims of crime. To keep a convicted criminal from committing more crimes, we must put him in prison so he cannot harm more law-abiding citizens. To be effective, this punishment must be swift and it must be certain. Too often, criminals are not sent to prison after conviction but are allowed to return to the streets.",5,97,0.1626944985955862,0.16664220347993655,0.12094373949889822,0.1192972909174037,0.12780099357436217,-0.3052881731792138,-0.19760759887818927,-0.20043042031349156,-0.2168253683414635,-0.20796756329447796,4.857142857142857,0.0005410080106953526,0.002038795338402913,"[0.1626944985955862, 0.16664220347993655, 0.12094373949889822, 0.1192972909174037, 0.12780099357436217]",0.828624625924958,0.8064477816444039,0.6774605973841138,0.9415990435035809,0.0007940377109284108
Gerald R. Ford,1976 State of the Union,19  - Address Before a Joint Session of the Congress Reporting on the State of the Union.,1976-01-19,Oral,35,5,175,179,"Some judges are reluctant to send convicted criminals to prison because of inadequate facilities. To alleviate this problem at the Federal level, my new budget proposes the construction of four new Federal facilities. To speed Federal justice, I propose an increase this year in the United States attorneys prosecuting Federal crimes and the reinforcement of the number of United States marshals. Additional Federal judges are needed, as recommended by me and the Judicial Conference. Another major threat to every American's person and property is the criminal carrying a handgun.",5,89,0.1037733895004183,0.11584349650544992,0.07692888159710667,0.09714087481419253,0.07731909238768386,-0.18766514199866374,-0.1335681148189138,-0.08953769764459946,-0.09694080450698483,-0.14221677727774756,3.6363636363636362,0.00028799900957640254,0.0015543392473181849,"[0.1037733895004183, 0.11584349650544992, 0.07692888159710667, 0.09714087481419253, 0.07731909238768386]",0.8227948309355421,0.8507076810832299,0.7048014974942434,0.9685037338789925,0.002736207287089839
Gerald R. Ford,1976 State of the Union,19  - Address Before a Joint Session of the Congress Reporting on the State of the Union.,1976-01-19,Oral,36,5,180,184,"The way to cut down on the criminal use of guns is not to take guns away from the law-abiding citizen, but to impose mandatory sentences for crimes in which a gun is used, make it harder to obtain cheap guns for criminal purposes, and concentrate gun control enforcement in highcrime areas. My budget recommends 500 additional Federal agents in the 11 largest metropolitan high-crime areas to help local authorities stop criminals from selling and using handguns. The sale of hard drugs is tragically on the increase again. I have directed all agencies of the Federal Government to step up law enforcement efforts against those who deal in drugs. In 1975, I am glad to report, Federal agents seized substantially more heroin coming into our country than in 1974.",5,129,0.13701499698289016,0.1392246408786838,0.10968372956422269,0.12339810741133563,0.10656344064180145,-0.21398261136519564,-0.14589564016687043,-0.12864634514693757,-0.11618762511489499,-0.14778146737262696,4.666666666666667,0.00022678613208925195,0.001428388446897734,"[0.13701499698289016, 0.1392246408786838, 0.10968372956422269, 0.12339810741133563, 0.10656344064180145]",0.811158906122347,0.8241321895585026,0.7257897036460313,0.9613704723172032,0.0004223490876436725
Gerald R. Ford,1976 State of the Union,19  - Address Before a Joint Session of the Congress Reporting on the State of the Union.,1976-01-19,Oral,37,5,185,189,"As President, I have talked personally with the leaders of Mexico, Colombia, and Turkey to urge greater efforts by their Governments to control effectively the production and shipment of hard drugs. I recommended months ago that the Congress enact mandatory fixed sentences for persons convicted of Federal crimes involving the sale of hard drugs. Hard drugs, we all know, degrade the spirit as they destroy the body of their users. It is unrealistic and misleading to hold out the hope that the Federal Government can move into every neighborhood and clean up crime. Under the Constitution, the greatest responsibility for curbing crime lies with State and local authorities.",5,108,0.128342635763716,0.12667847277929906,0.09394657291394254,0.12256079741362277,0.11419449661057816,-0.17724566571540745,-0.09069488029661395,-0.07973835505624806,-0.11666910187665923,-0.1673892256010946,2.933333333333333,0.00019811937506356738,0.0019530598969574298,"[0.128342635763716, 0.12667847277929906, 0.09394657291394254, 0.12256079741362277, 0.11419449661057816]",0.7910909343765438,0.8198627867817916,0.7334003741433537,0.9545688574773602,0.0005733049238377808
Gerald R. Ford,1976 State of the Union,19  - Address Before a Joint Session of the Congress Reporting on the State of the Union.,1976-01-19,Oral,38,5,190,194,"They are the frontline fighters in the war against crime. There are definite ways in which the Federal Government can help them. I will propose in the new budget that Congress authorize almost $7 billion over the next 5 years to assist State and local governments to protect the safety and property of all their citizens. As President, I pledge the strict enforcement of Federal laws and--by example, support, and leadership--to help State and local authorities enforce their laws. Together, we must protect the victims of crime and ensure domestic tranquility.",5,91,0.143006718756233,0.1463358588090428,0.11197658693224448,0.13844592226159672,0.09754985955363987,-0.05136509755748914,-0.06627685451625091,-0.021808282359152213,-0.045990199797914535,-0.056932087012395695,4.625,0.00046326038371786223,0.00027851726734923475,"[0.143006718756233, 0.1463358588090428, 0.11197658693224448, 0.13844592226159672, 0.09754985955363987]",0.8203914592612245,0.8411822373698981,0.7323434584187198,0.974773274812492,0.0016679482644509427
Gerald R. Ford,1976 State of the Union,19  - Address Before a Joint Session of the Congress Reporting on the State of the Union.,1976-01-19,Oral,39,5,195,199,"Last year I strongly recommended a 5-year extension of the existing revenue sharing legislation, which thus far has provided $23½ billion to help State and local units of government solve problems at home. This program has been effective with decisionmaking transferred from the Federal Government to locally elected officials. Congress must act this year, or State and local units of government will have to drop programs or raise local taxes. Including my health care program reforms, I propose to consolidate some 59 separate Federal programs and provide flexible Federal dollar grants to help States, cities, and local agencies in such important areas as education, child nutrition, and social services. This flexible system will do the job better and do it closer to home.",5,123,0.11982517320269902,0.10878646544152334,0.09283776565489717,0.10941577943480711,0.08002295469423096,-0.03502788932637102,0.02571677149815277,0.04175651977057439,0.001664339631988943,0.02078453182499896,3.111111111111111,0.0002463914995284527,0.0008660007123714217,"[0.11982517320269902, 0.10878646544152334, 0.09283776565489717, 0.10941577943480711, 0.08002295469423096]",0.8210572789073675,0.8164427248653261,0.7408226001801763,0.9683106801168311,-0.001566815248179955
Gerald R. Ford,1976 State of the Union,19  - Address Before a Joint Session of the Congress Reporting on the State of the Union.,1976-01-19,Oral,40,5,200,204,"The protection of the lives and property of Americans from foreign enemies is one of my primary responsibilities as President. In a world of instant communications and intercontinental ballistic missiles, in a world economy that is global and interdependent, our relations with other nations become more, not less, important to the lives of Americans. America has had a unique role in the world since the day of our independence 200 years ago. And ever since the end of World War II, we have borne--successfully--a heavy responsibility for ensuring a stable world order and hope for human progress. Today, the state of our foreign policy is sound and strong.",5,108,0.10053385567294608,0.09132967661572776,0.08905905624797049,0.10019215481951418,0.0796344407992689,-0.03977474496861719,0.004291207909718925,0.048371729399477995,-0.0012274854178363048,0.00924866739495744,3.076923076923077,7.545784394817597e-05,0.000984968297475325,"[0.10053385567294608, 0.09132967661572776, 0.08905905624797049, 0.10019215481951418, 0.0796344407992689]",0.7839707947379182,0.8068756539354631,0.7744703992224691,0.9629853695180399,-0.0018701142293866442
Gerald R. Ford,1976 State of the Union,19  - Address Before a Joint Session of the Congress Reporting on the State of the Union.,1976-01-19,Oral,41,5,205,209,"We are at peace, and I will do all in my power to keep it that way. Our military forces are capable and ready. Our military power is without equal, and I intend to keep it that way. Our principal alliances with the industrial democracies of the Atlantic community and Japan have never been more solid.A further agreement to limit the strategic arms race may be achieved. We have an improving relationship with China, the world's most populous nation.The key elements for peace among the nations of the Middle East now exist.",5,92,0.11260646313104436,0.10584103051614523,0.11817969511422369,0.11615906497091254,0.08416850879982146,0.05826566807022801,0.06635020883150382,0.08878653270047776,0.09852895926164583,0.05424794317837684,2.9,0.00019054061605126827,0.0003784060288375317,"[0.11260646313104436, 0.10584103051614523, 0.11817969511422369, 0.11615906497091254, 0.08416850879982146]",0.7737091428996219,0.8036832985668266,0.7913416042477647,0.9643509972668086,-0.0031970696242476296
