president,speech_label,matched_title,document_date,document_type,block_idx,block_size,sentence_start,sentence_end,text,n_sentences,n_words,care_p,fairness_p,loyalty_p,authority_p,sanctity_p,care_sent,fairness_sent,loyalty_sent,authority_sent,sanctity_sent,moral_nonmoral_ratio,f_var,sent_var,moral_vector_R5,cosine_gonye,cosine_pergel,cosine_yasa,cosine_gpy_sum_vector,delta_vector_discriminant
Gerald R. Ford,1976 State of the Union,19  - Address Before a Joint Session of the Congress Reporting on the State of the Union.,1976-01-19,Oral,60,2,120,121,"My proposals, as all of you know, would reduce domestic natural gas shortages; allow production from Federal petroleum reserves; stimulate effective conservation, including revitalization of our railroads and the expansion of our urban transportation systems; develop more and cleaner energy from our vast coal resources; expedite clean and safe nuclear power production; create a new national energy independence authority to stimulate vital energy investment; and accelerate development of technology to capture energy from the Sun and the Earth for this and future generations. Also, I ask, for the sake of future generations, that we preserve the family farm and family-owned small business.",2,102,0.1255508393534019,0.10633090831366139,0.10149530519307479,0.09158432613697133,0.09445547194087615,0.04717438296505421,0.07983000758468581,0.047029406347823904,0.04981100128130615,0.028775299228293146,3.923076923076923,0.00018033106681436485,0.0003389471380141236,"[0.1255508393534019, 0.10633090831366139, 0.10149530519307479, 0.09158432613697133, 0.09445547194087615]",0.8159117811168651,0.7690650439509077,0.7177371760961657,0.937402161666134,-0.004301160204606844
Gerald R. Ford,1976 State of the Union,19  - Address Before a Joint Session of the Congress Reporting on the State of the Union.,1976-01-19,Oral,61,2,122,123,Both strengthen America and give stability to our economy. I will propose estate tax changes so that family businesses and family farms can be handed down from generation to generation without having to be sold to pay taxes.,2,38,0.11810649042799402,0.12723055941656883,0.097252027232595,0.09483329886776995,0.09556375673036287,-0.00015206687921131372,0.046746250706895455,0.038884935499452294,0.06198405758266787,0.10302802012458684,5.0,0.00022641444531288404,0.0014012254137858915,"[0.11810649042799402, 0.12723055941656883, 0.097252027232595, 0.09483329886776995, 0.09556375673036287]",0.815714801007151,0.8171414367016775,0.6974643345157234,0.9488677673946998,0.0009629959852639758
Gerald R. Ford,1976 State of the Union,19  - Address Before a Joint Session of the Congress Reporting on the State of the Union.,1976-01-19,Oral,62,2,124,125,"I propose tax changes to encourage people to invest in America's future, and their own, through a plan that gives moderate-income families income tax benefits if they make long-term investments in common stock in American companies. The Federal Government must and will respond to clear-cut national needs-for this and future generations.",2,51,0.14076317295095278,0.13377961756089438,0.09499488505106779,0.10386962576194682,0.0957539562986915,-0.03093651042456651,0.04647938733606063,0.06734528102427066,-0.012298403592800832,-0.0024480118476167506,9.666666666666666,0.00047602424666956,0.0017203430198749754,"[0.14076317295095278, 0.13377961756089438, 0.09499488505106779, 0.10386962576194682, 0.0957539562986915]",0.8483968845753802,0.8081334709170741,0.6770524669891186,0.950136945326272,-0.0002817313714760794
Gerald R. Ford,1976 State of the Union,19  - Address Before a Joint Session of the Congress Reporting on the State of the Union.,1976-01-19,Oral,63,2,126,127,"Hospital and medical services in America are among the best in the world, but the cost of a serious and extended illness can quickly wipe out a family's lifetime savings. Increasing health costs are of deep concern to all and a powerful force pushing up the cost of living.",2,49,0.12569185927083576,0.10248429974059992,0.10050543660281491,0.09776197849521966,0.07805157095845502,-0.014933413342943272,-0.0013688209800158068,0.009452041823271718,0.005766563275320091,-0.04811083336147392,3.0,0.00028729996399107374,0.0005445270271243106,"[0.12569185927083576, 0.10248429974059992, 0.10050543660281491, 0.09776197849521966, 0.07805157095845502]",0.8318459161068332,0.7803713029544724,0.7295380886651065,0.9532851976526955,-0.004448504860981757
Gerald R. Ford,1976 State of the Union,19  - Address Before a Joint Session of the Congress Reporting on the State of the Union.,1976-01-19,Oral,64,2,128,129,The burden of catastrophic illness can be borne by very few in our society. We must eliminate this fear from every family.,2,22,0.134886323595475,0.11590325553197385,0.16418232704160876,0.11405798237154181,0.11606847378449807,-0.14786300810614533,-0.19230906018518518,-0.17409833636555397,-0.21521619532428357,-0.09949076666666667,1.6666666666666667,0.0004586139958090259,0.001983050754916579,"[0.134886323595475, 0.11590325553197385, 0.16418232704160876, 0.11405798237154181, 0.11606847378449807]",0.7444411612651332,0.7383572343277666,0.7837780111626391,0.9225814589204978,-0.010421170369162062
Gerald R. Ford,1976 State of the Union,19  - Address Before a Joint Session of the Congress Reporting on the State of the Union.,1976-01-19,Oral,65,2,130,131,"I propose catastrophic health insurance for everybody covered by Medicare. To finance this added protection, fees for short-term care will go up somewhat, but nobody after reaching age 65 will have to pay more than $500 a year for covered hospital or nursing home care, nor more than $250 for 1 year's doctor bills.",2,54,0.14194178696543694,0.12882041206373138,0.08334916062102274,0.0706180078074486,0.08245884382417369,0.00021799881609312833,0.04655067018100251,0.04517744258201252,0.06336176028465298,-0.07814144902661249,2.2222222222222223,0.0010069099115758379,0.0032844702739218794,"[0.14194178696543694, 0.12882041206373138, 0.08334916062102274, 0.0706180078074486, 0.08245884382417369]",0.8900608297222697,0.7683980173897665,0.5907537783527486,0.9157239945215305,-0.0006242184708988019
Gerald R. Ford,1976 State of the Union,19  - Address Before a Joint Session of the Congress Reporting on the State of the Union.,1976-01-19,Oral,66,2,132,133,We cannot realistically afford federally dictated national health insurance providing full coverage for all 215 million Americans. The experience of other countries raises questions about the quality as well as the cost of such plans.,2,35,0.11640912474140978,0.10929761535128019,0.08510541184805363,0.0720258022093039,0.08001440597657766,-0.028690547542236242,0.03403341125958293,0.0139704590395694,0.04807694277248974,0.021468274649085267,2.4,0.00037088601577131515,0.0008424263840602043,"[0.11640912474140978, 0.10929761535128019, 0.08510541184805363, 0.0720258022093039, 0.08001440597657766]",0.8501099184386055,0.7808029112894441,0.6570980532502071,0.9315145194902279,-0.0013106839550367823
Gerald R. Ford,1976 State of the Union,19  - Address Before a Joint Session of the Congress Reporting on the State of the Union.,1976-01-19,Oral,67,2,134,135,"But I do envision the day when we may use the private health insurance system to offer more middle-income families high quality health services at prices they can afford and shield them also from their catastrophic illnesses. Using resources now available, I propose improving the Medicare and other Federal health programs to help those who really need protection--older people and the poor.",2,62,0.14171175478136158,0.1251389062197388,0.08753390587906118,0.07906834011834674,0.09052378200454723,0.007138484512931132,0.019008324445723115,0.06098577533765169,0.015786035099706518,0.0007891398404616881,3.7142857142857144,0.0007350488413215187,0.0005575752333991577,"[0.14171175478136158, 0.1251389062197388, 0.08753390587906118, 0.07906834011834674, 0.09052378200454723]",0.8715278178868233,0.7700215702802995,0.6256260155224787,0.9230105609258908,-0.0017936014919567173
Gerald R. Ford,1976 State of the Union,19  - Address Before a Joint Session of the Congress Reporting on the State of the Union.,1976-01-19,Oral,68,2,136,137,"To help States and local governments give better health care to the poor, I propose that we combine 16 existing Federal programs, including Medicaid, into a single $10 billion Federal grant. Funds would be divided among States under a new formula which provides a larger share of Federal money to those States that have a larger share of low-income families.",2,60,0.13527009265584955,0.1401068611718752,0.08908662030630426,0.0916775735721375,0.08236462064392713,0.01769345026042049,-0.0023068542984610828,0.050669052263522925,0.027750908029007235,0.03734837935745939,3.375,0.0007638430381961561,0.0004026058815360354,"[0.13527009265584955, 0.1401068611718752, 0.08908662030630426, 0.0916775735721375, 0.08236462064392713]",0.8700568424730278,0.8197033855568523,0.6375219033247207,0.947652269959394,0.0022702998746007355
Gerald R. Ford,1976 State of the Union,19  - Address Before a Joint Session of the Congress Reporting on the State of the Union.,1976-01-19,Oral,69,2,138,139,I will take further steps to improve the quality of medical and hospital care for those who have served in our Armed Forces. Now let me speak about social security.,2,30,0.12157093104903681,0.09371552204470185,0.1061953862843792,0.11097607157502629,0.08794333062851901,0.03425431785974349,0.019006212525870984,0.060599180943346195,0.05607814197016981,0.015604090976223643,13.0,0.00018144445816105847,0.0004274845456360979,"[0.12157093104903681, 0.09371552204470185, 0.1061953862843792, 0.11097607157502629, 0.08794333062851901]",0.7894772889519296,0.774412496140062,0.7788652064234364,0.9536549561968671,-0.005704055222313133
Gerald R. Ford,1976 State of the Union,19  - Address Before a Joint Session of the Congress Reporting on the State of the Union.,1976-01-19,Oral,70,2,140,141,Our Federal social security system for people who have worked and contributed to it for all their lives is a vital part of our economic system. Its value is no longer debatable.,2,32,0.11140514934481159,0.0837199471241969,0.09451725463139055,0.0787886460579693,0.07405683600490473,0.01306647955845323,0.04671768210016006,0.031161601175404997,-0.10908962639982854,0.045467924598557204,11.0,0.0002216543693182039,0.004285719497442022,"[0.11140514934481159, 0.0837199471241969, 0.09451725463139055, 0.0787886460579693, 0.07405683600490473]",0.81853320932252,0.746086188296755,0.7317679724029886,0.9347045817006141,-0.005156765043315952
Gerald R. Ford,1976 State of the Union,19  - Address Before a Joint Session of the Congress Reporting on the State of the Union.,1976-01-19,Oral,71,2,142,143,"In my budget for fiscal year 1977, I am recommending that the full cost-of-living increases in the social security benefits be paid during the coming year. But I am concerned about the integrity of our Social Security Trust Fund that enables people--those retired and those still working who will retire--to count on this source of retirement income.",2,57,0.1266425049778279,0.13990668134357337,0.10413110082292408,0.09230722544192584,0.09491553598707093,-0.013865389140684437,0.040930783787354603,0.08337448312340712,0.04798804906933934,0.057334714059980314,3.6666666666666665,0.0004334775573108697,0.0012745753404524197,"[0.1266425049778279, 0.13990668134357337, 0.10413110082292408, 0.09230722544192584, 0.09491553598707093]",0.8314377911329992,0.8155481587223921,0.6725835850884478,0.9445030309627791,0.0016127965767037192
Gerald R. Ford,1976 State of the Union,19  - Address Before a Joint Session of the Congress Reporting on the State of the Union.,1976-01-19,Oral,72,2,144,145,Younger workers watch their deductions rise and wonder if they will be adequately protected in the future. We must meet this challenge head on.,2,24,0.11231083893070755,0.09893394212421379,0.08515972154675697,0.10681910800393876,0.08482995153557057,0.01288002752582354,0.11693701714951715,0.012800181337225715,-0.04263803447420633,-0.012739852716727694,2.0,0.00015525355700544153,0.003615542778654678,"[0.11231083893070755, 0.09893394212421379, 0.08515972154675697, 0.10681910800393876, 0.08482995153557057]",0.8026383009861146,0.8100162111765747,0.7532498368720385,0.9632419250155082,-0.0017234123326562642
Gerald R. Ford,1976 State of the Union,19  - Address Before a Joint Session of the Congress Reporting on the State of the Union.,1976-01-19,Oral,73,2,146,147,"Simple arithmetic warns all of us that the Social Security Trust Fund is headed for trouble. Unless we act soon to make sure the fund takes in as much as it pays out, there will be no security for old or for young.",2,43,0.09670580582375386,0.09729884307314633,0.08668600185691845,0.08400836761172366,0.07817579719036367,-0.03185957630255169,0.0648426582116237,0.04643314025345012,-0.05302033426411813,0.009082884594284342,3.5,6.869532643295928e-05,0.0025043863546096133,"[0.09670580582375386, 0.09729884307314633, 0.08668600185691845, 0.08400836761172366, 0.07817579719036367]",0.7998680000750366,0.807837133625873,0.7344557534179266,0.9536100097281908,-0.0007760693696043201
Gerald R. Ford,1976 State of the Union,19  - Address Before a Joint Session of the Congress Reporting on the State of the Union.,1976-01-19,Oral,74,2,148,149,"I must, therefore, recommend a three-tenths of 1 percent increase in both employer and employee social security taxes effective January 1, 1977. This will cost each covered employee less than 1 extra dollar a week and will ensure the integrity of the trust fund.",2,44,0.11753565617474836,0.16304619432249653,0.09171671887841659,0.0922325693554855,0.09352129562958618,0.14229071098210364,0.21777957563340375,0.20207472324058476,0.16042903982983506,0.17534662617743565,3.2,0.0009448060410658201,0.000935097967891349,"[0.11753565617474836, 0.16304619432249653, 0.09171671887841659, 0.0922325693554855, 0.09352129562958618]",0.8307144169342123,0.8580782037211362,0.6291890774306726,0.9441087002651591,0.009129523632244424
Gerald R. Ford,1976 State of the Union,19  - Address Before a Joint Session of the Congress Reporting on the State of the Union.,1976-01-19,Oral,75,2,150,151,"As we rebuild our economy, we have a continuing responsibility to provide a temporary cushion to the unemployed. At my request, the Congress enacted two extensions and two expansions in unemployment insurance which helped those who were jobless during 1975.",2,40,0.16084246407955463,0.1337639467412032,0.10609066057504446,0.11266106424604924,0.0985728355804515,-0.1605306371505605,0.04870164582331246,-0.069028335692123,-0.10105505304208798,0.031229786155202815,1.125,0.000633884140856127,0.007881479402353456,"[0.16084246407955463, 0.1337639467412032, 0.10609066057504446, 0.11266106424604924, 0.0985728355804515]",0.8574661606429365,0.7846237758610369,0.683970412761289,0.9469518441203654,-0.0042959846476814945
Gerald R. Ford,1976 State of the Union,19  - Address Before a Joint Session of the Congress Reporting on the State of the Union.,1976-01-19,Oral,76,2,152,153,"These programs will continue in 1976. In my fiscal year 1977 budget, I am also requesting funds to continue proven job training and employment opportunity programs for millions of other Americans.",2,31,0.11175634012843312,0.1390648172631213,0.09348998111253103,0.07692297617137966,0.06590613045318351,-0.007396691381987569,0.09722133850931673,0.07453520961718019,0.021098716450216444,0.07473163748079877,1.6666666666666667,0.0008421295343308682,0.0018880953769384752,"[0.11175634012843312, 0.1390648172631213, 0.09348998111253103, 0.07692297617137966, 0.06590613045318351]",0.8580051502212171,0.8368754960994472,0.6289332100421913,0.9463475907460586,0.004211604475441291
Gerald R. Ford,1976 State of the Union,19  - Address Before a Joint Session of the Congress Reporting on the State of the Union.,1976-01-19,Oral,77,2,154,155,Compassion and a sense of community--two of America's greatest strengths throughout our history-- tell us we must take care of our neighbors who cannot take care of themselves. The host of Federal programs in this field reflect our generosity as a people.,2,42,0.14618483074250105,0.10019723172259411,0.10183246929002722,0.0808419730244639,0.08615005774946154,0.08694209095800755,0.07115414147077748,0.08346846657040137,0.13295351794024712,0.20033376180741927,2.6,0.0006622596059783528,0.00282702962474327,"[0.14618483074250105, 0.10019723172259411, 0.10183246929002722, 0.0808419730244639, 0.08615005774946154]",0.8568598006787125,0.7183375799618661,0.6733239066193399,0.9151505994646062,-0.008036991601923536
Gerald R. Ford,1976 State of the Union,19  - Address Before a Joint Session of the Congress Reporting on the State of the Union.,1976-01-19,Oral,78,2,156,157,"But everyone realizes that when it comes to welfare, government at all levels is not doing the job well. Too many of our welfare programs are inequitable and invite abuse.",2,30,0.11829213146167811,0.14623691963654498,0.1312856995723004,0.11147597920869587,0.07385210349803199,-0.05703046925475592,-0.03166431683076462,-0.15021131183388148,-0.1407205363687008,-0.0731990218233471,2.6666666666666665,0.0007374571292985614,0.0027421731929672386,"[0.11829213146167811, 0.14623691963654498, 0.1312856995723004, 0.11147597920869587, 0.07385210349803199]",0.8081359765375957,0.8406202626759811,0.724711700384871,0.9664853353448041,0.002570085222776977
Gerald R. Ford,1976 State of the Union,19  - Address Before a Joint Session of the Congress Reporting on the State of the Union.,1976-01-19,Oral,79,2,158,159,"Too many of our welfare programs have problems from beginning to end. Worse, we are wasting badly needed resources without reaching many of the truly needy.",2,26,0.12654923976554752,0.11741713646274432,0.10180541126733723,0.09326026155399493,0.06632666196722434,-0.03826041815476192,0.11237917779385036,-0.09866454675806649,-0.06093755952380948,0.0006289248885172835,1.6,0.000546263224093083,0.006525339778739164,"[0.12654923976554752, 0.11741713646274432, 0.10180541126733723, 0.09326026155399493, 0.06632666196722434]",0.857608746012475,0.802241220570196,0.6934937616639977,0.9581082252706292,-0.0019699180081940715
Gerald R. Ford,1976 State of the Union,19  - Address Before a Joint Session of the Congress Reporting on the State of the Union.,1976-01-19,Oral,80,2,160,161,"Complex welfare programs cannot be reformed overnight. Surely we cannot simply dump welfare into the laps of the 50 States, their local taxpayers, or their private charities, and just walk away from it.",2,33,0.11229195742913035,0.15107394014902123,0.1111658554945269,0.11029536425680168,0.05962765986653421,-0.04282700507636645,0.01253789381914381,-0.058043863728470084,0.031178018331879095,-0.07653454349399523,2.4,0.0010562477096582596,0.0021538674866858716,"[0.11229195742913035, 0.15107394014902123, 0.1111658554945269, 0.11029536425680168, 0.05962765986653421]",0.8294522371037315,0.8730729696864674,0.6934045289729789,0.9757753787901858,0.006612108721401826
Gerald R. Ford,1976 State of the Union,19  - Address Before a Joint Session of the Congress Reporting on the State of the Union.,1976-01-19,Oral,81,2,162,163,"Nor is it the right time for massive and sweeping changes while we are still recovering from the recession. Nevertheless, there are still plenty of improvements that we can make.",2,30,0.09826413322564154,0.10300216649329579,0.0882156511912771,0.1099139954627747,0.09124754201063527,-0.07749998032282551,-0.031982907509157485,0.09123506622343532,-0.043316721197142895,-0.0281008618044651,2.0,7.707026973086895e-05,0.00410275261105409,"[0.09826413322564154, 0.10300216649329579, 0.0882156511912771, 0.1099139954627747, 0.09124754201063527]",0.7640481543580551,0.8311188753035632,0.7747112386140608,0.9649750672186156,0.0006502847666801231
Gerald R. Ford,1976 State of the Union,19  - Address Before a Joint Session of the Congress Reporting on the State of the Union.,1976-01-19,Oral,82,2,164,165,I will ask Congress for Presidential authority to tighten up the rules for eligibility and benefits. Last year I twice sought long overdue reform of the scandal-riddled food stamp program.,2,30,0.10575878099677079,0.13135896025213734,0.09915504353815675,0.13586925304397648,0.11183126385662072,-0.0559308736151,-0.0094622681159721,-0.03879001491155903,-0.06394592007890676,-0.03363044561771956,1.7142857142857142,0.00025838523429967057,0.00045029224858926547,"[0.10575878099677079, 0.13135896025213734, 0.09915504353815675, 0.13586925304397648, 0.11183126385662072]",0.7443448047892555,0.8581704018225311,0.7734340303933942,0.9675927653699284,0.005377998438555118
Gerald R. Ford,1976 State of the Union,19  - Address Before a Joint Session of the Congress Reporting on the State of the Union.,1976-01-19,Oral,83,2,166,167,This year I say again: Let's give food stamps to those most in need. Let's not give any to those who don't need them.,2,24,0.14137909338815818,0.11369426348515829,0.10537851616067213,0.08113762094441485,0.10223508318455295,-0.02059766346992152,-0.02811745169082124,0.046359587513935346,0.024589068407452758,-0.03899171040723982,2.5,0.0004763392214733831,0.0013582186750289182,"[0.14137909338815818, 0.11369426348515829, 0.10537851616067213, 0.08113762094441485, 0.10223508318455295]",0.8348403330217932,0.7386310575628443,0.6724451531478525,0.9142139470625561,-0.0059115084631756465
Gerald R. Ford,1976 State of the Union,19  - Address Before a Joint Session of the Congress Reporting on the State of the Union.,1976-01-19,Oral,84,2,168,169,"Protecting the life and property of the citizen at home is the responsibility of all public officials, but is primarily the job of local and State law enforcement authorities. Americans have always found the very thought of a Federal police force repugnant, and so do I.",2,46,0.12104219473326452,0.12769965955353735,0.10253238652615002,0.12911527321861502,0.0914139262073958,-0.11323796224201971,-0.07065839843389955,0.005404593333174727,-0.061305104967426596,-0.05082183669697301,4.5,0.000276682767957228,0.0018234957915977345,"[0.12104219473326452, 0.12769965955353735, 0.10253238652615002, 0.12911527321861502, 0.0914139262073958]",0.797101444736912,0.8453300305675526,0.7559234518405211,0.9765952206149763,0.0016677593300056248
Gerald R. Ford,1976 State of the Union,19  - Address Before a Joint Session of the Congress Reporting on the State of the Union.,1976-01-19,Oral,85,2,170,171,But there are proper ways in which we can help to insure domestic tranquility as the Constitution charges us. My recommendations on how to control violent crime were submitted to the Congress last June with strong emphasis on protecting the innocent victims of crime.,2,44,0.15551948782555255,0.1637991486810465,0.11509523135781534,0.12530599891383604,0.11674197341313801,-0.2996124546863272,-0.14763621507677743,-0.16338901800369926,-0.20029226628297636,-0.16094303538460403,3.2,0.0005183854891577489,0.0038430693156828407,"[0.15551948782555255, 0.1637991486810465, 0.11509523135781534, 0.12530599891383604, 0.11674197341313801]",0.8306940399226014,0.8250575465496459,0.6880002274148355,0.9543556017259996,0.00250126692064416
Gerald R. Ford,1976 State of the Union,19  - Address Before a Joint Session of the Congress Reporting on the State of the Union.,1976-01-19,Oral,86,2,172,173,"To keep a convicted criminal from committing more crimes, we must put him in prison so he cannot harm more law-abiding citizens. To be effective, this punishment must be swift and it must be certain.",2,35,0.1823508340991075,0.18502572836748293,0.12145411848549022,0.11887677753316761,0.12947670546665913,-0.33616040079980275,-0.26055587055954804,-0.2690233840747043,-0.2101856844314816,-0.2456478861668634,5.5,0.0011113142326302468,0.002119126373243858,"[0.1823508340991075, 0.18502572836748293, 0.12145411848549022, 0.11887677753316761, 0.12947670546665913]",0.8535586988708602,0.8035699460139268,0.6413832906651667,0.9359020853944676,0.0021790545506731734
Gerald R. Ford,1976 State of the Union,19  - Address Before a Joint Session of the Congress Reporting on the State of the Union.,1976-01-19,Oral,87,2,174,175,"Too often, criminals are not sent to prison after conviction but are allowed to return to the streets. Some judges are reluctant to send convicted criminals to prison because of inadequate facilities.",2,32,0.14631883287385622,0.15442293677893743,0.129108199370949,0.10573534959537546,0.1451036141623979,-0.3312160542875927,-0.27371128422325536,-0.2614121642246643,-0.2906189377289377,-0.2921593371905872,6.5,0.00037302743915158777,0.0006965599761931721,"[0.14631883287385622, 0.15442293677893743, 0.129108199370949, 0.10573534959537546, 0.1451036141623979]",0.7830417356096555,0.779346886257106,0.6930621701803172,0.918314427501275,-0.0012837055351771903
Gerald R. Ford,1976 State of the Union,19  - Address Before a Joint Session of the Congress Reporting on the State of the Union.,1976-01-19,Oral,88,2,176,177,"To alleviate this problem at the Federal level, my new budget proposes the construction of four new Federal facilities. To speed Federal justice, I propose an increase this year in the United States attorneys prosecuting Federal crimes and the reinforcement of the number of United States marshals.",2,47,0.0766696801738099,0.09781345443122173,0.06398904749710872,0.07848597098871665,0.0617486128761055,-0.127706079366307,-0.020019365290372352,0.011690132636137178,0.01470205505343713,-0.025264542138361636,2.5,0.00020737146041097422,0.0033506353666338364,"[0.0766696801738099, 0.09781345443122173, 0.06398904749710872, 0.07848597098871665, 0.0617486128761055]",0.8067246471894691,0.8690987491165459,0.7086524337896577,0.9711116263248729,0.0029850656190735098
