president,speech_label,matched_title,document_date,document_type,block_idx,block_size,sentence_start,sentence_end,text,n_sentences,n_words,care_p,fairness_p,loyalty_p,authority_p,sanctity_p,care_sent,fairness_sent,loyalty_sent,authority_sent,sanctity_sent,moral_nonmoral_ratio,f_var,sent_var,moral_vector_R5,cosine_gonye,cosine_pergel,cosine_yasa,cosine_gpy_sum_vector,delta_vector_discriminant
Gerald R. Ford,1976 State of the Union,19  - Address Before a Joint Session of the Congress Reporting on the State of the Union.,1976-01-19,Oral,89,2,178,179,"Additional Federal judges are needed, as recommended by me and the Judicial Conference. Another major threat to every American's person and property is the criminal carrying a handgun.",2,28,0.12520279436652224,0.11998129434615445,0.0752525614297755,0.12035167026849945,0.07318306433278056,-0.18106497079970768,-0.20531820975155401,-0.11843608581170458,-0.1606407732291275,-0.22707076449200883,14.0,0.0006852918215954841,0.001752885047878483,"[0.12520279436652224, 0.11998129434615445, 0.0752525614297755, 0.12035167026849945, 0.07318306433278056]",0.8441685178267269,0.8482367708246006,0.7083541310943657,0.9775867630945962,0.0019584663660868543
Gerald R. Ford,1976 State of the Union,19  - Address Before a Joint Session of the Congress Reporting on the State of the Union.,1976-01-19,Oral,90,2,180,181,"The way to cut down on the criminal use of guns is not to take guns away from the law-abiding citizen, but to impose mandatory sentences for crimes in which a gun is used, make it harder to obtain cheap guns for criminal purposes, and concentrate gun control enforcement in highcrime areas. My budget recommends 500 additional Federal agents in the 11 largest metropolitan high-crime areas to help local authorities stop criminals from selling and using handguns.",2,77,0.14737475846500958,0.15202781182518835,0.11453695979420357,0.12269695953413229,0.10330839667713781,-0.2392571774339833,-0.20669780955827985,-0.13583795562901887,-0.1427501262861323,-0.1483203209049329,3.888888888888889,0.0004429418408997852,0.002104587078111866,"[0.14737475846500958, 0.15202781182518835, 0.11453695979420357, 0.12269695953413229, 0.10330839667713781]",0.8319154027639485,0.8261364437696289,0.7022252945001592,0.9610567968365609,0.001171720551281355
Gerald R. Ford,1976 State of the Union,19  - Address Before a Joint Session of the Congress Reporting on the State of the Union.,1976-01-19,Oral,91,2,182,183,The sale of hard drugs is tragically on the increase again. I have directed all agencies of the Federal Government to step up law enforcement efforts against those who deal in drugs.,2,32,0.12367309515915689,0.1396821744061239,0.1038844926685476,0.12722515119685726,0.11180538848658562,-0.11773314922139477,-0.03346676254105855,-0.0917775471091108,-0.0644544083575989,-0.13623249010382243,14.0,0.0001930200810994702,0.0016875716242524628,"[0.12367309515915689, 0.1396821744061239, 0.1038844926685476, 0.12722515119685726, 0.11180538848658562]",0.7852026659550592,0.8419605478866585,0.7384030599907239,0.9632918010337711,0.0033747083224998503
Gerald R. Ford,1976 State of the Union,19  - Address Before a Joint Session of the Congress Reporting on the State of the Union.,1976-01-19,Oral,92,2,184,185,"In 1975, I am glad to report, Federal agents seized substantially more heroin coming into our country than in 1974. As President, I have talked personally with the leaders of Mexico, Colombia, and Turkey to urge greater efforts by their Governments to control effectively the production and shipment of hard drugs.",2,51,0.10814928445272744,0.09058589294286959,0.09120894987268767,0.12023220054892626,0.10392955086216586,-0.1400279938058147,-0.012910561445921356,-0.05308248712443455,-0.03643842828712549,-0.0756604556195661,2.7142857142857144,0.00015432673937058926,0.0023511195465998834,"[0.10814928445272744, 0.09058589294286959, 0.09120894987268767, 0.12023220054892626, 0.10392955086216586]",0.7428509896521025,0.7922975799868307,0.799555489472437,0.9504975940324978,-0.0027771277629028077
Gerald R. Ford,1976 State of the Union,19  - Address Before a Joint Session of the Congress Reporting on the State of the Union.,1976-01-19,Oral,93,2,186,187,"I recommended months ago that the Congress enact mandatory fixed sentences for persons convicted of Federal crimes involving the sale of hard drugs. Hard drugs, we all know, degrade the spirit as they destroy the body of their users.",2,39,0.14646008751972825,0.1258784486575982,0.10340909571511919,0.12180671115618431,0.13327727190906563,-0.21825665830944757,-0.1362567075822776,-0.15128381593358506,-0.142476166141685,-0.2793532982267049,3.0,0.00024984573838274937,0.003832034105963258,"[0.14646008751972825, 0.1258784486575982, 0.10340909571511919, 0.12180671115618431, 0.13327727190906563]",0.7888614850886996,0.7793023303343478,0.7251959942783512,0.9336722129160766,-0.003813928567412174
Gerald R. Ford,1976 State of the Union,19  - Address Before a Joint Session of the Congress Reporting on the State of the Union.,1976-01-19,Oral,94,2,188,189,"It is unrealistic and misleading to hold out the hope that the Federal Government can move into every neighborhood and clean up crime. Under the Constitution, the greatest responsibility for curbing crime lies with State and local authorities.",2,38,0.12423271044177808,0.15049748529834542,0.08703055737142405,0.12503505639590357,0.1026706316821405,-0.22645846405424327,-0.12570365488054555,-0.06727092157081564,-0.17745930171288538,-0.14832242723833283,3.5,0.0005846160553522972,0.0035081393360248676,"[0.12423271044177808, 0.15049748529834542, 0.08703055737142405, 0.12503505639590357, 0.1026706316821405]",0.8108535085377891,0.8663772680009805,0.6974411219053084,0.9671238859404447,0.0074328526724802
Gerald R. Ford,1976 State of the Union,19  - Address Before a Joint Session of the Congress Reporting on the State of the Union.,1976-01-19,Oral,95,2,190,191,They are the frontline fighters in the war against crime. There are definite ways in which the Federal Government can help them.,2,22,0.14952743866278626,0.12723358661022707,0.11632475694090515,0.1359674748004041,0.08327694324049964,-0.22597860045436735,-0.22489376328605365,-0.16977735278279557,-0.19724214326528727,-0.2239586859159097,3.5,0.0006277095505934768,0.0006098315765900729,"[0.14952743866278626, 0.12723358661022707, 0.11632475694090515, 0.1359674748004041, 0.08327694324049964]",0.8321731069162553,0.8109161846622497,0.7456331613778578,0.972491692721207,-0.004065406337607103
Gerald R. Ford,1976 State of the Union,19  - Address Before a Joint Session of the Congress Reporting on the State of the Union.,1976-01-19,Oral,96,2,192,193,"I will propose in the new budget that Congress authorize almost $7 billion over the next 5 years to assist State and local governments to protect the safety and property of all their citizens. As President, I pledge the strict enforcement of Federal laws and--by example, support, and leadership--to help State and local authorities enforce their laws.",2,57,0.13141537321877597,0.13585700449945995,0.10812802431329459,0.14167874270069766,0.09348785066490926,0.008146156641564465,-0.0158530610494264,0.03329368533208192,0.007162122595185104,-0.0009496737093935664,5.0,0.0004183072033075362,0.00031902714314455534,"[0.13141537321877597, 0.13585700449945995, 0.10812802431329459, 0.14167874270069766, 0.09348785066490926]",0.8020392381021398,0.8477611291749193,0.756991312481303,0.9800274562294076,0.0018253192347735536
Gerald R. Ford,1976 State of the Union,19  - Address Before a Joint Session of the Congress Reporting on the State of the Union.,1976-01-19,Oral,97,2,194,195,"Together, we must protect the victims of crime and ensure domestic tranquility. Last year I strongly recommended a 5-year extension of the existing revenue sharing legislation, which thus far has provided $23½ billion to help State and local units of government solve problems at home.",2,45,0.15517573678054516,0.14263267013048928,0.11402789331689683,0.1255771598841875,0.1017101176297398,-0.019304944862952273,0.03698303569227492,0.05556028445113335,0.050925546891149504,-0.04187926962608397,3.5,0.0004611824789877999,0.0019551256937845062,"[0.15517573678054516, 0.14263267013048928, 0.11402789331689683, 0.1255771598841875, 0.1017101176297398]",0.8384030053030929,0.809871794065773,0.709517595905166,0.9599550063768295,-0.002073118874232553
Gerald R. Ford,1976 State of the Union,19  - Address Before a Joint Session of the Congress Reporting on the State of the Union.,1976-01-19,Oral,98,2,196,197,"This program has been effective with decisionmaking transferred from the Federal Government to locally elected officials. Congress must act this year, or State and local units of government will have to drop programs or raise local taxes.",2,37,0.10531354053049646,0.10588979482965616,0.09562534923605136,0.11779574682663475,0.07887482049438206,-0.13253208072860465,-0.07996968636593392,-0.05396378583074078,-0.10055893712077474,0.00246088984033055,3.2,0.00021064345671935398,0.0026022063588949304,"[0.10531354053049646, 0.10588979482965616, 0.09562534923605136, 0.11779574682663475, 0.07887482049438206]",0.7839663335980582,0.8368363937494185,0.780236582714101,0.9776329088182766,1.7658207826301564e-05
Gerald R. Ford,1976 State of the Union,19  - Address Before a Joint Session of the Congress Reporting on the State of the Union.,1976-01-19,Oral,99,2,198,199,"Including my health care program reforms, I propose to consolidate some 59 separate Federal programs and provide flexible Federal dollar grants to help States, cities, and local agencies in such important areas as education, child nutrition, and social services. This flexible system will do the job better and do it closer to home.",2,53,0.11356978213931135,0.10541190966195955,0.0791659724715386,0.09309123225474637,0.07385774162169709,0.0017517920423856595,0.060889570347936524,0.06600885816079614,0.005529753086007623,0.062041234649582604,3.0,0.0002837460669333102,0.0010617295894864468,"[0.11356978213931135, 0.10541190966195955, 0.0791659724715386, 0.09309123225474637, 0.07385774162169709]",0.8422097382767718,0.8163230958020788,0.7038197786254,0.9618402727271618,-0.0005294057101870864
Gerald R. Ford,1976 State of the Union,19  - Address Before a Joint Session of the Congress Reporting on the State of the Union.,1976-01-19,Oral,100,2,200,201,"The protection of the lives and property of Americans from foreign enemies is one of my primary responsibilities as President. In a world of instant communications and intercontinental ballistic missiles, in a world economy that is global and interdependent, our relations with other nations become more, not less, important to the lives of Americans.",2,54,0.11082037302041645,0.09240988626868563,0.09246670853776992,0.08676215995273029,0.07575807305705606,-0.03457633398547224,-0.013139777592236977,-0.012119179726430262,-0.023168930305565837,-0.05539320472811736,2.4285714285714284,0.00016129793721236294,0.00032237202061464337,"[0.11082037302041645, 0.09240988626868563, 0.09246670853776992, 0.08676215995273029, 0.07575807305705606]",0.8190654219609419,0.7775764188270304,0.7346058495300921,0.9490118009097801,-0.0035771820879345433
Gerald R. Ford,1976 State of the Union,19  - Address Before a Joint Session of the Congress Reporting on the State of the Union.,1976-01-19,Oral,101,2,202,203,"America has had a unique role in the world since the day of our independence 200 years ago. And ever since the end of World War II, we have borne--successfully--a heavy responsibility for ensuring a stable world order and hope for human progress.",2,43,0.09373502761675812,0.09059467053518952,0.08331480766342522,0.10858927189053783,0.08413962223422246,-0.04842737437014567,-0.03136208088988874,0.05900911178145227,-0.008680003120408838,0.029228359595301297,3.6,0.00010434485815868379,0.001935123668643667,"[0.09373502761675812, 0.09059467053518952, 0.08331480766342522, 0.10858927189053783, 0.08413962223422246]",0.758082195256916,0.823650713264588,0.7927145437000067,0.9667824044503317,-0.00039665142481590254
Gerald R. Ford,1976 State of the Union,19  - Address Before a Joint Session of the Congress Reporting on the State of the Union.,1976-01-19,Oral,102,2,204,205,"Today, the state of our foreign policy is sound and strong. We are at peace, and I will do all in my power to keep it that way.",2,28,0.10166782251756169,0.10095636985605942,0.10076184795808248,0.11871850190116934,0.09028009343496894,0.03668860196536386,0.1699178425802968,0.17457252578441002,0.13474218834148244,0.1711262565250457,8.0,0.00010461493612371928,0.003431629086431418,"[0.10166782251756169, 0.10095636985605942, 0.10076184795808248, 0.11871850190116934, 0.09028009343496894]",0.7534285688742997,0.8216440992610198,0.8009584092593842,0.9674121895406802,-0.000817911600589187
Gerald R. Ford,1976 State of the Union,19  - Address Before a Joint Session of the Congress Reporting on the State of the Union.,1976-01-19,Oral,103,2,206,207,"Our military forces are capable and ready. Our military power is without equal, and I intend to keep it that way.",2,21,0.12870721234072866,0.12796690448814663,0.10677854024853768,0.1655908326204407,0.08217318762088202,-0.03190985562277229,0.03184691086788917,0.08971337622453145,0.10883534797705315,0.08672753345782756,9.0,0.0009495807739012077,0.0032946064371668156,"[0.12870721234072866, 0.12796690448814663, 0.10677854024853768, 0.1655908326204407, 0.08217318762088202]",0.7818354827144502,0.8578414064915121,0.7923715296362471,0.9903184966377738,0.0021187481929478696
Gerald R. Ford,1976 State of the Union,19  - Address Before a Joint Session of the Congress Reporting on the State of the Union.,1976-01-19,Oral,104,2,208,209,"Our principal alliances with the industrial democracies of the Atlantic community and Japan have never been more solid.A further agreement to limit the strategic arms race may be achieved. We have an improving relationship with China, the world's most populous nation.The key elements for peace among the nations of the Middle East now exist.",2,54,0.10259160753307957,0.09185598318555657,0.12652183407329795,0.08862764440691845,0.08012144170070187,0.09128734568174204,0.07280782994911864,0.08526706325176969,0.07652333145358335,0.012303129547822637,1.7,0.0003199487175651429,0.001009424891668365,"[0.10259160753307957, 0.09185598318555657, 0.12652183407329795, 0.08862764440691845, 0.08012144170070187]",0.7558167934258913,0.7515214581091739,0.7819202518809575,0.9318477611911246,-0.005490351992395896
Gerald R. Ford,1976 State of the Union,19  - Address Before a Joint Session of the Congress Reporting on the State of the Union.,1976-01-19,Oral,105,2,210,211,"Our traditional friendships in Latin America, Africa, and Asia continue. We have taken the role of leadership in launching a serious and hopeful dialog between the industrial world and the developing world.",2,32,0.12290107738225514,0.09647073607560358,0.1298539114096362,0.11869283119571358,0.07941378964543987,-0.09241052214948557,-0.006698946670455622,-0.013354471853310679,0.0067803644631298865,0.010295337756977057,1.125,0.00043832872009688293,0.001773776630914836,"[0.12290107738225514, 0.09647073607560358, 0.1298539114096362, 0.11869283119571358, 0.07941378964543987]",0.7752890934659621,0.7690665562155835,0.8019753757619457,0.95507229327911,-0.007401865531731618
Gerald R. Ford,1976 State of the Union,19  - Address Before a Joint Session of the Congress Reporting on the State of the Union.,1976-01-19,Oral,106,2,212,213,"We have helped to achieve significant reform of the international monetary system. We should be proud of what America, what our country, has accomplished in these areas, and I believe the American people are.",2,34,0.10067078480396977,0.12308840752364124,0.11322002802933034,0.10059357142143233,0.09070381821355518,-0.026830453652754847,0.04303752013132015,0.046123012125589335,0.0725163606002604,0.02520056026695955,3.6666666666666665,0.00015878791090977239,0.0013675290035803243,"[0.10067078480396977, 0.12308840752364124, 0.11322002802933034, 0.10059357142143233, 0.09070381821355518]",0.7707396045028352,0.8284372710298629,0.7494407466341784,0.9563461486415248,0.001429659878118772
Gerald R. Ford,1976 State of the Union,19  - Address Before a Joint Session of the Congress Reporting on the State of the Union.,1976-01-19,Oral,107,2,214,215,"The American people have heard too much about how terrible our mistakes, how evil our deeds, and how misguided our purposes. The American people know better.",2,26,0.14585107224969454,0.1245674720372392,0.11201239961875038,0.128880133251002,0.14528777171068474,-0.32177576247165535,-0.2940047055424608,-0.16689249427741543,-0.15608853418462357,-0.179175222120098,1.6,0.0002076459307863474,0.006085600552500155,"[0.14585107224969454, 0.1245674720372392, 0.11201239961875038, 0.128880133251002, 0.14528777171068474]",0.7636930400536994,0.7717545529660674,0.7456548292218668,0.928662008814202,-0.004877311924130601
Gerald R. Ford,1976 State of the Union,19  - Address Before a Joint Session of the Congress Reporting on the State of the Union.,1976-01-19,Oral,108,2,216,217,The truth is we are the world's greatest democracy. We remain the symbol of man's aspiration for liberty and well-being.,2,20,0.08042971584480026,0.10912546219726416,0.1167704811061193,0.12814096156123467,0.12625329889110373,0.24120544199871943,0.08029474340592625,0.09643181283942286,0.13106919849105808,0.16969217572550907,2.0,0.0003728217029393514,0.004149235541923911,"[0.08042971584480026, 0.10912546219726416, 0.1167704811061193, 0.12814096156123467, 0.12625329889110373]",0.6491661516896028,0.8152800904866724,0.8303809429304648,0.9344760956603335,0.0030791800624388466
Gerald R. Ford,1976 State of the Union,19  - Address Before a Joint Session of the Congress Reporting on the State of the Union.,1976-01-19,Oral,109,2,218,219,We are the embodiment of hope for progress. I say it is time we quit downgrading ourselves as a nation.,2,20,0.08835470790589495,0.07998763554921168,0.0970087657683299,0.10013100279057724,0.0792257193574339,0.19163971173063074,0.16372275556680163,0.19853101843169124,0.22762480821011313,0.23056148125846754,1.3333333333333333,9.129953917862474e-05,0.0007640101905131971,"[0.08835470790589495, 0.07998763554921168, 0.0970087657683299, 0.10013100279057724, 0.0792257193574339]",0.7375323770517707,0.7920992670894753,0.8187518979378436,0.9560383266350527,-0.002537965984317374
Gerald R. Ford,1976 State of the Union,19  - Address Before a Joint Session of the Congress Reporting on the State of the Union.,1976-01-19,Oral,110,2,220,221,"Of course, it is our responsibility to learn the right lesson from past mistakes. It is our duty to see that they never happen again.",2,25,0.10168917823579902,0.12510436416744136,0.125643363391388,0.14005203540418554,0.11990003730480954,-0.14146376929012344,-0.08845415854162177,-0.1218190825586033,-0.04349315373563219,-0.0758775345427519,8.0,0.00019114625907998623,0.0014841467454158527,"[0.10168917823579902, 0.12510436416744136, 0.125643363391388, 0.14005203540418554, 0.11990003730480954]",0.7047924399160953,0.831331672534611,0.8146897903770772,0.9572523038106667,0.0025808598949663072
Gerald R. Ford,1976 State of the Union,19  - Address Before a Joint Session of the Congress Reporting on the State of the Union.,1976-01-19,Oral,111,2,222,223,But our greater duty is to look to the future. The world's troubles will not go away.,2,17,0.10679462707024337,0.09232805766496463,0.14862795933919776,0.12842290720129645,0.11743381490933935,0.010795693052475963,0.066627984962406,0.04897046287682215,-0.01595469254195554,0.04284082295482296,2.5,0.00045725896023924575,0.001086215403579575,"[0.10679462707024337, 0.09232805766496463, 0.14862795933919776, 0.12842290720129645, 0.11743381490933935]",0.6764372085129514,0.7474072522108011,0.8497191452430156,0.9254645631179138,-0.0071661359689698875
Gerald R. Ford,1976 State of the Union,19  - Address Before a Joint Session of the Congress Reporting on the State of the Union.,1976-01-19,Oral,112,2,224,225,"The American people want strong and effective international and defense policies. In our constitutional system, these policies should reflect consultation and accommodation between the President and the Congress.",2,28,0.1080464043983135,0.10886845208334384,0.11125981825305399,0.11369315998474293,0.0868811363873163,0.07188341024320957,0.04900166077101051,0.12655584901235167,0.08282516737661223,0.18206123498586038,2.75,0.000116121029525987,0.0027738037320057135,"[0.1080464043983135, 0.10886845208334384, 0.11125981825305399, 0.11369315998474293, 0.0868811363873163]",0.7726556021980273,0.8164120496371153,0.7832757395519445,0.9658877430878628,-0.001466569282563522
Gerald R. Ford,1976 State of the Union,19  - Address Before a Joint Session of the Congress Reporting on the State of the Union.,1976-01-19,Oral,113,2,226,227,"But in the final analysis, as the framers of our Constitution knew from hard experience, the foreign relations of the United States can be conducted effectively only if there is strong central direction that allows flexibility of action. That responsibility clearly rests with the President.",2,45,0.08272523808951236,0.09631204460409765,0.07696822199241891,0.08623557279879397,0.06320471491180836,-9.288984335092214e-06,0.04082572564318892,0.05971542483823655,0.08515868317476978,0.013965743156366454,4.75,0.0001494335095137757,0.0011767971430725306,"[0.08272523808951236, 0.09631204460409765, 0.07696822199241891, 0.08623557279879397, 0.06320471491180836]",0.798263085913612,0.8518835330618725,0.7430795107580781,0.9745557734750413,0.0015709797502388226
Gerald R. Ford,1976 State of the Union,19  - Address Before a Joint Session of the Congress Reporting on the State of the Union.,1976-01-19,Oral,114,2,228,229,"I pledge to the American people policies which seek a secure, just, and peaceful world. I pledge to the Congress to work with you to that end.",2,27,0.14307520140673372,0.1321615465242664,0.13271127131600985,0.146983707824551,0.11465886648852716,-0.028582034292126662,-0.03893984101871141,0.1349539760630825,0.017550905334096388,0.07824773435486658,5.0,0.00015750565125786847,0.00541192671069827,"[0.14307520140673372, 0.1321615465242664, 0.13271127131600985, 0.146983707824551, 0.11465886648852716]",0.7773402350990735,0.8085253104862095,0.7822347702410444,0.9641226296279344,-0.0038017172014099335
Gerald R. Ford,1976 State of the Union,19  - Address Before a Joint Session of the Congress Reporting on the State of the Union.,1976-01-19,Oral,115,2,230,231,"We must not face a future in which we can no longer help our friends, such as Angola, even in limited and carefully controlled ways. We must not lose all capacity to respond short of military intervention.",2,37,0.12487007775193172,0.10866866359242786,0.09653793523322388,0.11011865810011591,0.09153234578465248,-0.03551782347046195,-0.0202269925111388,-0.00370906182332467,-0.032095842757129164,-0.07074981569664902,15.0,0.00016960291411716982,0.0006129639497939807,"[0.12487007775193172, 0.10866866359242786, 0.09653793523322388, 0.11011865810011591, 0.09153234578465248]",0.8112349717246777,0.8004962169731952,0.7428912375161586,0.9586156518611085,-0.00279470120810571
Gerald R. Ford,1976 State of the Union,19  - Address Before a Joint Session of the Congress Reporting on the State of the Union.,1976-01-19,Oral,116,2,232,233,"Some hasty actions of the Congress during the past year--most recently in respect to Angola--were, in my view, very shortsighted. Unfortunately, they are still very much on the minds of our allies and our adversaries.",2,35,0.08809026583905785,0.10802809599443622,0.11421298593138848,0.11718680445100094,0.08587155344940067,-0.1315429383116883,-0.01252126680095123,0.01156763154504226,-0.01815623276723277,-0.042389408996800305,1.0,0.0002168608669438853,0.0030668970612255844,"[0.08809026583905785, 0.10802809599443622, 0.11421298593138848, 0.11718680445100094, 0.08587155344940067]",0.7255732917120491,0.8365635364335586,0.8136993021435257,0.9674203056504782,0.0012986914924125528
Gerald R. Ford,1976 State of the Union,19  - Address Before a Joint Session of the Congress Reporting on the State of the Union.,1976-01-19,Oral,117,2,234,235,A strong defense posture gives weight to our values and our views in international negotiations. It assures the vigor of our alliances.,2,22,0.07912934280096827,0.08260715303577554,0.12320354591806788,0.10444210354716926,0.08254769841870196,0.04812977867690287,0.14710002125446567,0.17859673861324699,0.055485557480787664,0.04915456598829014,3.0,0.00036080709507790165,0.003890109001646541,"[0.07912934280096827, 0.08260715303577554, 0.12320354591806788, 0.10444210354716926, 0.08254769841870196]",0.681256112941028,0.7777322875692276,0.8499398720677639,0.9399693230066658,-0.002654375442617894
Gerald R. Ford,1976 State of the Union,19  - Address Before a Joint Session of the Congress Reporting on the State of the Union.,1976-01-19,Oral,118,2,236,237,And it sustains our efforts to promote settlements of international conflicts. Only from a position of strength can we negotiate a balanced agreement to limit the growth of nuclear arms.,2,30,0.12550156588861253,0.113235530635473,0.10664957563060501,0.10824245222073182,0.10976281004289046,0.02871805358731266,0.0795862818940319,0.07985824871452953,0.09530093804385661,0.030005677762408534,6.5,5.731724968160035e-05,0.0009665160938339973,"[0.12550156588861253, 0.113235530635473, 0.10664957563060501, 0.10824245222073182, 0.10976281004289046]",0.7854151944114032,0.7856736755066958,0.7457207205087163,0.9432096365421409,-0.003372977122532733
