president,speech_label,matched_title,document_date,document_type,block_idx,block_size,sentence_start,sentence_end,text,n_sentences,n_words,care_p,fairness_p,loyalty_p,authority_p,sanctity_p,care_sent,fairness_sent,loyalty_sent,authority_sent,sanctity_sent,moral_nonmoral_ratio,f_var,sent_var,moral_vector_R5,cosine_gonye,cosine_pergel,cosine_yasa,cosine_gpy_sum_vector,delta_vector_discriminant
Gerald R. Ford,1976 State of the Union,19  - Address Before a Joint Session of the Congress Reporting on the State of the Union.,1976-01-19,Oral,0,5,0,4,"Mr. Speaker, Mr. Vice President, Members of the 94th Congress, and distinguished guests: As we begin our Bicentennial, America is still one of the youngest nations in recorded history. Long before our forefathers came to these shores, men and women had been struggling on this planet to forge a better life for themselves and their families. In man's long, upward march from savagery and slavery--throughout the nearly 2,000 years of the Christian calendar, the nearly 6,000 years of Jewish reckoning--there have been many deep, terrifying valleys, but also many bright and towering peaks. One peak stands highest in the ranges of human history. One example shines forth of a people uniting to produce abundance and to share the good life fairly and with freedom.",5,124,0.10801886568739924,0.09524743848092926,0.08807861483427949,0.08212966920057661,0.09143948214144149,-0.09378350012963263,-0.054091811031104345,0.01866717805709251,-0.02925038611501483,0.024237649583162192,0.9411764705882353,9.385879227642798e-05,0.0024774332074641234,"[0.10801886568739924, 0.09524743848092926, 0.08807861483427949, 0.08212966920057661, 0.09143948214144149]",0.7992273558471483,0.772221097153635,0.7215371261436461,0.933479239565827,-0.0027718554544386292
Gerald R. Ford,1976 State of the Union,19  - Address Before a Joint Session of the Congress Reporting on the State of the Union.,1976-01-19,Oral,1,5,5,9,"One union holds out the promise of justice and opportunity for every citizen: That union is the United States of America. We have not remade paradise on Earth. We know perfection will not be found here. But think for a minute how far we have come in 200 years. We came from many roots, and we have many branches.",5,59,0.0636152269330779,0.09062423596401194,0.0753701195408062,0.07418698014873328,0.0524212663006138,0.0023912414481162833,0.093013767557275,0.18453513595973642,0.14289419049567953,0.13185984093668177,1.5555555555555556,0.00020344325553087536,0.004744784214486304,"[0.0636152269330779, 0.09062423596401194, 0.0753701195408062, 0.07418698014873328, 0.0524212663006138]",0.7731834824580599,0.8676932415646503,0.7476334858605053,0.9727375527772529,0.002394272263546649
Gerald R. Ford,1976 State of the Union,19  - Address Before a Joint Session of the Congress Reporting on the State of the Union.,1976-01-19,Oral,2,5,10,14,"Yet all Americans across the eight generations that separate us from the stirring deeds of 1776, those who know no other homeland and those who just found refuge among our shores, say in unison: I am proud of America, and I am proud to be an American. Life will be a little better here for my children than for me. I believe this not because I am told to believe it, but because life has been better for me than it was for my father and my mother. I know it will be better for my children because my hands, my brains, my voice, and my vote can help make it happen. It has happened here in America.",5,118,0.12404533150152863,0.10476433742972711,0.11091757613539398,0.08304260759712641,0.10319484518645827,0.010420639157043011,0.012522921597702371,0.05412250902875576,0.046081670088003616,-0.005366160565702716,2.0,0.0002207493582036263,0.0006431187954784927,"[0.12404533150152863, 0.10476433742972711, 0.11091757613539398, 0.08304260759712641, 0.10319484518645827]",0.7956600622608836,0.7432460632653327,0.7157568033414612,0.9177840312631684,-0.005580077145397665
Gerald R. Ford,1976 State of the Union,19  - Address Before a Joint Session of the Congress Reporting on the State of the Union.,1976-01-19,Oral,3,5,15,19,"It has happened to you and to me. Government exists to create and preserve conditions in which people can translate their ideas into practical reality. In the best of times, much is lost in translation. But we try. Sometimes we have tried and failed.",5,44,0.1337416484402313,0.12514350348262412,0.09840015889445529,0.09730638595095302,0.10858236264295947,-0.07558002588482396,-0.0498945694234476,-0.032463803940256525,-0.07365597193912247,-0.06792060924479983,3.5,0.00026399356177245567,0.00033806839969116614,"[0.1337416484402313, 0.12514350348262412, 0.09840015889445529, 0.09730638595095302, 0.10858236264295947]",0.8195020573071822,0.7874968046471601,0.6915454575733762,0.9358208298050912,-0.0018287321224716782
Gerald R. Ford,1976 State of the Union,19  - Address Before a Joint Session of the Congress Reporting on the State of the Union.,1976-01-19,Oral,4,5,20,24,"Always we have had the best of intentions. But in the recent past, we sometimes forgot the sound principles that guided us through most of our history. We wanted to accomplish great things and solve age-old problems. And we became overconfident of our abilities. We tried to be a policeman abroad and the indulgent parent here at home.",5,58,0.09997467466147796,0.08948242507416489,0.08756032230493564,0.07403096302882746,0.09908648328189634,-0.07831579962816645,0.040465364546957316,0.0680700585155163,0.023256542891098367,-0.008516783567259325,2.125,0.00011082118199659968,0.0031533690589003543,"[0.09997467466147796, 0.08948242507416489, 0.08756032230493564, 0.07403096302882746, 0.09908648328189634]",0.7694968181608373,0.7521423079724268,0.722504220870114,0.913574108155374,-0.0028873803476575886
Gerald R. Ford,1976 State of the Union,19  - Address Before a Joint Session of the Congress Reporting on the State of the Union.,1976-01-19,Oral,5,5,25,29,"We thought we could transform the country through massive national programs, but often the programs did not work. Too often they only made things worse. In our rush to accomplish great deeds quickly, we trampled on sound principles of restraint and endangered the rights of individuals. We unbalanced our economic system by the huge and unprecedented growth of Federal expenditures and borrowing. And we were not totally honest with ourselves about how much these programs would cost and how we would pay for them.",5,84,0.10812451480713554,0.1272231576579783,0.105415975681043,0.09367511153265266,0.0943801149053501,0.02650522303446813,0.08012414389360782,0.08650184123353633,0.01672390195907426,0.09668670176565886,2.1818181818181817,0.00018548066561052578,0.0013598511319319678,"[0.10812451480713554, 0.1272231576579783, 0.105415975681043, 0.09367511153265266, 0.0943801149053501]",0.7936895706597308,0.8224036318024733,0.7150771105168066,0.9492426359744567,0.001524112558278251
Gerald R. Ford,1976 State of the Union,19  - Address Before a Joint Session of the Congress Reporting on the State of the Union.,1976-01-19,Oral,6,5,30,34,"Finally, we shifted our emphasis from defense to domestic problems while our adversaries continued a massive buildup of arms. The time has now come for a fundamentally different approach for a new realism that is true to the great principles upon which this Nation was founded. We must introduce a new balance to our economy--a balance that favors not only sound, active government but also a much more vigorous, healthy economy that can create new jobs and hold down prices. We must introduce a new balance in the relationship between the individual and the government--a balance that favors greater individual freedom and self-reliance. We must strike a new balance in our system of federalism--a balance that favors greater responsibility and freedom for the leaders of our State and local governments.",5,130,0.10203012803715283,0.1007270023990422,0.08505717562044676,0.09809607228414272,0.08174451406255123,0.0011865418506390346,0.10090594327738045,0.06632082128816957,0.0595274123055599,0.08670067640193037,2.8823529411764706,8.889611581131484e-05,0.0014606368014679688,"[0.10203012803715283, 0.1007270023990422, 0.08505717562044676, 0.09809607228414272, 0.08174451406255123]",0.7971935585751625,0.8214325057277185,0.7481223203515309,0.9636506469271195,-0.00034020147907483714
Gerald R. Ford,1976 State of the Union,19  - Address Before a Joint Session of the Congress Reporting on the State of the Union.,1976-01-19,Oral,7,5,35,39,"We must introduce a new balance between the spending on domestic programs and spending on defense--a balance that ensures we will fully meet our obligation to the needy while also protecting our security in a world that is still hostile to freedom. And in all that we do, we must be more honest with the American people, promising them no more than we can deliver and delivering all that we promise. The genius of America has been its incredible ability to improve the lives of its citizens through a unique combination of governmental and free citizen activity. History and experience tells us that moral progress cannot come in comfortable and in complacent times, but out of trial and out of confusion. Tom Paine aroused the troubled Americans of 1776 to stand up to the times that try men's souls because the harder the conflict, the more glorious the triumph.",5,149,0.11175801980098546,0.1193034789224511,0.10864228139362948,0.11375987983910818,0.09515816661969168,-0.00358875039235029,0.03877313322990906,0.03643138604975255,0.05030786353207871,0.06326829617492219,2.0476190476190474,8.138139889780059e-05,0.0006295073075231847,"[0.11175801980098546, 0.1193034789224511, 0.10864228139362948, 0.11375987983910818, 0.09515816661969168]",0.7792334100053211,0.8250628687073451,0.7623662317510047,0.9636369544825403,5.6688406645133416e-05
Gerald R. Ford,1976 State of the Union,19  - Address Before a Joint Session of the Congress Reporting on the State of the Union.,1976-01-19,Oral,8,5,40,44,"Just a year ago I reported that the state of the Union was not good. Tonight, I report that the state of our Union is better--in many ways a lot better--but still not good enough. To paraphrase Tom Paine, 1975 was not a year for summer soldiers and sum shine patriots. It was a year of fears and alarms and of dire forecasts--most of which never happened and won't happen. As you recall, the year 1975 opened with rancor and with bitterness.",5,82,0.08408211581679008,0.07777442604528673,0.07346183347472889,0.07758135256732707,0.06637528686200474,-0.04812956270516192,-0.07420155315028024,0.0011255726348935902,-0.07462077219015434,-0.04583236450862685,0.7619047619047619,4.248553284730847e-05,0.0009531684931240829,"[0.08408211581679008, 0.07777442604528673, 0.07346183347472889, 0.07758135256732707, 0.06637528686200474]",0.7939480206933197,0.8031431374728306,0.7563077276677126,0.9581353083156506,-0.0012179539336289284
Gerald R. Ford,1976 State of the Union,19  - Address Before a Joint Session of the Congress Reporting on the State of the Union.,1976-01-19,Oral,9,5,45,49,"Political misdeeds of the past had neither been forgotten nor forgiven. The longest, most divisive war in our history was winding toward an unhappy conclusion. Many feared that the end of that foreign war of men and machines meant the beginning of a domestic war of recrimination and reprisal. Friends and adversaries abroad were asking whether America had lost its nerve. Finally, our economy was ravaged by inflation--inflation that was plunging us into the worse recession in four decades.",5,79,0.10697761191981003,0.09958299888943103,0.1097119505477201,0.08156813558499934,0.09352358623039693,-0.24762468473678984,-0.15898960971963325,-0.1259910366503073,-0.16132280863479026,-0.12856446135857408,1.105263157894737,0.00012748634539341936,0.0024311188358431177,"[0.10697761191981003, 0.09958299888943103, 0.1097119505477201, 0.08156813558499934, 0.09352358623039693]",0.7768137732869755,0.7605520927600596,0.7394542138293152,0.9268616503553697,-0.003848912030246933
Gerald R. Ford,1976 State of the Union,19  - Address Before a Joint Session of the Congress Reporting on the State of the Union.,1976-01-19,Oral,10,5,50,54,"At the same time, Americans became increasingly alienated from big institutions. They were steadily losing confidence, not just in big government but in big business, big labor, and big education, among others. Ours was a troubled land. And so, 1975 was a year of hard decisions, difficult compromises, and a new realism that taught us something important about America. It brought back a needed measure of common sense, steadfastness, and self-discipline.",5,71,0.10196998153699387,0.10277279845248745,0.10587049889762247,0.10099744111057815,0.07692230399456669,-0.02718056346739652,-0.036374141702511256,0.0018216063758328459,0.027709226256611243,0.006682566813560534,2.3636363636363638,0.00013832715743924872,0.00068203199600205,"[0.10196998153699387, 0.10277279845248745, 0.10587049889762247, 0.10099744111057815, 0.07692230399456669]",0.7834820972325005,0.8124695593113219,0.7721434869431516,0.964143674394843,-0.0015527680415606537
Gerald R. Ford,1976 State of the Union,19  - Address Before a Joint Session of the Congress Reporting on the State of the Union.,1976-01-19,Oral,11,5,55,59,"Americans did not panic or demand instant but useless cures. In all sectors, people met their difficult problems with the restraint and with responsibility worthy of their great heritage. Add up the separate pieces of progress in 1975, subtract the setbacks, and the sum total shows that we are not only headed in a new direction, a direction which I proposed 12 months ago, but it turned out to be the right direction. It is the right direction because it follows the truly revolutionary American concept of 1776, which holds that in a free society the making of public policy and successful problemsolving involves much more than government. It involves a full partnership among all branches and all levels of government, private institutions, and individual citizens.Common sense tells me to stick to that steady course.",5,135,0.10569212858742047,0.11594130340564299,0.10024884378832899,0.11419868767268351,0.084904191897673,-0.04407739494093819,0.04900095719315612,0.07590707069810716,0.008150159236203661,-0.02445209155329634,2.1904761904761907,0.0001569995525546932,0.0024843332921039994,"[0.10569212858742047, 0.11594130340564299, 0.10024884378832899, 0.11419868767268351, 0.084904191897673]",0.7842531728858737,0.8412556759857088,0.7645489256582852,0.9732098545565829,0.0011850816278441562
Gerald R. Ford,1976 State of the Union,19  - Address Before a Joint Session of the Congress Reporting on the State of the Union.,1976-01-19,Oral,12,5,60,64,"Take the state of our economy. Last January, most things were rapidly getting worse. This January, most things are slowly but surely getting better. The worst recession since World War II turned around in April. The best cost-of-living news of the past year is that double-digit inflation of 12 percent or higher was cut almost in half.",5,57,0.09780060763146549,0.09878946766054782,0.0771598201098222,0.07465081291743768,0.08830052751002883,-0.10594482495276093,-0.08148178018162197,-0.03314485103127114,-0.0747801630404463,-0.10195161643112421,0.9411764705882353,0.00012652219148352967,0.0008446000633589213,"[0.09780060763146549, 0.09878946766054782, 0.0771598201098222, 0.07465081291743768, 0.08830052751002883]",0.8013125739957175,0.7938909402417623,0.6966678089362652,0.9331546870610593,-0.0003303788709515948
Gerald R. Ford,1976 State of the Union,19  - Address Before a Joint Session of the Congress Reporting on the State of the Union.,1976-01-19,Oral,13,5,65,69,"The worst--unemployment remains far too high. Today, nearly 1,700,000 more Americans are working than at the bottom of the recession. At year's end, people were again being hired much faster than they Were being laid off. Yet, let's be honest. Many Americans have not yet felt these changes in their daily lives.",5,52,0.12396553957407735,0.10665261710474697,0.10745900417499944,0.09446325273970421,0.08846805512187358,-0.0867063299200799,-0.022794432518815626,0.013217225595084372,-0.019991173297491338,-0.008569153046265513,1.3,0.00018740282901125914,0.0013920370532793367,"[0.12396553957407735, 0.10665261710474697, 0.10745900417499944, 0.09446325273970421, 0.08846805512187358]",0.8146088082847849,0.7747180592866831,0.7302085986786037,0.9442500838739493,-0.004430064380469986
Gerald R. Ford,1976 State of the Union,19  - Address Before a Joint Session of the Congress Reporting on the State of the Union.,1976-01-19,Oral,14,5,70,74,"They still see prices going up far too fast, and they still know the fear of unemployment. We are also a growing nation. We need more and more jobs every year. Today's economy has produced over 85 million jobs for Americans, but we need a lot more jobs, especially for the young.My first objective is to have sound economic growth without inflation. We all know from recent experience what runaway inflation does to ruin every other worthy purpose.",5,78,0.11040256011617879,0.10835814045599323,0.09186621202590654,0.07721214721659052,0.07747144522913513,-0.03420462319233141,0.026836367646434812,0.021482014285429677,0.012529860871483495,-0.019817286608189568,2.1818181818181817,0.0002575950195348367,0.0007230065778650398,"[0.11040256011617879, 0.10835814045599323, 0.09186621202590654, 0.07721214721659052, 0.07747144522913513]",0.8339370994933881,0.7929487652524182,0.68762944796335,0.9423231593751022,-0.0012159190466998204
Gerald R. Ford,1976 State of the Union,19  - Address Before a Joint Session of the Congress Reporting on the State of the Union.,1976-01-19,Oral,15,5,75,79,"We are slowing it. We must stop it cold. For many Americans, the way to a healthy, noninflationary economy has become increasingly apparent. The Government must stop spending so much and stop borrowing so much of our money. More money must remain in private hands where it will do the most good.",5,52,0.1285453786585514,0.12407981088590135,0.10693185175263696,0.10522859431955148,0.10172142427021111,-0.10896296089460661,-0.044129123255462664,0.00646812634748349,-0.03410115311132736,-0.04571146364276196,4.25,0.0001470975502248093,0.0017149662792889993,"[0.1285453786585514, 0.12407981088590135, 0.10693185175263696, 0.10522859431955148, 0.10172142427021111]",0.80964077056646,0.8008947185449385,0.7219488198075921,0.9496492043370334,-0.0017774533001503057
Gerald R. Ford,1976 State of the Union,19  - Address Before a Joint Session of the Congress Reporting on the State of the Union.,1976-01-19,Oral,16,5,80,84,"To hold down the cost of living, we must hold down the cost of government. In the past decade, the Federal budget has been growing at an average rate of over 10 percent a year. The budget I am submitting Wednesday cuts this rate of growth in half. I have kept my promise to submit a budget for the next fiscal year of $395 billion. In fact, it is $394.2 billion.",5,71,0.095081495109101,0.1228162942659622,0.08889923136564437,0.08712071487402058,0.07279185129612362,-0.053846813423990905,0.03206657043033144,0.04935992963807679,-0.024968155993975807,-0.01611561289077731,2.1,0.0003381277647963923,0.0018026991635278831,"[0.095081495109101, 0.1228162942659622, 0.08889923136564437, 0.08712071487402058, 0.07279185129612362]",0.8130848041460232,0.8547014957978945,0.6967041550939049,0.9629307743801567,0.0036959030250163713
Gerald R. Ford,1976 State of the Union,19  - Address Before a Joint Session of the Congress Reporting on the State of the Union.,1976-01-19,Oral,17,5,85,89,"By holding down the growth of Federal spending, we can afford additional tax cuts and return to the people who pay taxes more decisionmaking power over their own lives. Last month I signed legislation to extend the 1975 tax reductions for the first 6 months of this year. I now propose that effective July 1, 1976, we give our taxpayers a tax cut of approximately $10 billion more than Congress agreed to in December. My broader tax reduction would mean that for a family of four making $15,000 a year, there will be $227 more in take-home pay annually. Hardworking Americans caught in the middle can really use that kind of extra cash.",5,113,0.1341845959827403,0.140079379259113,0.100125359744238,0.1067506504170837,0.09595942437123288,-0.04577026656659941,-0.0044072643736306275,0.010397496904865805,0.01935472937449007,-0.026202792502941295,1.7,0.000411998173579381,0.0007122013044529096,"[0.1341845959827403, 0.140079379259113, 0.100125359744238, 0.1067506504170837, 0.09595942437123288]",0.8362507275755919,0.8245774925987936,0.6870210253570789,0.9560128224697401,0.001535445595246425
Gerald R. Ford,1976 State of the Union,19  - Address Before a Joint Session of the Congress Reporting on the State of the Union.,1976-01-19,Oral,18,5,90,94,"My recommendations for a firm restraint on the growth of Federal spending and for greater tax reduction are simple and straightforward. For every dollar saved in cutting the growth in the Federal budget, we can have an added dollar of Federal tax reduction. We can achieve a balanced budget by 1979 if we have the courage and the wisdom to continue to reduce the growth of Federal spending. One test of a healthy economy is a job for every American who wants to work. Government--our kind of government--cannot create that many jobs.",5,92,0.12595731237861438,0.11858635229087687,0.08730640751725903,0.10077147681226244,0.07867289724795364,-0.03375082619835438,0.046006349718820914,0.060985019544152176,0.035897722467027,0.03729154920952625,3.888888888888889,0.00040257235814563226,0.0013414607710155065,"[0.12595731237861438, 0.11858635229087687, 0.08730640751725903, 0.10077147681226244, 0.07867289724795364]",0.8494528320452182,0.8182832093238335,0.6947346059476206,0.9618996271733005,-0.0003084097322407914
Gerald R. Ford,1976 State of the Union,19  - Address Before a Joint Session of the Congress Reporting on the State of the Union.,1976-01-19,Oral,19,5,95,99,"But the Federal Government can create conditions and incentives for private business and industry to make more and more jobs. Five out of six jobs in this country are in private business and in industry. Common sense tells us this is the place to look for more jobs and to find them faster. I mean real, rewarding, permanent jobs. To achieve this we must offer the American people greater incentives to invest in the future.",5,75,0.12027441553840512,0.11797217620759218,0.10893294380026683,0.10087216292037905,0.08522986777423056,-0.047477153279229405,0.012864506948489247,0.07842833452405072,0.06131747275726086,0.030537213049603537,5.8,0.00020280836795916372,0.0023954107621621036,"[0.12027441553840512, 0.11797217620759218, 0.10893294380026683, 0.10087216292037905, 0.08522986777423056]",0.814393681274341,0.8059597122076234,0.730915210459114,0.9572889330659086,-0.001822079048860295
Gerald R. Ford,1976 State of the Union,19  - Address Before a Joint Session of the Congress Reporting on the State of the Union.,1976-01-19,Oral,20,5,100,104,"My tax proposals are a major step in that direction. To supplement these proposals, I ask that Congress enact changes in Federal tax laws that will speed up plant expansion and the purchase of new equipment. My recommendations will concentrate this job-creation tax incentive in areas where the unemployment rate now runs over 7 percent. Legislation to get this started must be approved at the earliest possible date. Within the strict budget total that I will recommend for the coming year, I will ask for additional housing assistance for 500,000 families.",5,91,0.11157463904625815,0.11915224834307725,0.08680641114242058,0.09872775446488012,0.08886338825873784,-0.01615146921811677,0.0036980803079124957,-0.0036803622378379854,-0.04697757956519608,-0.036770047931858826,3.8,0.00019881060568255202,0.0004629405671939293,"[0.11157463904625815, 0.11915224834307725, 0.08680641114242058, 0.09872775446488012, 0.08886338825873784]",0.8145641504992002,0.8308740738152331,0.7102589542467185,0.9592289109694372,0.0014670550422749215
Gerald R. Ford,1976 State of the Union,19  - Address Before a Joint Session of the Congress Reporting on the State of the Union.,1976-01-19,Oral,21,5,105,109,"These programs will expand housing opportunities, spur construction, and help to house moderate- and low-income families. We had a disappointing year in the housing industry in 1975. But with lower interest rates and available mortgage money, we can have a healthy recovery in 1976. A necessary condition of a healthy economy is freedom from the petty tyranny of massive government regulation. We are wasting literally millions of working hours costing billions of taxpayers' and consumers' dollars because of bureaucratic redtape.",5,80,0.14312708843073543,0.13569969399696297,0.09316520763388751,0.08433626750790744,0.10412639290001188,0.005526929878262809,0.05067790144827679,0.08232626983987322,-0.057375897277726136,0.03051447731607481,2.2142857142857144,0.0006781387439870581,0.00277637868226273,"[0.14312708843073543, 0.13569969399696297, 0.09316520763388751, 0.08433626750790744, 0.10412639290001188]",0.8526135529404761,0.7793914835080383,0.6337718324981504,0.9224986619019487,-0.0007138522295062691
