president,speech_label,matched_title,document_date,document_type,block_idx,block_size,sentence_start,sentence_end,text,n_sentences,n_words,care_p,fairness_p,loyalty_p,authority_p,sanctity_p,care_sent,fairness_sent,loyalty_sent,authority_sent,sanctity_sent,moral_nonmoral_ratio,f_var,sent_var,moral_vector_R5,cosine_gonye,cosine_pergel,cosine_yasa,cosine_gpy_sum_vector,delta_vector_discriminant
Harry S. Truman,Korean War Report,193  - Special Message to the Congress Reporting on the Situation in Korea.,1950-07-19,Written,27,2,54,55,Only a few countries have failed to support the common action to restore the peace. The most important of these is the Soviet Union.,2,24,0.12201780414900247,0.09795535536750398,0.109635511241208,0.09795289933636692,0.07932973760179124,0.154648163086762,0.07954646257494298,0.1573058690402741,0.14629067235066326,0.16636223653544102,9.0,0.00025093992312062057,0.0012249454734397762,"[0.12201780414900247, 0.09795535536750398, 0.109635511241208, 0.09795289933636692, 0.07932973760179124]",0.8117559262299648,0.7692378267951289,0.7513799076797324,0.9494190900707401,-0.005565666633017417
Harry S. Truman,Korean War Report,193  - Special Message to the Congress Reporting on the Situation in Korea.,1950-07-19,Written,28,2,56,57,"Since the Soviet representative had refused to participate in the meetings of the Security Council which took action regarding Korea, the United States brought the matter directly to the attention of the Soviet Government in Moscow. On June 27th, we requested the Soviet Government, in view of its known close relations with the north Korean regime, to use its influence to have the invaders withdraw at once.",2,67,0.0880506112106771,0.09955039375537465,0.10168260496875409,0.111109612934224,0.067656250672376,-0.10900628863939238,-0.08393500520377797,-0.07090641001314489,-0.05583379184921137,0.06750314838360916,2.7777777777777777,0.0002777988974036669,0.004727619656200716,"[0.0880506112106771, 0.09955039375537465, 0.10168260496875409, 0.111109612934224, 0.067656250672376]",0.7564881371450125,0.8431417152694085,0.804827210126589,0.9790542098790683,0.0006371196968374404
Harry S. Truman,Korean War Report,193  - Special Message to the Congress Reporting on the Situation in Korea.,1950-07-19,Written,29,2,58,59,"The Soviet Government, in its reply on June 29th and in subsequent statements, has taken the position that the attack launched by the north Korean forces was provoked by the Republic of Korea, and that the actions of the United Nations Security Council were illegal. These Soviet claims are flatly disproved by the facts.",2,54,0.09542242647379112,0.11406446611277074,0.10133755065085709,0.12229514226574838,0.07146741703439546,-0.19664308764151586,-0.1105300884805906,-0.0763412482847142,-0.1078585183797132,-0.032934584620174484,1.4545454545454546,0.00038188149226296936,0.003612965189621893,"[0.09542242647379112, 0.11406446611277074, 0.10133755065085709, 0.12229514226574838, 0.07146741703439546]",0.7688492795374577,0.8633823308817143,0.7883309729022074,0.9856975889796213,0.002719594299386903
Harry S. Truman,Korean War Report,193  - Special Message to the Congress Reporting on the Situation in Korea.,1950-07-19,Written,30,2,60,61,"The attitude of the Soviet Government toward the aggression against the Republic of Korea, is in direct contradiction to its often expressed intention to work with other nations to achieve peace in the world. For our part, we shall continue to support the United Nations action to restore peace in the Korean area.",2,53,0.09789903775492492,0.0937446855102052,0.10423722764831024,0.10482368551979519,0.08217647755871028,0.07942772541396899,0.07728398997780798,0.06939553262579852,0.11811862826196551,0.1164509047815956,3.1666666666666665,8.595793561069046e-05,0.000541380716228903,"[0.09789903775492492, 0.0937446855102052, 0.10423722764831024, 0.10482368551979519, 0.08217647755871028]",0.7586697866594618,0.8033718608214643,0.7980721182001831,0.9608567311188195,-0.0022288842691048256
Harry S. Truman,Korean War Report,193  - Special Message to the Congress Reporting on the Situation in Korea.,1950-07-19,Written,31,2,62,63,"As the situation has developed, I have authorized a number of measures to be taken. Within the first week of the fighting, General MacArthur reported, after a visit to the front, that the forces from north Korea were continuing to drive south, and further support to the Republic of Korea was needed.",2,52,0.09054647535395459,0.08163596397084553,0.0897287931691906,0.11901610525447384,0.06226617290177957,-0.09491590192193518,0.004002764095524425,-0.0029363656713425157,-0.039406033392129204,-0.012288638057773357,3.4,0.0004180407893383934,0.0016252243805481164,"[0.09054647535395459, 0.08163596397084553, 0.0897287931691906, 0.11901610525447384, 0.06226617290177957]",0.7524808081666227,0.827130347278283,0.8300192789264111,0.9810563289024417,-0.0012517523551143078
Harry S. Truman,Korean War Report,193  - Special Message to the Congress Reporting on the Situation in Korea.,1950-07-19,Written,32,2,64,65,"Accordingly, General MacArthur was authorized to use United States Army troops in Korea, and to use United States aircraft of the Air Force and the Navy to conduct missions against specific military targets in Korea north of the thirty-eighth parallel, where necessary to carry out the United Nations resolution. General MacArthur was also directed to blockade the Korean coast.",2,59,0.07937981670290764,0.08696692016423038,0.07854700177090534,0.0887590296000634,0.056681623747128165,-0.16623539150606187,-0.04293034540473439,-0.05048086620415822,0.003951069187498803,-0.004303050494243796,2.6,0.0001632040706741926,0.004634953052372122,"[0.07937981670290764, 0.08696692016423038, 0.07854700177090534, 0.0887590296000634, 0.056681623747128165]",0.7878834943348647,0.84603198930308,0.7726803758189066,0.9799378817764917,0.0005955067411250493
Harry S. Truman,Korean War Report,193  - Special Message to the Congress Reporting on the Situation in Korea.,1950-07-19,Written,33,2,66,67,"The attacking forces from the north have continued to move forward, although their advance has been slowed down. The troops of the Republic of Korea, though initially overwhelmed by the tanks and artillery of the surprise attack by the invaders, have been reorganized and are fighting bravely.",2,47,0.1470960790244325,0.10852096639193133,0.12433171467711675,0.1379498201707218,0.07851029551637376,-0.1729986305366163,-0.19054787563838804,-0.12673352712741484,-0.1930547990909762,-0.17551423457160154,1.2222222222222223,0.0007314354626963575,0.0007123659999964145,"[0.1470960790244325, 0.10852096639193133, 0.12433171467711675, 0.1379498201707218, 0.07851029551637376]",0.8127497583164471,0.7832490706908863,0.7786183567821846,0.9666151403199809,-0.008196733976644562
Harry S. Truman,Korean War Report,193  - Special Message to the Congress Reporting on the Situation in Korea.,1950-07-19,Written,34,2,68,69,"United States forces, as they have arrived in the area, have fought with great valor. The Army troops have been conducting a very difficult delaying operation with skill and determination, outnumbered many times over by attacking troops, spearheaded by tanks.",2,40,0.12777650017805522,0.06994904446749771,0.10595960912603067,0.12255473358668362,0.0677476032816822,-0.1297301036495204,-0.11395556513561839,-0.0879706648213293,-0.08533176989937358,-0.10383440083250743,2.6666666666666665,0.0008129534697435231,0.00034162150818791527,"[0.12777650017805522, 0.06994904446749771, 0.10595960912603067, 0.12255473358668362, 0.0677476032816822]",0.785414806076103,0.7363655518783282,0.8098065487363321,0.9489077098447862,-0.009661064780263746
Harry S. Truman,Korean War Report,193  - Special Message to the Congress Reporting on the Situation in Korea.,1950-07-19,Written,35,2,70,71,"Despite the bad weather of the rainy season, our troops have been valiantly supported by the air and naval forces of both the United States and other members of the United Nations. In this connection, I think it is important that the nature of our military action in Korea be understood.",2,51,0.0857081610074145,0.07550289221462193,0.08624958948413658,0.09464179178220355,0.055689047449520315,-0.1110109496084118,-0.028293703356413322,0.0345072093057045,0.04745969317610034,-0.02462393271215575,3.0,0.00022407335483476425,0.00395748227819871,"[0.0857081610074145, 0.07550289221462193, 0.08624958948413658, 0.09464179178220355, 0.055689047449520315]",0.7769819228821612,0.8089069683590865,0.8055019424186145,0.9735604967200605,-0.002012836062088061
Harry S. Truman,Korean War Report,193  - Special Message to the Congress Reporting on the Situation in Korea.,1950-07-19,Written,36,2,72,73,It should be made perfectly clear that the action was undertaken as a matter of basic moral principle. The United States was going to the aid of a nation established and supported by the United Nations and unjustifiably attacked by an aggressor force.,2,43,0.100095869493981,0.09345545528871808,0.10780540447005765,0.10318315917290775,0.07002606683121818,-0.050439357386310835,-0.004351328908687847,0.041132402424223426,0.07712245706412413,0.051353117796496935,4.25,0.00022073891022668184,0.002550837848745752,"[0.100095869493981, 0.09345545528871808, 0.10780540447005765, 0.10318315917290775, 0.07002606683121818]",0.7760569105327018,0.8021343278560926,0.7931992329602316,0.9654181421213425,-0.0028006666453920734
Harry S. Truman,Korean War Report,193  - Special Message to the Congress Reporting on the Situation in Korea.,1950-07-19,Written,37,2,74,75,"Consequently, we were not deterred by the relative immediate superiority of the attacking forces, by the fact that our base of supplies was 5,000 miles away, or by the further fact that we would have to supply our forces through port facilities that are far from satisfactory. We are moving as rapidly as possible to bring to bear on the fighting front larger forces and heavier equipment, and to increase our naval and air superiority.",2,75,0.11635021084374167,0.10748704020770129,0.11493316523570372,0.10967325690539048,0.08216621742559836,-0.13294095066011638,-0.06892279326131547,0.015470268228313615,-0.05363086629188407,-0.10856458678737088,2.0,0.00019265180225031138,0.0032556670158524746,"[0.11635021084374167, 0.10748704020770129, 0.11493316523570372, 0.10967325690539048, 0.08216621742559836]",0.7922219919195368,0.7999391825717086,0.7711057086667867,0.9621143390375099,-0.0033758937806425485
Harry S. Truman,Korean War Report,193  - Special Message to the Congress Reporting on the Situation in Korea.,1950-07-19,Written,38,2,76,77,"But it will take time, men, and material to slow down the forces of aggression, bring those forces to a halt, and throw them back. Nevertheless, our assistance to the Republic of Korea has prevented the invaders from crushing that nation in a few days--as they had evidently expected to do.",2,51,0.12849295011957979,0.11870674726030452,0.12362463894171992,0.11501147487388089,0.09982686102387875,-0.08498457999940129,-0.016849998082181405,-0.08657053428969409,-0.08839188666763907,-0.1251069185730555,3.0,0.00011941745933654414,0.001540068396346773,"[0.12849295011957979, 0.11870674726030452, 0.12362463894171992, 0.11501147487388089, 0.09982686102387875]",0.7892189152327703,0.7921019194955227,0.7610073469474751,0.9535855876250724,-0.0041343508272731755
Harry S. Truman,Korean War Report,193  - Special Message to the Congress Reporting on the Situation in Korea.,1950-07-19,Written,39,2,78,79,"We are determined to support the United Nations in its effort to restore peace and security to Korea, and its effort to assure the people of Korea an opportunity to choose their own form of government free from coercion, as expressed in the General Assembly resolutions of November 14, 1947, and December 12, 1948. In addition to the direct military effort we and other members of the United Nations are making in Korea, the outbreak of aggression there requires us to consider its implications for peace throughout the world.",2,89,0.09997603978484969,0.1041683199452175,0.09902088572134236,0.095939246678972,0.07454563530682909,0.12160318371965079,0.10349251575994092,0.09320570015228365,0.12966597014723177,0.10818512227010717,3.5555555555555554,0.0001359713431701043,0.00021037581556618376,"[0.09997603978484969, 0.1041683199452175, 0.09902088572134236, 0.095939246678972, 0.07454563530682909]",0.794684137156073,0.8203670115573662,0.7555854275795466,0.9652196031116903,-0.0006404476003603436
Harry S. Truman,Korean War Report,193  - Special Message to the Congress Reporting on the Situation in Korea.,1950-07-19,Written,40,2,80,81,The attack upon the Republic of Korea makes it plain beyond all doubt that the international communist movement is prepared to use armed invasion to conquer independent nations. We must therefore recognize the possibility that armed aggression may take place in other areas.,2,43,0.10482886800152827,0.10220938370704992,0.09955386466057464,0.10919730087701113,0.08881566339017752,-0.1146936791939624,-0.09542331583207675,-0.10889496201777665,-0.11205757183548593,-0.0980828629068359,4.5,5.8459188643222276e-05,7.376466483927205e-05,"[0.10482886800152827, 0.10220938370704992, 0.09955386466057464, 0.10919730087701113, 0.08881566339017752]",0.7722588749515231,0.8139628625561094,0.7793170662023995,0.9631166756499652,-0.001337893091249577
Harry S. Truman,Korean War Report,193  - Special Message to the Congress Reporting on the Situation in Korea.,1950-07-19,Written,41,2,82,83,"In view of this, I have already directed that United States forces in support of the Philippines be strengthened, and that military assistance be speeded up to the Philippine Government and to the Associated States of Indo-China and to the forces of France in Indo-China. I have also ordered the United States Seventh Fleet to prevent any attack upon Formosa, and I have requested the Chinese Government on Formosa to cease all air and sea operations against the mainland.",2,79,0.10287674094403491,0.10916403900075865,0.09085428816175929,0.10316253991174981,0.07150711424332364,-0.1261603605379429,-0.06922580953207615,-0.08880036421203513,0.008649691623065699,-0.04858712378291038,1.6428571428571428,0.0002242692885728692,0.0025046026497223175,"[0.10287674094403491, 0.10916403900075865, 0.09085428816175929, 0.10316253991174981, 0.07150711424332364]",0.8088172755929893,0.8413634312653187,0.7460429809522122,0.9757086773815706,0.0008092681974117277
Harry S. Truman,Korean War Report,193  - Special Message to the Congress Reporting on the Situation in Korea.,1950-07-19,Written,42,2,84,85,These steps were at once reported to the United Nations Security Council. Our action in regard to Formosa was a matter of elementary security.,2,24,0.06367796071095279,0.06542138612391275,0.07191560969424002,0.08397332764502242,0.04938392881009823,-0.016579884292178413,-0.0865704442174263,-0.054403263949013944,0.06790910923821179,0.06192241138763197,5.0,0.00015900804441984745,0.004755344749924208,"[0.06367796071095279, 0.06542138612391275, 0.07191560969424002, 0.08397332764502242, 0.04938392881009823]",0.7439219867148854,0.8325828934414722,0.8260604966581058,0.9782259216481447,-0.00023029805829888686
Harry S. Truman,Korean War Report,193  - Special Message to the Congress Reporting on the Situation in Korea.,1950-07-19,Written,43,2,86,87,"The peace and stability of the Pacific area had been violently disturbed by the attack on Korea. Attacks elsewhere in the Pacific area would have enlarged the Korean crisis, thereby rendering much more difficult the carrying out of our obligations to the United Nations in Korea.",2,46,0.1417588047346262,0.09624368988900062,0.10282712699264802,0.0943929154749577,0.06549468241201244,-0.14493183100886534,-0.15324003917687082,-0.12243033190729026,-0.08237733074795578,-0.1317702511803499,1.3333333333333333,0.0007469634358757203,0.0007612243679263788,"[0.1417588047346262, 0.09624368988900062, 0.10282712699264802, 0.0943929154749577, 0.06549468241201244]",0.8640313853743684,0.7436110021929411,0.704646586975646,0.9411326625333979,-0.007637245613203392
Harry S. Truman,Korean War Report,193  - Special Message to the Congress Reporting on the Situation in Korea.,1950-07-19,Written,44,2,88,89,"In order that there may be no doubt in any quarter about our intentions regarding Formosa, I wish to state that the United States has no territorial ambitions whatever concerning that island, nor do we seek for ourselves any special position or privilege on Formosa. The present military neutralization of Formosa is without prejudice to political questions affecting that island.",2,60,0.07696212207666642,0.09801387810523039,0.07821698719883922,0.13186259196914296,0.09975863278093058,-0.10150849816621887,-0.017730630889014574,-0.005499579646487161,-0.031974452963672746,-0.0013095838250438408,2.375,0.0004945873851429408,0.0016696097204064089,"[0.07696212207666642, 0.09801387810523039, 0.07821698719883922, 0.13186259196914296, 0.09975863278093058]",0.6807605864253677,0.8580881209524583,0.8230239444605789,0.9618889262508401,0.004662458629488053
Harry S. Truman,Korean War Report,193  - Special Message to the Congress Reporting on the Situation in Korea.,1950-07-19,Written,45,2,90,91,"Our desire is that Formosa not become embroiled in hostilities disturbing to the peace of the Pacific and that all questions affecting Formosa be settled by peaceful means as envisaged in the Charter of the United Nations. With peace re-established, even the most complex political questions are susceptible of solution.",2,50,0.11242421769626564,0.07573840801950564,0.08083203497278499,0.09527610540009912,0.07868430430340587,-0.027521226575357004,0.07729478291316524,0.06366072371400015,0.1177154627967177,0.08129611359126984,2.0,0.0002340615446256408,0.002931523686701576,"[0.11242421769626564, 0.07573840801950564, 0.08083203497278499, 0.09527610540009912, 0.07868430430340587]",0.8040990487699662,0.7571661873253589,0.7602430571966068,0.9449465004268378,-0.00507169023778755
Harry S. Truman,Korean War Report,193  - Special Message to the Congress Reporting on the Situation in Korea.,1950-07-19,Written,46,2,92,93,"In the presence of brutal and unprovoked aggression, however, some of these questions may have to be held in abeyance in the interest of the essential security of all. The outbreak of aggression in the Far East does not, of course, lessen, but instead increases, the importance of the common strength of the free nations in other parts of the world.",2,61,0.09704842627247973,0.09796312192518504,0.08624677623477583,0.08495818986820772,0.10177224216919308,0.02654351179272876,0.08074270501724169,0.007433063327395058,-0.020785172689984015,0.024368210826015323,3.8,5.661619389367687e-05,0.0013764845657656686,"[0.09704842627247973, 0.09796312192518504, 0.08624677623477583, 0.08495818986820772, 0.10177224216919308]",0.7611524609282045,0.7871071703020645,0.7350915767852182,0.9296629003068095,-0.0009124909035823636
Harry S. Truman,Korean War Report,193  - Special Message to the Congress Reporting on the Situation in Korea.,1950-07-19,Written,47,2,94,95,"The attack on the Republic of Korea gives added urgency to the efforts of the free nations to increase and to unify their common strength, in order to deter a potential aggressor. To be able to accomplish this objective, the free nations must maintain a sufficient defensive military strength in being, and, even more important, a solid basis of economic strength, capable of rapid mobilization in the event of emergency.",2,70,0.11214429975501555,0.09339024150141864,0.09117982677807121,0.09755222079969614,0.09276014215986411,0.11070974527551367,0.1193221937023006,0.10796422666156812,0.12039864982106427,0.10792064969888236,2.3636363636363638,7.342860060820475e-05,3.76920354919048e-05,"[0.11214429975501555, 0.09339024150141864, 0.09117982677807121, 0.09755222079969614, 0.09276014215986411]",0.789382135568901,0.7795894391246675,0.7537425455533249,0.9455661450041498,-0.0034890815816847782
Harry S. Truman,Korean War Report,193  - Special Message to the Congress Reporting on the Situation in Korea.,1950-07-19,Written,48,2,96,97,"The strong cooperative efforts that have been made by the United States and other free nations, since the end of World War II, to restore economic vitality to Europe and other parts of the world, and the cooperative efforts we have begun in order to increase the productive capacity of underdeveloped areas, are extremely important contributions to the growing economic strength of all the free nations, and will be of even greater importance in the future. We have been increasing our common defensive strength under the treaty of Rio de Janeiro and the North Atlantic Treaty, which are collective security arrangements within the framework of the United Nations Charter.",2,109,0.10061933849604868,0.08537585704709998,0.08452772632635744,0.08737213731189439,0.07926982124724735,0.03744180989159165,0.09877363434509447,0.08078358927792746,0.11092681003778221,0.10777334835755678,2.176470588235294,6.329829169828458e-05,0.0009093007253704408,"[0.10061933849604868, 0.08537585704709998, 0.08452772632635744, 0.08737213731189439, 0.07926982124724735]",0.7952038305936043,0.7839781230811775,0.7540075469676221,0.9498357517710266,-0.002750893076087061
Harry S. Truman,Korean War Report,193  - Special Message to the Congress Reporting on the Situation in Korea.,1950-07-19,Written,49,2,98,99,"We have also taken action to bolster the military defenses of individual free nations, such as Greece, Turkey, and Iran. The defenses of the North Atlantic Treaty area were considered a matter of great urgency by the North Atlantic Council in London this spring.",2,44,0.11007553326423743,0.10063476177240346,0.08598488394253086,0.11018338437535112,0.07217104996064208,-0.005896851916308916,-0.002004693094582408,0.06604746598267701,0.08421182229698952,0.11709153819562165,1.0833333333333333,0.0002721777020877977,0.00293508320519433,"[0.11007553326423743, 0.10063476177240346, 0.08598488394253086, 0.11018338437535112, 0.07217104996064208]",0.8127028852647131,0.8270323019806233,0.7570042611668225,0.9758337712621274,-0.0009407335231072372
Harry S. Truman,Korean War Report,193  - Special Message to the Congress Reporting on the Situation in Korea.,1950-07-19,Written,50,2,100,101,"Recent events make it even more urgent than it was at that time to build and maintain these defenses. Under all the circumstances, it is apparent that the United States is required to increase its military strength and preparedness not only to deal with the aggression in Korea but also to increase our common defense, with other free nations, against further aggression.",2,62,0.09283374010814731,0.09315937635637736,0.08645251203596623,0.08014392463064571,0.09078614543642198,0.03151686664467844,0.10728469072694749,0.018511901796211268,0.05384867014334084,0.05414786349533666,5.25,2.989509631418847e-05,0.0011499500490762878,"[0.09283374010814731, 0.09315937635637736, 0.08645251203596623, 0.08014392463064571, 0.09078614543642198]",0.7698702439634886,0.7883682040355408,0.7393543875865983,0.9354400352494229,-0.0011762400005333462
Harry S. Truman,Korean War Report,193  - Special Message to the Congress Reporting on the Situation in Korea.,1950-07-19,Written,51,2,102,103,"The increased strength which is needed falls into three categories. In the first place, to meet the situation in Korea, we shall need to send additional men, equipment and supplies to General MacArthur's command as rapidly as possible.",2,38,0.10639017209916483,0.09429673847542241,0.07920580899069132,0.08352497990702165,0.08728568543725948,0.008503389670282862,0.06361856545628289,0.10984286334359318,0.03737105942188419,-0.056912684422623434,2.0,0.00011320217529890907,0.0038861187773153814,"[0.10639017209916483, 0.09429673847542241, 0.07920580899069132, 0.08352497990702165, 0.08728568543725948]",0.8089279891072335,0.7850134027505027,0.7158070284910268,0.9403452956237879,-0.0019041530617668993
Harry S. Truman,Korean War Report,193  - Special Message to the Congress Reporting on the Situation in Korea.,1950-07-19,Written,52,2,104,105,"In the second place, the world situation requires that we increase substantially the size and materiel support of our armed forces, over and above the increases which are needed in Korea. In the third place, we must assist the free nations associated with us in common defense to augment their military strength.",2,52,0.10823134259170633,0.09601315321941514,0.08773607969859472,0.09299814504236377,0.08094935002981343,0.04985011616836667,0.03947986453962375,0.07337591165756377,0.05783901487170179,0.06912108248149693,5.0,0.00010345691288824398,0.0001923791906098012,"[0.10823134259170633, 0.09601315321941514, 0.08773607969859472, 0.09299814504236377, 0.08094935002981343]",0.808993923387108,0.7966926526972279,0.7407993008501921,0.9552970261167802,-0.002238486670505989
