president,speech_label,matched_title,document_date,document_type,block_idx,block_size,sentence_start,sentence_end,text,n_sentences,n_words,care_p,fairness_p,loyalty_p,authority_p,sanctity_p,care_sent,fairness_sent,loyalty_sent,authority_sent,sanctity_sent,moral_nonmoral_ratio,f_var,sent_var,moral_vector_R5,cosine_gonye,cosine_pergel,cosine_yasa,cosine_gpy_sum_vector,delta_vector_discriminant
Harry S. Truman,Korean War Report,193  - Special Message to the Congress Reporting on the Situation in Korea.,1950-07-19,Written,0,2,0,1,"To the Congress of the United States: I am reporting to the Congress on the situation which has been created in Korea, and on the actions which this Nation has taken, as a member of the United Nations, to meet this situation. I am also laying before the Congress my views concerning the significance of these events for this Nation and the world, and certain recommendations for legislative action which I believe should be taken at this time.",2,78,0.07466116125284923,0.09943213807584061,0.08111850052678314,0.09615373548757673,0.07720404219964379,-0.04182734259725368,0.015522816415171838,0.03726883918476664,-0.0001052898512258318,0.050821635928389654,3.4285714285714284,0.0001282196577063501,0.0013003499539682032,"[0.07466116125284923, 0.09943213807584061, 0.08111850052678314, 0.09615373548757673, 0.07720404219964379]",0.7441960659640701,0.8612346757633117,0.7756245897901932,0.9696793218243348,0.003024790929811186
Harry S. Truman,Korean War Report,193  - Special Message to the Congress Reporting on the Situation in Korea.,1950-07-19,Written,1,2,2,3,"At four o'clock in the morning, Sunday, June 25th, Korean time, armed forces from north of the thirty-eighth parallel invaded the Republic of Korea. The Republic of Korea was established as an independent nation in August, 1948, after a free election held under the auspices of the United Nations.",2,49,0.07822769299977442,0.09513210066643098,0.08726033761422548,0.11048447319354757,0.07298904008992252,0.05854144970221456,0.0493535942087728,0.06304890414516415,0.06668486085346108,0.09649903102076016,1.0833333333333333,0.00021861020287947352,0.0003171734700377412,"[0.07822769299977442, 0.09513210066643098, 0.08726033761422548, 0.11048447319354757, 0.07298904008992252]",0.7355683441404316,0.858542720500729,0.8106390990826159,0.9792629258794051,0.0022079910898472298
Harry S. Truman,Korean War Report,193  - Special Message to the Congress Reporting on the Situation in Korea.,1950-07-19,Written,2,2,4,5,"This election, which was originally intended to cover all of Korea, was held only in the part of the Korean peninsula south of the thirty-eighth parallel, because the Soviet Government, which occupied the peninsula north of that parallel, refused to allow the election to be held in the area under its control. The United States, and a majority of the other members of the United Nations, have recognized the Republic of Korea.",2,72,0.08483561262173245,0.10667940651760337,0.09286435294932276,0.1097150031091599,0.07031482696851314,-0.10180496262458553,0.02380735132175088,-0.04455464527266423,0.02753315020595541,0.002558037928183823,2.1,0.00026193509501257293,0.002992741222541411,"[0.08483561262173245, 0.10667940651760337, 0.09286435294932276, 0.1097150031091599, 0.07031482696851314]",0.7611315473781227,0.8651971224541664,0.7853651365988531,0.9821151582306967,0.002851316360043238
Harry S. Truman,Korean War Report,193  - Special Message to the Congress Reporting on the Situation in Korea.,1950-07-19,Written,3,2,6,7,"The admission of Korea to the United Nations has been blocked by the Soviet veto. In December, 1948, the Soviet Government stated that it had withdrawn its occupation troops from northern Korea, and that a local regime had been established there.",2,41,0.09100195865679295,0.10135275109009412,0.11546161826187529,0.13924987419400237,0.06265997439889276,-0.07638938573698309,-0.048829119674185434,-0.06915576166495514,-0.04565324434991025,-0.09096759881747392,1.7142857142857142,0.0008094416891702001,0.0003624776765391778,"[0.09100195865679295, 0.10135275109009412, 0.11546161826187529, 0.13924987419400237, 0.06265997439889276]",0.7271716134401542,0.8468039553121558,0.8428240013476583,0.9840756901644465,0.0008695923689929427
Harry S. Truman,Korean War Report,193  - Special Message to the Congress Reporting on the Situation in Korea.,1950-07-19,Written,4,2,8,9,"The authorities in northern Korea continued to refuse to permit United Nations observers to pass the thirty-eighth parallel to supervise or observe a free election, or to verify the withdrawal of Soviet troops. Nevertheless, the United Nations continued its efforts to obtain a freely-elected government for all of Korea, and at the time of the attack, a United Nations Commission, made up of representatives of seven nations-Australia, China, El Salvador, France, India, the Philippines and Turkey-was in the Republic of Korea.",2,81,0.07465502444692149,0.09928771835830119,0.08222045345199097,0.08890903528318195,0.05605697603840603,-0.09289790142735511,-0.001062065044353128,-0.03636736498816239,-0.004453913713339065,0.022093895209810546,1.5,0.0002644748852039634,0.0019805057731251212,"[0.07465502444692149, 0.09928771835830119, 0.08222045345199097, 0.08890903528318195, 0.05605697603840603]",0.7811459318436572,0.8705216743082163,0.7567454973113739,0.9808173923588548,0.00270469910739881
Harry S. Truman,Korean War Report,193  - Special Message to the Congress Reporting on the Situation in Korea.,1950-07-19,Written,5,2,10,11,"Just one day before the attack of June 25th, field observers attached to the United Nations Commission on Korea had completed a routine tour, lasting two weeks, of the military positions of the Republic of Korea south of the thirty-eighth parallel. The report of these international observers stated that the Army of the Republic of Korea was organized entirely for defense.",2,61,0.07168324067630123,0.08206770277096706,0.07972246140631947,0.07972900158786447,0.05492238235499425,-0.06954627721161723,-0.04755162832822893,-0.08363131955366301,-0.023905507268111498,-0.060075024403113034,1.5833333333333333,0.00012481885927565812,0.0005151480890804059,"[0.07168324067630123, 0.08206770277096706, 0.07972246140631947, 0.07972900158786447, 0.05492238235499425]",0.7746399930735813,0.8380450149057926,0.7770306944557148,0.9730523959524409,0.00037361451275899626
Harry S. Truman,Korean War Report,193  - Special Message to the Congress Reporting on the Situation in Korea.,1950-07-19,Written,6,2,12,13,"The observers found the parallel guarded on the south side by small bodies of troops in scattered outposts, with roving patrols. They found no concentration of troops and no preparation to attack.",2,32,0.13274183916345872,0.0904587857570683,0.11208921643704249,0.15064537134654662,0.10266818922034793,-0.2704977785989981,-0.12959377838535732,-0.20305851863768523,-0.15671061298232036,-0.2972759339525284,0.6666666666666666,0.0005777930652811357,0.005154996748240506,"[0.13274183916345872, 0.0904587857570683, 0.11208921643704249, 0.15064537134654662, 0.10266818922034793]",0.7483387103106812,0.7748297180722753,0.8262320383641186,0.9563493147319851,-0.0076735364126259906
Harry S. Truman,Korean War Report,193  - Special Message to the Congress Reporting on the Situation in Korea.,1950-07-19,Written,7,2,14,15,"The observers concluded that the absence of armor, air support, heavy artillery, and military supplies precluded any offensive action by the forces of the Republic of Korea. On June 25th, within a few hours after the invasion was launched from the north, the Commission reported to the United Nations that the attack had come without warning and without provocation.",2,59,0.09914285680428202,0.07727687509730224,0.08721024546014737,0.1059530874323601,0.06877348916837667,-0.11262487053925198,-0.1418561295012201,-0.06413105101526502,-0.08621557238043959,-0.12566391769196672,1.9,0.00023280106545241208,0.0009651511835625976,"[0.09914285680428202, 0.07727687509730224, 0.08721024546014737, 0.1059530874323601, 0.06877348916837667]",0.7770079589493682,0.7944476915942139,0.804741394042955,0.9673204324183968,-0.0033214459168491826
Harry S. Truman,Korean War Report,193  - Special Message to the Congress Reporting on the Situation in Korea.,1950-07-19,Written,8,2,16,17,"The reports from the Commission make it unmistakably clear that the attack was naked, deliberate, unprovoked aggression, without a shadow of justification. This outright breach of the peace, in violation of the United Nations Charter, created a real and present danger to the security of every nation.",2,47,0.1181310295903617,0.11811261789306764,0.09481890629991152,0.10346195075314042,0.11316627757665229,-0.06804836648890637,-0.056044860223477766,-0.048532062235495964,-0.032330962542419565,-0.11526605953756923,3.8,0.00010352468035152308,0.0009875143820849198,"[0.1181310295903617, 0.11811261789306764, 0.09481890629991152, 0.10346195075314042, 0.11316627757665229]",0.7822143458472368,0.8011273418296667,0.7257844718619108,0.9401872968923308,-0.0004737932454050922
Harry S. Truman,Korean War Report,193  - Special Message to the Congress Reporting on the Situation in Korea.,1950-07-19,Written,9,2,18,19,"This attack was, in addition, a demonstration of contempt for the United Nations, since it was an attempt to settle, by military aggression, a question which the United Nations had been working to settle by peaceful means. The attack on the Republic of Korea, therefore, was a clear challenge to the basic principles of the United Nations Charter and to the specific actions taken by the United Nations in Korea.",2,70,0.0876939337650842,0.09904866599737619,0.07576766809901342,0.09523954108153426,0.07819018630395802,-0.0893411365292439,-0.020086481227923357,0.005635054237882685,-0.005261795367354701,-0.005330030338894364,10.0,0.00010428582817524244,0.0014640993137305927,"[0.0876939337650842, 0.09904866599737619, 0.07576766809901342, 0.09523954108153426, 0.07819018630395802]",0.780376161639851,0.8465827975220106,0.7513976668545298,0.9685005437033802,0.0017563813401394596
Harry S. Truman,Korean War Report,193  - Special Message to the Congress Reporting on the Situation in Korea.,1950-07-19,Written,10,2,20,21,"If this challenge had not been met squarely, the effectiveness of the United Nations would have been all but ended, and the hope of mankind that the United Nations would develop into an institution of world order would have been shattered. Prompt action was imperative.",2,45,0.08450176916811805,0.07954859023432492,0.06933102400928398,0.09834061553235007,0.06281262615830319,-0.0730483509334406,0.07147120497238445,-0.008939274507273524,0.06623468792215674,0.04401710652841272,3.75,0.00019002666955886453,0.0037148039824049387,"[0.08450176916811805, 0.07954859023432492, 0.06933102400928398, 0.09834061553235007, 0.06281262615830319]",0.7808502010136321,0.8363613140015207,0.787009286528958,0.9789190119886165,-0.0001186940218732245
Harry S. Truman,Korean War Report,193  - Special Message to the Congress Reporting on the Situation in Korea.,1950-07-19,Written,11,2,22,23,"The Security Council of the United Nations met, at the request of the United States, in New York at two o'clock in the afternoon, Sunday, June 25th, eastern daylight time. Since there is a 14-hour difference in time between Korea and New York, this meant that the Council convened just 24 hours after the attack began.",2,56,0.06162520785778993,0.06321558017245446,0.05723251649406958,0.0667037583613682,0.050695685490425836,-0.14057909112271316,-0.08744984621986844,-0.04461375812003369,-0.04188698386380313,-0.01329062812353833,1.9,3.802381679695209e-05,0.0024595683240418646,"[0.06162520785778993, 0.06321558017245446, 0.05723251649406958, 0.0667037583613682, 0.050695685490425836]",0.777902115536938,0.8303172569985272,0.7750469644927251,0.9703943716466076,-8.897339654140649e-06
Harry S. Truman,Korean War Report,193  - Special Message to the Congress Reporting on the Situation in Korea.,1950-07-19,Written,12,2,24,25,"At this meeting, the Security Council passed a resolution which called for the immediate cessation of hostilities and for the withdrawal of the invading troops to the thirty-eighth parallel, and which requested the members of the United Nations to refrain from giving aid to the northern aggressors and to assist in the execution of this resolution. The representative of the Soviet Union to the Security Council stayed away from the meetings, and the Soviet Government has refused to support the Council's resolution.",2,82,0.07926776640310251,0.08804990811251834,0.08993844146143345,0.11509822133634615,0.05829176220918248,-0.08131760209081276,-0.09004758800473528,-0.09567098196941469,-0.021346700288737044,0.002890026683225555,3.3333333333333335,0.00041985146277774094,0.002009214546976063,"[0.07926776640310251, 0.08804990811251834, 0.08993844146143345, 0.11509822133634615, 0.05829176220918248]",0.7412573107925595,0.8540299566247562,0.8276857715242686,0.9866191518063493,0.001058393577835881
Harry S. Truman,Korean War Report,193  - Special Message to the Congress Reporting on the Situation in Korea.,1950-07-19,Written,13,2,26,27,"The attack launched on June 25th moved ahead rapidly. The tactical surprise gained by the aggressors, and their superiority in planes, tanks and artillery, forced the lightly-armed defenders to retreat.",2,30,0.14679175484721185,0.11096170171884305,0.11971896789354304,0.14928105634726396,0.07885183482883477,-0.084358924659209,-0.048159840624288006,-0.015443681844323149,-0.08749603463203466,-0.12162748922305762,1.1111111111111112,0.0008359589469367773,0.001655257450999232,"[0.14679175484721185, 0.11096170171884305, 0.11971896789354304, 0.14928105634726396, 0.07885183482883477]",0.8073417309315061,0.7984530630580019,0.7862381840447175,0.973759713259016,-0.006813637277676206
Harry S. Truman,Korean War Report,193  - Special Message to the Congress Reporting on the Situation in Korea.,1950-07-19,Written,14,2,28,29,"The speed, the scale, and the coordination of the attack left no doubt that it had been plotted long in advance. When the attack came, our Ambassador to Korea, John J.",2,31,0.125763190006067,0.11383958276730637,0.1108851413665474,0.11316268190971009,0.0990523704764285,-0.2532438625501987,-0.28006560508413897,-0.1390344285368469,-0.22874014818466748,-0.22701475981329683,1.5,9.039602689202129e-05,0.0028090358900290384,"[0.125763190006067, 0.11383958276730637, 0.1108851413665474, 0.11316268190971009, 0.0990523704764285]",0.793746364856999,0.7959311489186566,0.7560887568991338,0.9550009062337195,-0.003391081692966723
Harry S. Truman,Korean War Report,193  - Special Message to the Congress Reporting on the Situation in Korea.,1950-07-19,Written,15,2,30,31,"Muccio, began the immediate evacuation of American women and children from the danger zone. To protect this evacuation, air cover and sea cover were provided by the Commander in Chief of United States Forces in the Far East, General of the Army Douglas MacArthur.",2,44,0.11363333316492653,0.11114294682679753,0.08172973825995483,0.09918298985331718,0.086682219207997,-0.09004515206778797,-0.06460778693131247,0.00498998363044759,-0.056072058701992604,-0.062272057477154696,4.4,0.0002025566643705258,0.0012408805773243237,"[0.11363333316492653, 0.11114294682679753, 0.08172973825995483, 0.09918298985331718, 0.086682219207997]",0.8201077149722249,0.8215215585302816,0.7140714796104595,0.9591756607999462,0.0002351482010605685
Harry S. Truman,Korean War Report,193  - Special Message to the Congress Reporting on the Situation in Korea.,1950-07-19,Written,16,2,32,33,"In response to urgent appeals from the Government of Korea, General MacArthur was immediately authorized to send supplies of ammunition to the Korean defenders. These supplies were sent by air transport, with fighter protection.",2,34,0.1024835873737004,0.09814713571352925,0.0996779044401593,0.09540475927382625,0.08199315063088301,-0.12600373456509195,-0.00862150161862988,-0.02099823671159833,-0.10490695841005636,-0.16056831645416866,1.5,6.391705618420474e-05,0.00442875511458761,"[0.1024835873737004, 0.09814713571352925, 0.0996779044401593, 0.09540475927382625, 0.08199315063088301]",0.7848141463451134,0.8002063658469515,0.7639282593128708,0.9563151749398823,-0.0020989895895309647
Harry S. Truman,Korean War Report,193  - Special Message to the Congress Reporting on the Situation in Korea.,1950-07-19,Written,17,2,34,35,"The United States Seventh Fleet was ordered north from the Philippines, so that it might be available in the area in case of need. Throughout Monday, June 26th, the invaders continued their attack with no heed to the resolution of the Security Council of the United Nations.",2,47,0.07636857680737952,0.0737451733030849,0.06973098849417066,0.0681539761894626,0.04612635461607665,-0.11865491072265989,-0.09697380939448401,-0.07065780799157269,-0.01609951037058181,-0.028947521615641934,2.0,0.00014440338109798496,0.0019040502525192748,"[0.07636857680737952, 0.0737451733030849, 0.06973098849417066, 0.0681539761894626, 0.04612635461607665]",0.8219284011841775,0.8154138619317055,0.7413751239778347,0.9684646026452814,-0.0007420422573098384
Harry S. Truman,Korean War Report,193  - Special Message to the Congress Reporting on the Situation in Korea.,1950-07-19,Written,18,2,36,37,"Accordingly, in order to support the resolution, and on the unanimous advice of our civil and military authorities, I ordered United States air and sea forces to give the Korean Government troops cover and support. On Tuesday, June 27th, when the United Nations Commission in Korea had reported that the northern troops had neither ceased hostilities nor withdrawn to the thirty-eighth parallel, the United Nations Security Council met again and passed a second resolution recommending that members of the United Nations furnish to the Republic of Korea such aid as might be necessary to repel the attack and to restore international peace and security in the area.",2,107,0.08921632968852451,0.07880364637870281,0.08458937665389141,0.0958649677959647,0.05818699786033384,-0.058120419438836175,-0.004601294301812144,-0.024928061871593448,0.033212108219211445,0.006822205665527416,3.0,0.00020651600149826672,0.0011791758792687084,"[0.08921632968852451, 0.07880364637870281, 0.08458937665389141, 0.0958649677959647, 0.05818699786033384]",0.7861561816385677,0.8126195962644953,0.7949489991875675,0.9745278523181752,-0.0018575087033979448
Harry S. Truman,Korean War Report,193  - Special Message to the Congress Reporting on the Situation in Korea.,1950-07-19,Written,19,2,38,39,"The representative of the Soviet Union to the Security Council stayed away from this meeting also, and the Soviet Government has refused to support the Council's resolution. The vigorous and unhesitating actions of the United Nations and the United States in the face of this aggression met with an immediate and overwhelming response throughout the free world.",2,57,0.0725639777405857,0.08646284693322386,0.09142950534457742,0.096635709714517,0.06254835461865493,-0.06507383377278654,-0.01320896625499663,-0.0093532995205282,0.01353529225191212,0.0643818040139023,6.25,0.00019760393337942345,0.002201473465700692,"[0.0725639777405857, 0.08646284693322386, 0.09142950534457742, 0.096635709714517, 0.06254835461865493]",0.7370247836352368,0.8416280979208054,0.8146894335407875,0.9745422909370103,0.0007295994097666347
Harry S. Truman,Korean War Report,193  - Special Message to the Congress Reporting on the Situation in Korea.,1950-07-19,Written,20,2,40,41,"The first blow of aggression had brought dismay and anxiety to the hearts of men the world over. The fateful events of the 1930's, when aggression unopposed bred more aggression and eventually war, were fresh in our memory.",2,38,0.11656808051212865,0.09594341578482626,0.10539880210484545,0.07923368155422993,0.1331402609267717,-0.11540539962612585,-0.07876047396799635,-0.12119305232933279,-0.24325460029366938,-0.19203719813538686,3.5,0.00041654851460864594,0.004391289623240591,"[0.11656808051212865, 0.09594341578482626, 0.10539880210484545, 0.07923368155422993, 0.1331402609267717]",0.7326870993835081,0.7067650013716762,0.7188096604973038,0.8785151583962167,-0.005973060108876424
Harry S. Truman,Korean War Report,193  - Special Message to the Congress Reporting on the Situation in Korea.,1950-07-19,Written,21,2,42,43,But the free nations had learned the lesson of history. Their determined and united actions uplifted the spirit of free men everywhere.,2,22,0.09758029020013322,0.12517608169418645,0.08613658536172816,0.07892486638170201,0.08892435607236922,0.06515078635667816,0.13648039919313865,0.12412909079983817,0.12053957240340307,0.20572336624869383,5.0,0.0003226325637335176,0.0025261482163129474,"[0.09758029020013322, 0.12517608169418645, 0.08613658536172816, 0.07892486638170201, 0.08892435607236922]",0.8034861211777858,0.8333994531197227,0.6729649679088597,0.9406698524765745,0.003543617052524095
Harry S. Truman,Korean War Report,193  - Special Message to the Congress Reporting on the Situation in Korea.,1950-07-19,Written,22,2,44,45,"As a result, where there had been dismay there is hope; where there had been anxiety there is firm determination. Fifty-two of the fifty-nine member nations have supported the United Nations action to restore peace in Korea.",2,37,0.09339870354822852,0.08000343173382629,0.08437388226501377,0.08031578240744831,0.06379478058629855,0.08807740708451585,0.11389781483222662,0.09925472944647946,0.13349031995781996,0.020276141518737627,6.5,0.00011516328304149353,0.0018520708694242873,"[0.09339870354822852, 0.08000343173382629, 0.08437388226501377, 0.08031578240744831, 0.06379478058629855]",0.8063747881860246,0.7864199343680696,0.7562442887080874,0.9562712174766548,-0.002600237505485707
Harry S. Truman,Korean War Report,193  - Special Message to the Congress Reporting on the Situation in Korea.,1950-07-19,Written,23,2,46,47,"A number of member nations have offered military support or other types of assistance for the United Nations action to repel the aggressors in Korea. In a third resolution, passed on July 7th, the Security Council requested the United States to designate a commander for all the forces of the members of the United Nations in the Korean operation, and authorized these forces to fly the United Nations flag.",2,69,0.07191936604644661,0.07983072898189841,0.08107325026194259,0.10465717821927217,0.054019748917716326,-0.06767044357055932,-0.033960513461751475,-0.04584308635898393,0.02199921521284763,0.0334695843166192,5.0,0.0003337444935417491,0.001936344884808225,"[0.07191936604644661, 0.07983072898189841, 0.08107325026194259, 0.10465717821927217, 0.054019748917716326]",0.7400063064839915,0.8540405253412083,0.828064821081394,0.986270231591898,0.0009014887598910379
Harry S. Truman,Korean War Report,193  - Special Message to the Congress Reporting on the Situation in Korea.,1950-07-19,Written,24,2,48,49,"In response to this resolution, General MacArthur has been designated as commander of these forces. These are important steps forward in the development of a United Nations system of collective security.",2,31,0.07907106327602396,0.0652031902803031,0.0862438894623282,0.09217696956643441,0.06720371566026258,0.014426418331258229,0.021732596322658948,-0.030887283650406716,0.009920634272936145,0.02304741600602945,14.0,0.00013760285087443538,0.0004928994436297028,"[0.07907106327602396, 0.0652031902803031, 0.0862438894623282, 0.09217696956643441, 0.06720371566026258]",0.7320933714130854,0.7826785531546564,0.8340919434355238,0.9561777289435466,-0.00266735640511704
Harry S. Truman,Korean War Report,193  - Special Message to the Congress Reporting on the Situation in Korea.,1950-07-19,Written,25,2,50,51,"Already, aircraft of two nations--Australia and Great Britain--and naval vessels of five nations--Australia, Canada, Great Britain, the Netherlands and New Zealand--have been made available for operations in the Korean area, along with forces of Korea and the United States, under General MacArthur's command. The other offers of assistance that have been and will continue to be made will be coordinated by the United Nations and by the unified command, in order to support the effort in Korea to maximum advantage.",2,80,0.09259524193564345,0.108645585649827,0.09684320594516475,0.08403744925070222,0.060648892713125936,0.02500432274437873,0.05159059673409974,0.06426368846736183,0.10448494787688734,0.046494782548280295,1.5,0.0003219521572107068,0.0008653933677833102,"[0.09259524193564345, 0.108645585649827, 0.09684320594516475, 0.08403744925070222, 0.060648892713125936]",0.8116330472994049,0.8337949602551007,0.7242354803998123,0.9649041236956,0.0009140712626778784
Harry S. Truman,Korean War Report,193  - Special Message to the Congress Reporting on the Situation in Korea.,1950-07-19,Written,26,2,52,53,All the members of the United Nations who have indorsed the action of the Security Council realize the significance of the step that has been taken. This united and resolute action to put down lawless aggression is a milestone toward the establishment of a rule of law among nations.,2,49,0.08006163276635975,0.09554670276882558,0.09162427034372057,0.09953181132847085,0.07162506294987611,-0.07630539384779211,-0.05259381263631304,-0.033610815492377974,-0.011763042266541056,0.05903369195862614,3.2,0.0001334270534049244,0.0026714081351707306,"[0.08006163276635975, 0.09554670276882558, 0.09162427034372057, 0.09953181132847085, 0.07162506294987611]",0.7502677226120642,0.8448335766581148,0.7945674727347369,0.9730729128060437,0.0012304960262377838
